Date	Event	Region	Country	Cancellation Note
2023-03-11	Achill Greenway parkrun	Ireland	Ireland	snow and ice forecast
2023-03-11	Aggeneys parkrun	Northern Cape	South Africa	Community unavailable
2023-04-01	Albert parkrun, Melbourne	Victoria	Australia	Grand Prix - entire park closed
2023-03-11	Albert parkrun, Middlesbrough	North East England	United Kingdom	Unsafe due to ice.
2023-03-11	Alberton Ascot parkrun	Victoria	Australia	Prison operational matters
2023-03-18	Alberton Ascot parkrun	Victoria	Australia	Staffing issues
2023-03-11	Alderford Lake parkrun	West Midlands	United Kingdom	Dangerous on-course conditions
2023-04-15	Alderley Park parkrun	North West England	United Kingdom	Alderley Park Farm Weekend taking place
2023-04-22	Alderley Park parkrun	North West England	United Kingdom	conquer fitness event taking place
2023-04-01	Alice Holt parkrun	South East England	United Kingdom	Charity event taking place!
2023-03-11	Allerpark parkrun	Germany	Germany	Schnee, Matsch und Eis auf den Wegen
2023-03-12	Alyn Waters junior parkrun	Wales	United Kingdom	Weather Conditions
2023-03-11	Armagh parkrun	Northern Ireland	United Kingdom	Snow and Ice on course
2023-03-11	Armley parkrun	Yorkshire and the Humber	United Kingdom	Compacted snow on course likely to become ice
2023-03-18	Arrow Rest parkrun	North West	South Africa	om die dam
2023-03-11	Arrow Valley parkrun	West Midlands	United Kingdom	Fallen tree on course and very high risk of ice
2023-03-11	Ashbourne Recreation Ground parkrun	East Midlands	United Kingdom	Frozen - So we've Let it Go
2023-03-11	Ashford parkrun	South East England	United Kingdom	Holi Festival in the park, Vehicles on Course
2023-05-06	Ashford parkrun	South East England	United Kingdom	Coronation Event in Victoria Park
2023-03-11	Aspen parkrun	USA	United States	Winter Pause
2023-03-18	Aspen parkrun	USA	United States	Winter Pause
2023-03-25	Aspen parkrun	USA	United States	Winter Pause
2023-05-06	Australian Standing Stones parkrun	New South Wales	Australia	The Australian Celtic Festival is on this weekend
2023-03-19	Avenham Park junior parkrun	North West England	United Kingdom	no available Run Directors
2023-08-13	Avenham Park junior parkrun	North West England	United Kingdom	Ribble Runfest using the park
2023-03-11	Avery Beach parkrun, Huntsville	Ontario	Canada	Winter Pause
2023-03-18	Avery Beach parkrun, Huntsville	Ontario	Canada	Winter Pause
2023-03-25	Avery Beach parkrun, Huntsville	Ontario	Canada	Winter Pause
2023-03-11	Aylesbury parkrun	South East England	United Kingdom	Flooded and icy paths on both courses
2023-03-11	Ballinamore Greenway parkrun	Ireland	Ireland	Overnight snow made course unsafe
2023-03-11	Bambra Bolinda parkrun	Victoria	Australia	Prison operational matters
2023-03-18	Bambra Bolinda parkrun	Victoria	Australia	Staffing issues
2023-03-11	Barberton parkrun	Kruger Lowveld	South Africa	Current course abandoned-moving to new course soon
2023-03-18	Barberton parkrun	Kruger Lowveld	South Africa	Current course abandoned-moving to new course soon
2023-04-23	Barking and Dagenham junior parkrun	Greater London	United Kingdom	Core team unavailable due to TCS London Marathon
2023-06-17	Barking parkrun	Greater London	United Kingdom	Festival in park - course unusable
2023-03-12	Barnsley junior parkrun	Yorkshire and the Humber	United Kingdom	due to icy conditions and fallen trees
2023-03-11	Barnsley parkrun	Yorkshire and the Humber	United Kingdom	due to icy conditions
2023-03-11	Barton Trail parkrun	Ontario	Canada	Winter Pause
2023-03-18	Barton Trail parkrun	Ontario	Canada	Winter Pause
2023-03-25	Barton Trail parkrun	Ontario	Canada	Winter Pause
2023-03-12	Battery Park junior parkrun	Scotland	United Kingdom	Other event taking place in the park
2023-03-11	Beacon Hill Country Park parkrun	East Midlands	United Kingdom	Carparks and paths very frozen
2023-03-11	Beacon parkrun	West Midlands	United Kingdom	Freezing conditions forecast, creating ice on path
2023-03-11	Beatrixpark parkrun	Netherlands	Netherlands	New temporary course not yet approved
2023-03-12	Beaumont Park junior parkrun	Yorkshire and the Humber	United Kingdom	Due to there still being snow and ice in the park
2023-03-11	Beckton parkrun	Greater London	United Kingdom	Police incident in the park on the course
2023-03-11	Bedworth parkrun	West Midlands	United Kingdom	Perfect for ice skating not for parkrunning
2023-11-11	Bedworth parkrun	West Midlands	United Kingdom	Bedworth Armistice Parade
2023-03-11	Belfast Victoria parkrun	Northern Ireland	United Kingdom	Adverse weather conditions
2023-03-11	Bellevue parkrun	Ontario	Canada	Winter Pause
2023-03-18	Bellevue parkrun	Ontario	Canada	Winter Pause
2023-03-25	Bellevue parkrun	Ontario	Canada	Winter Pause
2023-03-11	Belvoir Castle parkrun	East Midlands	United Kingdom	Another event taking part in the Castle Grounds.
2023-03-18	Berkeley Green parkrun	South West England	United Kingdom	another event - this town ain't big enough punk!
2023-03-18	Birdsland Reserve parkrun	Victoria	Australia	Total Fire Ban - course closed to the public
2023-05-20	Birkenhead parkrun	North West England	United Kingdom	Race for Life in the park
2023-03-11	Blackhill parkrun	North East England	United Kingdom	Course currently covered in snow and ice.
2023-03-19	Blickling junior parkrun	East of England	United Kingdom	Course clash with Blickling Half Marathon
2023-04-08	Blue Lagoon parkrun	KZN · Coastal	South Africa	Easter weekend - route unsafe
2023-03-12	Bodington junior parkrun	Yorkshire and the Humber	United Kingdom	Venue closed due to snow and forecast of ice on Su
2023-04-16	Bognor Regis junior parkrun	South East England	United Kingdom	Football Event at venue
2023-04-30	Bognor Regis junior parkrun	South East England	United Kingdom	Football event at venue
2023-05-14	Bognor Regis junior parkrun	South East England	United Kingdom	Local 10K Event
2023-06-11	Bognor Regis junior parkrun	South East England	United Kingdom	Football event at venue
2023-06-25	Bognor Regis junior parkrun	South East England	United Kingdom	Football event at venue
2023-03-18	Bognor Regis parkrun	South East England	United Kingdom	work being carried out in the Park affecting route
2023-03-11	Bowling Park parkrun	Yorkshire and the Humber	United Kingdom	Thick snow on route and forecast icy conditions
2023-03-11	Bradford parkrun	Yorkshire and the Humber	United Kingdom	paths still snow covered and forecast very icy
2023-03-11	Braidwood Showground parkrun	New South Wales	Australia	Works being done at showground; cannot use course
2023-03-18	Braidwood Showground parkrun	New South Wales	Australia	Works being done at showground; cannot use course
2023-03-25	Braidwood Showground parkrun	New South Wales	Australia	Works being done at showground; cannot use course
2023-04-01	Braidwood Showground parkrun	New South Wales	Australia	Works being done at showground. Cannot use course.
2023-04-08	Braidwood Showground parkrun	New South Wales	Australia	Works being done at showground; cannot use course
2023-04-15	Braidwood Showground parkrun	New South Wales	Australia	Works being done at showground. Cannot use course.
2023-04-22	Braidwood Showground parkrun	New South Wales	Australia	Works being done at showground. Cannot use course.
2023-04-29	Braidwood Showground parkrun	New South Wales	Australia	Works being done at showground. Cannot use course.
2023-03-11	Bramhall parkrun	North West England	United Kingdom	Ice on course makes it dangerous.
2023-03-12	Bramley junior parkrun	Yorkshire and the Humber	United Kingdom	Paths are too icy, unsafe.
2023-03-11	Bramley parkrun	Yorkshire and the Humber	United Kingdom	Adverse winter conditions
2023-03-11	Brecksville Reservation parkrun	USA	United States	Winter Pause
2023-03-18	Brecksville Reservation parkrun	USA	United States	Winter Pause
2023-03-25	Brecksville Reservation parkrun	USA	United States	Winter Pause
2023-05-20	Brentwood parkrun	East of England	United Kingdom	Race For Life taking place in park
2023-03-11	Bressay parkrun	Scotland	United Kingdom	Adverse weather conditions - snow and ice
2023-03-11	Brierley Forest parkrun	East Midlands	United Kingdom	Freezing snowfall and icy paths.
2023-03-11	Brighouse parkrun	Yorkshire and the Humber	United Kingdom	Ice/snow on the course
2023-03-12	Broadmeadow junior parkrun	Northern Ireland	United Kingdom	Course flooded
2023-05-20	Brockwell parkrun, Herne Hill	Greater London	United Kingdom	Festival site blocks paths & uses briefing area
2023-05-27	Brockwell parkrun, Herne Hill	Greater London	United Kingdom	Festival site blocks paths & uses briefing area
2023-06-03	Brockwell parkrun, Herne Hill	Greater London	United Kingdom	Festival site blocks paths & uses briefing area
2023-06-10	Brockwell parkrun, Herne Hill	Greater London	United Kingdom	Festival site blocks paths & uses briefing area
2023-10-07	Brooklands parkrun	South East England	United Kingdom	Funfair on park
2023-10-14	Brooklands parkrun	South East England	United Kingdom	Funfair on park
2023-03-11	Brundall parkrun	East of England	United Kingdom	park is boggy & wet Grass paths are unusable
2023-03-11	Bryn Bach parkrun	Wales	United Kingdom	Ice on course
2023-03-11	Burnley parkrun	North West England	United Kingdom	Too many icy patches on the course
2023-03-11	Bury St Edmunds parkrun	East of England	United Kingdom	on advice from park ranger due to severe flooding.
2023-05-13	Camperdown parkrun, Dundee	Scotland	United Kingdom	BBC One Big Weekend Event Preparation
2023-05-20	Camperdown parkrun, Dundee	Scotland	United Kingdom	BBC One Big Weekend Event Preparation
2023-05-27	Camperdown parkrun, Dundee	Scotland	United Kingdom	BBC One Big Weekend Event
2023-03-11	Cannock Chase parkrun	West Midlands	United Kingdom	Poor Weather Conditions
2023-03-12	Cannon Hill junior parkrun, Birmingham	West Midlands	United Kingdom	St Patrick’s Day Cultural Festival
2023-05-07	Cannon Hill junior parkrun, Birmingham	West Midlands	United Kingdom	Birmingham half marathon route through the course
2023-03-11	Cannon Hill parkrun, Birmingham	West Midlands	United Kingdom	Icy conditions so course is unsafe for the event
2023-03-11	Canterbury parkrun	South East England	United Kingdom	Icy conditions
2023-03-11	Canyon Rim Trail parkrun	USA	United States	No participants showed - weather- conflict event
2023-03-12	Carlisle junior parkrun	North West England	United Kingdom	Carlisle Half/10k using same paths at same time
2023-03-11	Carrickfergus parkrun	Northern Ireland	United Kingdom	ice on the course, unsafe
2023-03-12	Castle Playing Fields junior parkrun	East of England	United Kingdom	Water logged on course, unsafe if freezes
2023-03-11	Castlewellan parkrun	Northern Ireland	United Kingdom	Course unsafe after heavy snowfall.
2023-03-25	Centennial parkrun	New South Wales	Australia	Knotfest Music Festival in Centennial Park
2023-04-16	Central Park junior parkrun, Boston	East Midlands	United Kingdom	The park is being used for Boston Marathon
2023-03-11	Centre Vale parkrun	Yorkshire and the Humber	United Kingdom	Snow and ice in park
2023-03-25	Champion Lakes parkrun	Western Australia	Australia	Venue unavailable due to National Event at Lake
2023-04-01	Champion Lakes parkrun	Western Australia	Australia	Venue unavailable due to National Event at Lake
2023-06-10	Charlton parkrun	Greater London	United Kingdom	Event taking place in the park; key paths unusable
2023-03-11	Chasewater parkrun	West Midlands	United Kingdom	Snow and ice on course
2023-06-10	Chasewater parkrun	West Midlands	United Kingdom	Set up for Ironman event on 11 June
2023-04-02	Cheddar junior parkrun	South West England	United Kingdom	The field is being used for Cheddar triathlon
2023-03-11	Chevin Forest parkrun	Yorkshire and the Humber	United Kingdom	minus temperatures overnight will freeze - unsafe
2023-03-11	Chippenham Playing Fields parkrun, Monmouth	Wales	United Kingdom	Ice on course - suitable for penguins only
2023-05-28	Chippenham junior parkrun	South West England	United Kingdom	Folk Festival, park used for camping
2023-03-11	Chopwell Wood parkrun	North East England	United Kingdom	Course not safe due to snow and ice
2023-04-01	Christiana parkrun	North West	South Africa	No volunteers available to make the parkrun happen
2023-04-08	Christiana parkrun	North West	South Africa	No volunteers available to make the parkrun happen
2023-03-11	Churchill Parkway parkrun	Manitoba	Canada	Construction on event route: key path blocked and
2023-06-24	Cirencester parkrun	South West England	United Kingdom	Major event at the University, route unusable
2023-03-11	Clacton Seafront parkrun	East of England	United Kingdom	Council works happening on the course not safe
2023-03-12	Clacton junior parkrun	South East England	United Kingdom	Works on the course preventing safe run
2023-03-11	Clare Castle parkrun	East of England	United Kingdom	Route flooded
2023-03-18	Clermont Waterfront parkrun	USA	United States	Area in use by city
2023-04-22	Clermont Waterfront parkrun	USA	United States	City using park
2023-03-11	Cliffe Castle parkrun	Yorkshire and the Humber	United Kingdom	Snow and ice in the park
2023-03-18	Clifton parkrun	East Midlands	United Kingdom	Uninvited visitors
2023-03-18	Clonakilty parkrun	Ireland	Ireland	Due to the West Cork rally
2023-03-11	Cloncurry parkrun	Queensland	Australia	wet westher
2023-03-18	Clonmel parkrun	Ireland	Ireland	Course flooded
2023-03-11	Cobaw Clunes parkrun	Victoria	Australia	Prison operational matters
2023-03-18	Cobaw Clunes parkrun	Victoria	Australia	Staffing issues
2023-05-06	Colchester Castle parkrun	East of England	United Kingdom	Coronation event in the park. Heightened security.
2023-03-11	Colin Glen parkrun	Northern Ireland	United Kingdom	Adverse weather conditions - paths unsafe.
2023-06-10	Colwick parkrun	East Midlands	United Kingdom	Detonate Festival
2023-03-11	Comber parkrun	Northern Ireland	United Kingdom	Ice on the course, making it unsafe.
2023-05-07	Community Park junior parkrun	Yorkshire and the Humber	United Kingdom	Council need early access to set up for an event.
2023-03-11	Con Smith parkrun	Ireland	Ireland	Course and Weather Conditions
2023-03-11	Concord parkrun, Sheffield	Yorkshire and the Humber	United Kingdom	Too risky to go ahead
2023-03-11	Conyngham Hall parkrun	Yorkshire and the Humber	United Kingdom	Paths and trails too icy for safety
2023-03-12	Cotlands Park junior parkrun	Scotland	United Kingdom	Unable to access kit/facilities on day of the even
2023-05-28	Cottenham Recreation Ground junior parkrun	East of England	United Kingdom	football tournament - field to be used for parking
2023-03-11	Cradock parkrun	EC · Inland	South Africa	Event Closed
2023-03-18	Cradock parkrun	EC · Inland	South Africa	Event Closed
2023-03-26	Cranleigh junior parkrun	South East England	United Kingdom	14/21 Race happening along Knowle Lane
2023-03-11	Cranleigh parkrun	South East England	United Kingdom	Continuing redevelopment of park
2023-03-18	Cranleigh parkrun	South East England	United Kingdom	Continuing redevelopment of park
2023-03-25	Cranleigh parkrun	South East England	United Kingdom	Continuing redevelopment of park
2023-04-01	Cranleigh parkrun	South East England	United Kingdom	Final stages of park redevelopment
2023-04-08	Cranleigh parkrun	South East England	United Kingdom	Final stages of park redevelopment
2023-04-15	Cranleigh parkrun	South East England	United Kingdom	Final stages of park redevelopment
2023-04-22	Cranleigh parkrun	South East England	United Kingdom	Final stages of park redevelopment
2023-04-29	Cranleigh parkrun	South East England	United Kingdom	Final stages of park redevelopment
2023-05-06	Cranleigh parkrun	South East England	United Kingdom	Final stages of park redevelopment
2023-05-13	Cranleigh parkrun	South East England	United Kingdom	Final stages of park redevelopment
2023-05-20	Cranleigh parkrun	South East England	United Kingdom	Final stages of park redevelopment
2023-03-12	Cross Flatts junior parkrun	Yorkshire and the Humber	United Kingdom	Due to the weather & parts of the course being icy
2023-03-11	Cross Flatts parkrun	Yorkshire and the Humber	United Kingdom	Extreme weather forecast for freezing conditions
2023-03-11	Croxteth Hall parkrun	North West England	United Kingdom	Risk of ice on route, yellow weather warning
2023-03-11	Dalby Forest parkrun	Yorkshire and the Humber	United Kingdom	Snowy and icy conditions
2023-03-11	Dallas Burston Polo Club parkrun	West Midlands	United Kingdom	Ice Ice Baby
2023-04-08	Dallas Burston Polo Club parkrun	West Midlands	United Kingdom	Polo Championship taking place
2023-04-29	Dallas Burston Polo Club parkrun	West Midlands	United Kingdom	Polo Championship taking place
2023-05-06	Dallas Burston Polo Club parkrun	West Midlands	United Kingdom	Polo Championship taking place
2023-05-20	Dallas Burston Polo Club parkrun	West Midlands	United Kingdom	Polo Championship taking place
2023-06-17	Dallas Burston Polo Club parkrun	West Midlands	United Kingdom	Polo Championship taking place
2023-07-15	Dallas Burston Polo Club parkrun	West Midlands	United Kingdom	Polo Championship taking place
2023-07-22	Dallas Burston Polo Club parkrun	West Midlands	United Kingdom	Polo Championship taking place
2023-08-26	Dallas Burston Polo Club parkrun	West Midlands	United Kingdom	Polo Championship taking place
2023-09-02	Dallas Burston Polo Club parkrun	West Midlands	United Kingdom	Polo Championship taking place
2023-09-30	Dallas Burston Polo Club parkrun	West Midlands	United Kingdom	Polo Championship taking place
2023-03-11	Darlington South Park parkrun	North East England	United Kingdom	Icy paths - Unsafe to hold our event
2023-03-11	Darndale parkrun	Ireland	Ireland	Flooding on Key Pathways.
2023-04-23	Dartford junior parkrun	South East England	United Kingdom	St George's day parade taking place in the park
2023-03-11	Daventry parkrun	East Midlands	United Kingdom	Extreme weather conditions making route dangerous
2023-04-15	Deep Run parkrun	USA	United States	Another event in the park
2023-04-22	Deep Run parkrun	USA	United States	Another event in the park
2023-04-29	Deep Run parkrun	USA	United States	Another event in the park
2023-05-06	Deep Run parkrun	USA	United States	Another event in the park
2023-03-11	Deerpark Forest parkrun, Virginia	Ireland	Ireland	Dangerous levels of ice on the course
2023-03-11	Deerpark parkrun, Carlanstown	Ireland	Ireland	Water on track now, Status yellow ice until 10am.
2023-03-11	Delamere parkrun	North West England	United Kingdom	slush & meltwater likely to freeze overnight
2023-03-11	Derrynoid Forest parkrun	Northern Ireland	United Kingdom	Due to the upgrading of paths and carparking
2023-03-18	Derrynoid Forest parkrun	Northern Ireland	United Kingdom	Due to the upgrading of paths and carparking
2023-03-11	Devils Peak parkrun	South Australia	Australia	Security Operation
2023-03-11	Dewsbury parkrun	Yorkshire and the Humber	United Kingdom	high risk of icy paths
2023-03-11	Didcot parkrun	South East England	United Kingdom	Hatwell & Williams Amusements Fair - park unusable
2023-03-18	Didcot parkrun	South East England	United Kingdom	Hatwell & Williams Amusements Fair - park unusable
2023-03-11	Donaupark parkrun	Austria	Austria	Severe wind predicted with extreme gusts
2023-03-11	Downham Market Academy parkrun	East of England	United Kingdom	Weather concerns will affect safety of runners
2023-03-18	Drumblade parkrun	GP · Sedibeng	South Africa	Property not available
2023-03-11	Drumpellier Country parkrun	Scotland	United Kingdom	Paths covered in sheets of ice and snow.
2023-03-12	Drumpellier junior parkrun	Scotland	United Kingdom	Snow/ice of course
2023-03-18	Dubbo parkrun	New South Wales	Australia	Mud Run event in the park, key paths unusable
2023-03-11	Duffins Trail parkrun	Ontario	Canada	Trail Conditions
2023-03-11	Dungannon Park parkrun	Northern Ireland	United Kingdom	Ice and further poor weather forecasted
2023-03-11	Dunleath Playing Fields parkrun	Northern Ireland	United Kingdom	Adverse weather conditions
2023-06-04	Duthie junior parkrun	Scotland	United Kingdom	Kiltwalk in the park starting at 9 and 9.30am.
2023-03-11	Eagan parkrun	USA	United States	Snow ice
2023-03-11	East Coast Park parkrun	Singapore	Singapore	Roadworks on course causing obstruction
2023-03-18	East Coast Park parkrun	Singapore	Singapore	Works in park obstructing course.
2023-03-11	East Park parkrun	West Midlands	United Kingdom	Course unsafe due to very icy conditions
2023-03-12	Eastbourne junior parkrun	South East England	United Kingdom	Lack of volunteers
2023-03-11	Edenbrook Country parkrun	South East England	United Kingdom	Water water everywhere and not a drop to drink
2023-03-11	Edwin Carolan Community parkrun	Ireland	Ireland	Coirse unsafe due to bad weather
2023-03-11	Ekebergsletta parkrun	Norway	Norway	Winter Pause
2023-03-18	Ekebergsletta parkrun	Norway	Norway	Winter Pause
2023-03-25	Ekebergsletta parkrun	Norway	Norway	Winter Pause
2023-03-11	Ellesmere Port parkrun	North West England	United Kingdom	Ice expected: freezing temperatures overnight
2023-03-11	Ellon parkrun	Scotland	United Kingdom	snow and ice on paths
2023-03-11	Endcliffe parkrun	Yorkshire and the Humber	United Kingdom	Snow and ice on course
2023-03-11	Erddig parkrun	Wales	United Kingdom	Erddig NT closed due to weather coditions
2023-04-08	Erddig parkrun	Wales	United Kingdom	Erddig NT have another event that day.
2023-03-11	Evergreen parkrun	USA	United States	Snowy/icy conditions predicted; trail unsafe.
2023-03-12	Evesham junior parkrun	West Midlands	United Kingdom	Localized flooding
2023-03-11	Evesham parkrun	West Midlands	United Kingdom	Course flooded alternative routes also flooded.
2023-03-11	Falls parkrun, Belfast	Northern Ireland	United Kingdom	Adverse weather
2023-03-11	Feltham parkrun	South East England	United Kingdom	ice, unsafe path
2023-03-11	Festningen parkrun	Norway	Norway	Not enough Volunteers
2023-04-09	Fife Cycle Park junior parkrun	Scotland	United Kingdom	Cycling event being held on track
2023-04-15	Finsbury parkrun	Greater London	United Kingdom	Tough Mudder starts at 8.45am and uses same route
2023-03-11	Flatts Lane parkrun	North East England	United Kingdom	Due to the amount of snow and ice at Flatts Lane
2023-03-25	Flegg High parkrun	East of England	United Kingdom	Easter fayre at the school
2023-06-03	Folkestone parkrun	South East England	United Kingdom	King's Coronation events on the Leas
2023-08-19	Folkestone parkrun	South East England	United Kingdom	Folkestone Festival events on the Leas
2023-03-11	Fountains Abbey parkrun	Yorkshire and the Humber	United Kingdom	Site closed - weather conditions
2023-03-11	Frickley Country parkrun	Yorkshire and the Humber	United Kingdom	Ice on course
2023-03-11	Fuldaaue parkrun	Germany	Germany	Teil der Strecke wegen Hochwasser gesperrt
2023-03-11	Garvagh Forest parkrun	Northern Ireland	United Kingdom	Snow and ice underfoot.  Paths unusable
2023-04-15	Garvey Park parkrun	Western Australia	Australia	Kid’z Fest
2023-05-20	Garvey Park parkrun	Western Australia	Australia	Cyclocross event
2023-03-11	Gedling parkrun	East Midlands	United Kingdom	Too much ice
2023-04-29	Geographe Bay parkrun	Western Australia	Australia	due to Busselton 100 event
2023-03-11	George Lane Memorial parkrun	Alberta	Canada	Poor Weather Conditions
2023-03-11	Gladstone QLD parkrun	Queensland	Australia	Both A and B course flooded
2023-03-11	Glossop parkrun	East Midlands	United Kingdom	Snow, and a tree fallen across the route
2023-03-12	Gnoll junior parkrun	Wales	United Kingdom	Not enough volunteers to hold the event safely.
2023-03-25	Goondiwindi parkrun	Queensland	Australia	HOTW weekend
2023-04-27	Gracepoint parkrun	GP · Greater Joburg	South Africa	Core volunteers travelling over the long weekend
2023-03-12	Graves junior parkrun	Yorkshire and the Humber	United Kingdom	Snow and Ice causing unsafe conditions
2023-03-11	Graves parkrun	Yorkshire and the Humber	United Kingdom	Paths unsafe due to heavy snow and ice
2023-03-12	Great Cornard junior parkrun	East of England	United Kingdom	Waterlogged Course
2023-03-11	Great Cornard parkrun	East of England	United Kingdom	WEATHER, SATURATED GROUND
2023-05-27	Great Lines parkrun, Medway	South East England	United Kingdom	Event in the park
2023-03-11	Great Notley parkrun	East of England	United Kingdom	Ice on course
2023-03-11	Great Yarmouth North Beach parkrun	East of England	United Kingdom	Cycle Sportive event starts in same location
2023-03-11	Greenfield Valley parkrun	Wales	United Kingdom	Icy conditions.
2023-03-11	Greenpoint parkrun	WC · Greater Cape Town	South Africa	New course awaiting approval + cycle tour
2023-03-18	Greenpoint parkrun	WC · Greater Cape Town	South Africa	New course awaiting approval
2023-03-19	Griffeen junior parkrun	Ireland	Ireland	The weather forecast predicts bad weather
2023-05-07	Guildford junior parkrun	South East England	United Kingdom	Guildford Inflatable 5km Clear up
2023-06-11	Guildford junior parkrun	South East England	United Kingdom	Sausage and Cider Festival
2023-07-23	Guildford junior parkrun	South East England	United Kingdom	Race for Life in Park
2023-08-27	Guildford junior parkrun	South East England	United Kingdom	Legends Festival in park
2023-10-15	Guildford junior parkrun	South East England	United Kingdom	Oktoborfest
2023-06-10	Guildford parkrun	South East England	United Kingdom	Sausage and cider festival in Stoke Park
2023-07-22	Guildford parkrun	South East England	United Kingdom	Race for Life in Stoke Park
2023-08-26	Guildford parkrun	South East England	United Kingdom	the legends festival will be in the park
2023-10-14	Guildford parkrun	South East England	United Kingdom	Oktoberfest
2023-11-04	Guildford parkrun	South East England	United Kingdom	Fireworks in Stoke Park
2023-03-11	Guysborough Nature Trail parkrun	Nova Scotia	Canada	course conditions
2023-03-18	Guysborough Nature Trail parkrun	Nova Scotia	Canada	course conditions
