Date	Event	Region	Country	Cancellation Note
2023-04-01	Albert parkrun, Melbourne	Victoria	Australia	Grand Prix - entire park closed
2023-03-04	Alderley Park parkrun	North West England	United Kingdom	Planned removal of a tree close to the course
2023-04-15	Alderley Park parkrun	North West England	United Kingdom	Alderley Park Farm Weekend taking place
2023-04-22	Alderley Park parkrun	North West England	United Kingdom	conquer fitness event taking place
2023-04-01	Alice Holt parkrun	South East England	United Kingdom	Charity event taking place!
2023-03-11	Ashford parkrun	South East England	United Kingdom	Holi Festival in the park, Vehicles on Course
2023-05-06	Ashford parkrun	South East England	United Kingdom	Coronation Event in Victoria Park
2023-03-04	Aspen parkrun	USA	United States	Winter Pause
2023-03-11	Aspen parkrun	USA	United States	Winter Pause
2023-03-18	Aspen parkrun	USA	United States	Winter Pause
2023-03-25	Aspen parkrun	USA	United States	Winter Pause
2023-05-06	Australian Standing Stones parkrun	New South Wales	Australia	The Australian Celtic Festival is on this weekend
2023-08-13	Avenham Park junior parkrun	North West England	United Kingdom	Ribble Runfest using the park
2023-03-04	Avery Beach parkrun, Huntsville	Ontario	Canada	Winter Pause
2023-03-11	Avery Beach parkrun, Huntsville	Ontario	Canada	Winter Pause
2023-03-18	Avery Beach parkrun, Huntsville	Ontario	Canada	Winter Pause
2023-03-25	Avery Beach parkrun, Huntsville	Ontario	Canada	Winter Pause
2023-03-04	Barberton parkrun	Kruger Lowveld	South Africa	Current course abandoned-moving to new course soon
2023-03-11	Barberton parkrun	Kruger Lowveld	South Africa	Current course abandoned-moving to new course soon
2023-04-23	Barking and Dagenham junior parkrun	Greater London	United Kingdom	Core team unavailable due to TCS London Marathon
2023-03-04	Barton Trail parkrun	Ontario	Canada	Winter Pause
2023-03-11	Barton Trail parkrun	Ontario	Canada	Winter Pause
2023-03-18	Barton Trail parkrun	Ontario	Canada	Winter Pause
2023-03-25	Barton Trail parkrun	Ontario	Canada	Winter Pause
2023-03-12	Battery Park junior parkrun	Scotland	United Kingdom	Other event taking place in the park
2023-03-04	Beach Strip parkrun	Ontario	Canada	Adverse weather conditions overnight
2023-11-11	Bedworth parkrun	West Midlands	United Kingdom	Bedworth Armistice Parade
2023-03-04	Bellevue parkrun	Ontario	Canada	Winter Pause
2023-03-11	Bellevue parkrun	Ontario	Canada	Winter Pause
2023-03-18	Bellevue parkrun	Ontario	Canada	Winter Pause
2023-03-25	Bellevue parkrun	Ontario	Canada	Winter Pause
2023-03-11	Belvoir Castle parkrun	East Midlands	United Kingdom	Another event taking part in the Castle Grounds.
2023-03-18	Berkeley Green parkrun	South West England	United Kingdom	another event - this town ain't big enough punk!
2023-03-04	Berwick Springs parkrun	Victoria	Australia	Concrete footpath ripped up and detours
2023-05-20	Birkenhead parkrun	North West England	United Kingdom	Race for Life in the park
2023-03-19	Blickling junior parkrun	East of England	United Kingdom	Course clash with Blickling Half Marathon
2023-04-16	Bognor Regis junior parkrun	South East England	United Kingdom	Football Event at venue
2023-04-30	Bognor Regis junior parkrun	South East England	United Kingdom	Football event at venue
2023-05-14	Bognor Regis junior parkrun	South East England	United Kingdom	Local 10K Event
2023-06-11	Bognor Regis junior parkrun	South East England	United Kingdom	Football event at venue
2023-06-25	Bognor Regis junior parkrun	South East England	United Kingdom	Football event at venue
2023-03-04	Braidwood Showground parkrun	New South Wales	Australia	Works being done at showground; cannot use course
2023-03-11	Braidwood Showground parkrun	New South Wales	Australia	Works being done at showground; cannot use course
2023-03-18	Braidwood Showground parkrun	New South Wales	Australia	Works being done at showground; cannot use course
2023-03-25	Braidwood Showground parkrun	New South Wales	Australia	Works being done at showground; cannot use course
2023-04-01	Braidwood Showground parkrun	New South Wales	Australia	Works being done at showground. Cannot use course.
2023-04-08	Braidwood Showground parkrun	New South Wales	Australia	Works being done at showground. Cannot use course.
2023-04-15	Braidwood Showground parkrun	New South Wales	Australia	Works being done at showground. Cannot use course.
2023-04-22	Braidwood Showground parkrun	New South Wales	Australia	Works being done at showground. Cannot use course.
2023-04-29	Braidwood Showground parkrun	New South Wales	Australia	Works being done at showground. Cannot use course.
2023-03-04	Brakpan parkrun	GP · Ekurhuleni	South Africa	Sadly no volunteers and only Jillian the ED.
2023-03-04	Breakwater parkrun	Ontario	Canada	Weather - high amount of snow forecasted
2023-03-04	Brecksville Reservation parkrun	USA	United States	Winter Pause
2023-03-11	Brecksville Reservation parkrun	USA	United States	Winter Pause
2023-03-18	Brecksville Reservation parkrun	USA	United States	Winter Pause
2023-03-25	Brecksville Reservation parkrun	USA	United States	Winter Pause
2023-05-20	Brentwood parkrun	East of England	United Kingdom	Race For Life taking place in park
2023-03-11	Brierley Forest parkrun	East Midlands	United Kingdom	Freezing snowfall and icy paths.
2023-05-20	Brockwell parkrun, Herne Hill	Greater London	United Kingdom	Festival site blocks paths & uses briefing area
2023-05-27	Brockwell parkrun, Herne Hill	Greater London	United Kingdom	Festival site blocks paths & uses briefing area
2023-06-03	Brockwell parkrun, Herne Hill	Greater London	United Kingdom	Festival site blocks paths & uses briefing area
2023-06-10	Brockwell parkrun, Herne Hill	Greater London	United Kingdom	Festival site blocks paths & uses briefing area
2023-10-07	Brooklands parkrun	South East England	United Kingdom	Funfair on park
2023-10-14	Brooklands parkrun	South East England	United Kingdom	Funfair on park
2023-03-05	Cambourne junior parkrun	East of England	United Kingdom	Cambridge Half Marathon - Core team unavailable
2023-05-13	Camperdown parkrun, Dundee	Scotland	United Kingdom	BBC One Big Weekend Event Preparation
2023-05-20	Camperdown parkrun, Dundee	Scotland	United Kingdom	BBC One Big Weekend Event Preparation
2023-05-27	Camperdown parkrun, Dundee	Scotland	United Kingdom	BBC One Big Weekend Event
2023-03-12	Cannon Hill junior parkrun, Birmingham	West Midlands	United Kingdom	St Patrick’s Day Cultural Festival
2023-05-07	Cannon Hill junior parkrun, Birmingham	West Midlands	United Kingdom	Birmingham half marathon route through the course
2023-03-12	Carlisle junior parkrun	North West England	United Kingdom	Carlisle Half/10k using same paths at same time
2023-03-25	Centennial parkrun	New South Wales	Australia	Knotfest Music Festival in Centennial Park
2023-04-16	Central Park junior parkrun, Boston	East Midlands	United Kingdom	The park is being used for Boston Marathon
2023-03-04	Century City parkrun	WC · Greater Cape Town	South Africa	Century City Express race takes place on 4 March
2023-04-02	Cheddar junior parkrun	South West England	United Kingdom	The field is being used for Cheddar triathlon
2023-05-28	Chippenham junior parkrun	South West England	United Kingdom	Folk Festival, park used for camping
2023-04-08	Christiana parkrun	North West	South Africa	No volunteers available to make the parkrun happen
2023-03-04	Chuo koen parkrun	Japan	Japan	イベントディレクター、ボランティア不在のため中央公園parkrunはお休みです。
2023-06-24	Cirencester parkrun	South West England	United Kingdom	Major event at the University, route unusable
2023-03-18	Clermont Waterfront parkrun	USA	United States	Area in use by city
2023-03-04	Cloncurry parkrun	Queensland	Australia	Wet weather
2023-03-04	Cobram parkrun	Victoria	Australia	River flooding
2023-05-06	Colchester Castle parkrun	East of England	United Kingdom	Coronation event in the park. Heightened security.
2023-06-10	Colwick parkrun	East Midlands	United Kingdom	Detonate Festival
2023-05-07	Community Park junior parkrun	Yorkshire and the Humber	United Kingdom	Council need early access to set up for an event.
2023-03-12	Cotlands Park junior parkrun	Scotland	United Kingdom	Unable to access kit/facilities on day of the even
2023-05-28	Cottenham Recreation Ground junior parkrun	East of England	United Kingdom	football tournament - field to be used for parking
2023-03-04	Cradock parkrun	EC · Inland	South Africa	Event Closed
2023-03-11	Cradock parkrun	EC · Inland	South Africa	Event Closed
2023-03-18	Cradock parkrun	EC · Inland	South Africa	Event Closed
2023-03-26	Cranleigh junior parkrun	South East England	United Kingdom	14/21 Race happening along Knowle Lane
2023-03-04	Cranleigh parkrun	South East England	United Kingdom	Continuing redevelopment of park
2023-03-11	Cranleigh parkrun	South East England	United Kingdom	Continuing redevelopment of park
2023-03-18	Cranleigh parkrun	South East England	United Kingdom	Continuing redevelopment of park
2023-03-25	Cranleigh parkrun	South East England	United Kingdom	Continuing redevelopment of park
2023-04-01	Cranleigh parkrun	South East England	United Kingdom	Final stages of park redevelopment
2023-04-08	Cranleigh parkrun	South East England	United Kingdom	Final stages of park redevelopment
2023-04-15	Cranleigh parkrun	South East England	United Kingdom	Final stages of park redevelopment
2023-04-22	Cranleigh parkrun	South East England	United Kingdom	Final stages of park redevelopment
2023-04-29	Cranleigh parkrun	South East England	United Kingdom	Final stages of park redevelopment
2023-05-06	Cranleigh parkrun	South East England	United Kingdom	Final stages of park redevelopment
2023-05-13	Cranleigh parkrun	South East England	United Kingdom	Final stages of park redevelopment
2023-05-20	Cranleigh parkrun	South East England	United Kingdom	Final stages of park redevelopment
2023-04-08	Dallas Burston Polo Club parkrun	West Midlands	United Kingdom	Polo Championship taking place
2023-04-29	Dallas Burston Polo Club parkrun	West Midlands	United Kingdom	Polo Championship taking place
2023-05-06	Dallas Burston Polo Club parkrun	West Midlands	United Kingdom	Polo Championship taking place
2023-05-20	Dallas Burston Polo Club parkrun	West Midlands	United Kingdom	Polo Championship taking place
2023-06-17	Dallas Burston Polo Club parkrun	West Midlands	United Kingdom	Polo Championship taking place
2023-07-15	Dallas Burston Polo Club parkrun	West Midlands	United Kingdom	Polo Championship taking place
2023-07-22	Dallas Burston Polo Club parkrun	West Midlands	United Kingdom	Polo Championship taking place
2023-08-26	Dallas Burston Polo Club parkrun	West Midlands	United Kingdom	Polo Championship taking place
2023-09-02	Dallas Burston Polo Club parkrun	West Midlands	United Kingdom	Polo Championship taking place
2023-09-30	Dallas Burston Polo Club parkrun	West Midlands	United Kingdom	Polo Championship taking place
2023-03-04	Danehy Park parkrun	USA	United States	Course is unsafe due to thick slush and ice
2023-03-05	Dartford junior parkrun	South East England	United Kingdom	Dartford Half Marathon starts on our course
2023-04-23	Dartford junior parkrun	South East England	United Kingdom	St George's day parade taking place in the park
2023-04-15	Deep Run parkrun	USA	United States	Another event in the park
2023-04-22	Deep Run parkrun	USA	United States	Another event in the park
2023-04-29	Deep Run parkrun	USA	United States	Another event in the park
2023-03-04	Derrynoid Forest parkrun	Northern Ireland	United Kingdom	Due to the upgrading of paths and carparking
2023-03-11	Derrynoid Forest parkrun	Northern Ireland	United Kingdom	Due to the upgrading of paths and carparking
2023-03-11	Didcot parkrun	South East England	United Kingdom	Hatwell & Williams Amusements Fair - park unusable
2023-03-18	Didcot parkrun	South East England	United Kingdom	Hatwell & Williams Amusements Fair - park unusable
2023-03-11	Downham Market Academy parkrun	East of England	United Kingdom	Weather concerns will affect safety of runners
2023-03-04	Downsview parkrun	Ontario	Canada	Winter storm warning in effect
2023-03-18	Dubbo parkrun	New South Wales	Australia	Mud Run event in the park, key paths unusable
2023-03-04	Duffins Trail parkrun	Ontario	Canada	Expected snow storm overnight Friday into Saturday
2023-03-04	Durbanville parkrun	WC · Greater Cape Town	South Africa	Conflicting event (KFM KDay) at venue
2023-06-04	Duthie junior parkrun	Scotland	United Kingdom	Kiltwalk in the park starting at 9 and 9.30am.
2023-03-04	Eagan parkrun	USA	United States	ice, snow on path
2023-03-11	East Park parkrun	West Midlands	United Kingdom	Course unsafe due to very icy conditions
2023-03-05	Eastbourne junior parkrun	South East England	United Kingdom	Other event on the prom
2023-03-04	Ekebergsletta parkrun	Norway	Norway	Winter Pause
2023-03-11	Ekebergsletta parkrun	Norway	Norway	Winter Pause
2023-03-18	Ekebergsletta parkrun	Norway	Norway	Winter Pause
2023-03-25	Ekebergsletta parkrun	Norway	Norway	Winter Pause
2023-03-04	Eramosa River Trail parkrun	Ontario	Canada	Unsafe trail conditions due to snowfall
2023-04-08	Erddig parkrun	Wales	United Kingdom	Erddig NT have another event that day.
2023-04-09	Fife Cycle Park junior parkrun	Scotland	United Kingdom	Cycling event being held on track
2023-04-15	Finsbury parkrun	Greater London	United Kingdom	Tough Mudder starts at 8.45am and uses same route
2023-03-25	Flegg High parkrun	East of England	United Kingdom	Easter fayre at the school
2023-03-04	Frédéric Back parkrun	Quebec	Canada	winter snow storm causing unsafe conditions.
2023-04-15	Garvey Park parkrun	Western Australia	Australia	Kid’z Fest
2023-05-20	Garvey Park parkrun	Western Australia	Australia	Cyclocross event
2023-04-29	Geographe Bay parkrun	Western Australia	Australia	due to Busselton 100 event
2023-03-25	Goondiwindi parkrun	Queensland	Australia	HOTW weekend
2023-05-27	Great Lines parkrun, Medway	South East England	United Kingdom	Event in the park
2023-03-11	Great Yarmouth North Beach parkrun	East of England	United Kingdom	Cycle Sportive event starts in same location
2023-03-04	Greenpoint parkrun	WC · Greater Cape Town	South Africa	New course pending approval
2023-03-11	Greenpoint parkrun	WC · Greater Cape Town	South Africa	New course awaiting approval + cycle tour
2023-05-07	Guildford junior parkrun	South East England	United Kingdom	Guildford Inflatable 5km Clear up
2023-06-11	Guildford junior parkrun	South East England	United Kingdom	Sausage and Cider Festival
2023-07-23	Guildford junior parkrun	South East England	United Kingdom	Race for Life in Park
2023-08-27	Guildford junior parkrun	South East England	United Kingdom	Legends Festival in park
2023-10-15	Guildford junior parkrun	South East England	United Kingdom	Oktoborfest
2023-06-10	Guildford parkrun	South East England	United Kingdom	Sausage and cider festival in Stoke Park
2023-07-22	Guildford parkrun	South East England	United Kingdom	Race for Life in Stoke Park
2023-08-26	Guildford parkrun	South East England	United Kingdom	the legends festival will be in the park
2023-10-14	Guildford parkrun	South East England	United Kingdom	Oktoberfest
2023-11-04	Guildford parkrun	South East England	United Kingdom	Fireworks in Stoke Park
2023-03-04	Guysborough Nature Trail parkrun	Nova Scotia	Canada	weather and course conditions
2023-03-11	Guysborough Nature Trail parkrun	Nova Scotia	Canada	course conditions
2023-03-04	Haga parkrun	Sweden	Sweden	För isigt/Too icy
2023-03-25	Harcourt Hill parkrun	South East England	United Kingdom	Varsity event on campus
2023-07-15	Harrow Lodge parkrun	Greater London	United Kingdom	Event in park - route blocked
2023-03-11	Hazlehead parkrun, Aberdeen	Scotland	United Kingdom	Sheet ice on course
2023-04-22	Henstridge Airfield parkrun	South West England	United Kingdom	Other event at Airfield
2023-04-15	Hogmoor Inclosure parkrun	South East England	United Kingdom	Landowner request
2023-05-20	Hogmoor Inclosure parkrun	South East England	United Kingdom	Landowner request
2023-05-20	Holkham parkrun	East of England	United Kingdom	Mighty Hike
2023-07-08	Holkham parkrun	East of England	United Kingdom	Triathlon
2023-08-12	Holkham parkrun	East of England	United Kingdom	Festival of Sport
2023-09-02	Holkham parkrun	East of England	United Kingdom	Food Festival
2023-09-23	Holkham parkrun	East of England	United Kingdom	Food Fair
2023-12-09	Holkham parkrun	East of England	United Kingdom	Christmas Fair
2023-03-25	Horspath parkrun	South East England	United Kingdom	Rugby and American Football on course
2023-05-13	Horspath parkrun	South East England	United Kingdom	Oxford 7s Festival on fields
2023-07-08	Horspath parkrun	South East England	United Kingdom	Chilterns Classic Cycling Event on course
2023-05-20	Huddersfield parkrun	Yorkshire and the Humber	United Kingdom	Charity Colour Run - key paths unusable
2023-03-04	Huddinge parkrun	Sweden	Sweden	Vinterpaus
2023-03-11	Huddinge parkrun	Sweden	Sweden	Vinterpaus
2023-03-18	Huddinge parkrun	Sweden	Sweden	Vinterpaus
2023-03-25	Huddinge parkrun	Sweden	Sweden	Vinterpaus
2023-03-12	Jubilee junior parkrun	East of England	United Kingdom	Cross country race taking place in the park
2023-03-04	Kameeldoring parkrun	Limpopo	South Africa	Parkrun clashes with colour run event on course.
2023-03-25	Kew Woods parkrun	North West England	United Kingdom	EDs and core team at 24 hour charity run event
2023-03-04	Kiwanis parkrun	Ontario	Canada	snow storm night before; car park inaccessible
2023-03-04	Kleinplaas parkrun	North West	South Africa	Heavy Rain pour
2023-03-11	Klipspringer Lodge parkrun	Kruger Lowveld	South Africa	Due to MTB Cycling event paths used for bicycles
2023-03-11	Kroonstad parkrun	Free State	South Africa	Venue not available, School sport
2023-03-04	Lancefield parkrun	Victoria	Australia	Track damage
2023-03-11	Lancefield parkrun	Victoria	Australia	Track damage
2023-03-18	Langebaan parkrun	WC · West Coast	South Africa	Weskus Marathon taking place at the venue
2023-05-27	Lews Castle parkrun	Scotland	United Kingdom	Local Half Marathon & 10k using same route
2023-03-04	Lillie parkrun, Ann Arbor	USA	United States	snow storm left parking lots impassable
2023-03-04	Lillsjön parkrun	Sweden	Sweden	Vinterpaus
2023-03-11	Lillsjön parkrun	Sweden	Sweden	Vinterpaus
2023-03-18	Lillsjön parkrun	Sweden	Sweden	Vinterpaus
2023-03-25	Lillsjön parkrun	Sweden	Sweden	Vinterpaus
2023-03-25	Lithgow parkrun	New South Wales	Australia	Another event happening at the same time/site.
2023-06-24	Lough Key parkrun	Ireland	Ireland	Music Festival in Lough Key over weekend
2023-05-07	Lydiard junior parkrun	South West England	United Kingdom	Race for Life in the park
2023-03-04	Løvstien parkrun, Bergen	Norway	Norway	Ice on the course
2023-04-29	Markeaton parkrun	East Midlands	United Kingdom	Circus Starr event in park.
2023-06-17	Markeaton parkrun	East Midlands	United Kingdom	Face (?Fake) Festival event in park.
2023-07-08	Markeaton parkrun	East Midlands	United Kingdom	Cancer Run UK event in park.
2023-08-12	Markeaton parkrun	East Midlands	United Kingdom	Food and Drink Festival event in park.
2023-09-09	Markeaton parkrun	East Midlands	United Kingdom	Derby PRIDE event in park.
2023-09-16	Markeaton parkrun	East Midlands	United Kingdom	ColourRun event in park.
2023-12-02	Markeaton parkrun	East Midlands	United Kingdom	Family Festival event in park.
2023-06-18	Marple junior parkrun	North West England	United Kingdom	Dennis the Menace Trail Race & Family Fun Run ❤️
2023-03-04	Matlosana Bird parkrun	North West	South Africa	Due to sudden heavy rain down pour
2023-03-04	Meadowvale parkrun	Ontario	Canada	Storm warning with hazardous snow conditions
2023-03-11	Meijo koen parkrun	Japan	Japan	公園で他のイベントが開催されるため
2023-03-25	Melton Mowbray parkrun	East Midlands	United Kingdom	Wooden bridge closed for repair, key path unusable
2023-04-01	Melton Mowbray parkrun	East Midlands	United Kingdom	Wooden bridge closed for repair, key path unusable
2023-04-08	Melton Mowbray parkrun	East Midlands	United Kingdom	Wooden bridge closed for repair, key path unusable
2023-03-04	Merrymeeting parkrun	USA	United States	Snow Storm
2023-03-05	Milton Keynes junior parkrun	South East England	United Kingdom	Rugby Club holding event; paths will be unusable
2023-03-04	Moana parkrun	South Australia	Australia	Surf Lifesaving State Championships; too hazardous
2023-03-04	Mount Beauty parkrun	Victoria	Australia	Mt Bogong Conquestathon - another running event
2023-05-20	Mount Beauty parkrun	Victoria	Australia	Mt Beauty Running Festival
2023-08-26	Mount Beauty parkrun	Victoria	Australia	Kangaroo Hoppet race volunteers busy skiing
2023-05-27	Mount Edgcumbe parkrun	South West England	United Kingdom	Green man festival in the park so course not avail
2023-03-04	Moussette parkrun	Quebec	Canada	L’événement du 4 mars est annulé
2023-03-04	Mt Penang parkrun	New South Wales	Australia	Event preventing parkrun from occurring
2023-03-11	Mt Penang parkrun	New South Wales	Australia	Infrastructure upgrades impacting our course
2023-03-04	Murray Bridge parkrun	South Australia	Australia	Course closed due to flooding
2023-03-11	Murray Bridge parkrun	South Australia	Australia	Course closed due to flooding
2023-03-18	Murray Bridge parkrun	South Australia	Australia	Course closed due to flooding
2023-03-25	Murray Bridge parkrun	South Australia	Australia	Course closed due to flooding
2023-04-08	Naas parkrun	Ireland	Ireland	Racing at Racecourse
2023-05-06	Naas parkrun	Ireland	Ireland	Horse racing meeting taking place
2023-07-08	Naas parkrun	Ireland	Ireland	Horse racing meeting taking place
2023-10-14	Naas parkrun	Ireland	Ireland	Horse racing meeting taking place
2023-11-11	Naas parkrun	Ireland	Ireland	Horse racing meeting taking place
2023-03-04	Nagaragawa koen parkrun	Japan	Japan	イベント会場の都合で中止します。
2023-03-04	New York Central Fitness Trail parkrun	Ontario	Canada	Heavy snowfall overnight on trail - unsafe
2023-03-04	Nkomazi parkrun	Kruger Lowveld	South Africa	course not accessible after the heavy rains
2023-04-08	Norm-Hudlin Trails parkrun	EC · Coastal	South Africa	Norm-Hudlin Trails Market day
2023-04-15	Norm-Hudlin Trails parkrun	EC · Coastal	South Africa	Bay to Bike event, trails are closed
2023-03-25	Oiso undokoen parkrun	Japan	Japan	年度末休みのため
2023-03-04	Orleans parkrun	Ontario	Canada	Heavy snowfall
2023-03-04	Ormskirk parkrun	North West England	United Kingdom	University open day
2023-03-18	Ormskirk parkrun	North West England	United Kingdom	University open day
2023-06-17	Ormskirk parkrun	North West England	United Kingdom	university open day
2023-03-04	Osborn MetroPark parkrun	USA	United States	Multiple flooded sections of course due to heavy r
2023-03-05	Padiham Greenway junior parkrun	North West England	United Kingdom	Not enough volunteers available to be safe
2023-03-25	Pakapakanthi parkrun	South Australia	Australia	Motorsport Festival; cars using course paths
2023-04-22	Pakapakanthi parkrun	South Australia	Australia	Equestrian event utilising park and paths
2023-09-02	Penistone parkrun	Yorkshire and the Humber	United Kingdom	Penistone Show set up
2023-09-09	Penistone parkrun	Yorkshire and the Humber	United Kingdom	Penistone Show using the show field
2023-03-11	Penrhyn parkrun	Wales	United Kingdom	NT request owing to forecast
2023-03-12	Peoples Park junior parkrun	Wales	United Kingdom	There is a running event in the same area
2023-03-11	Pittsworth parkrun	Queensland	Australia	Local country show
2023-06-25	Pontefract junior parkrun	Yorkshire and the Humber	United Kingdom	Horse Racing
2023-07-30	Pontefract junior parkrun	Yorkshire and the Humber	United Kingdom	Horse Racing
2023-08-20	Pontefract junior parkrun	Yorkshire and the Humber	United Kingdom	Horse Racing
2023-03-04	Pontypool parkrun	Wales	United Kingdom	Another event taking place in the Park
2023-08-05	Pontypridd parkrun	Wales	United Kingdom	RCTCBC event in the park - sorry guys
2023-08-26	Pontypridd parkrun	Wales	United Kingdom	RCTCBC event in the park - sorry guys
2023-03-11	Port Fairy parkrun	Victoria	Australia	Port Fairy Folk Festival weekend.
2023-04-02	Preston Park junior parkrun, Brighton	South East England	United Kingdom	Brighton marathon taking place
2023-03-04	Prieska parkrun	Northern Cape	South Africa	Route still flooded
2023-03-04	Puolarmaari parkrun	Finland	Finland	Winter Pause
2023-03-11	Puolarmaari parkrun	Finland	Finland	Winter Pause
2023-03-18	Puolarmaari parkrun	Finland	Finland	Winter Pause
2023-03-25	Puolarmaari parkrun	Finland	Finland	Winter Pause
2023-03-12	Queen’s Parade junior parkrun, Aldershot	South East England	United Kingdom	Lacrosse School Championships in field
2023-03-04	Red Star parkrun	Mpumalanga	South Africa	Histrorics Car Event at Red Star Raceway
2023-03-05	Reigate Priory junior parkrun	South East England	United Kingdom	Another event in the park
2023-03-04	Richards Bay parkrun	KZN · Coastal	South Africa	Event taking place in the park
2023-03-25	Richards Bay parkrun	KZN · Coastal	South Africa	Event taking place in the park
2023-04-27	Richards Bay parkrun	KZN · Coastal	South Africa	The park is not accessible on this holiday
2023-03-04	River Oaks parkrun	Ontario	Canada	Winter Storm Warning
2023-03-04	Riverside Park parkrun	USA	United States	There was too much snow on the trail.
2023-03-04	Riviera on Vaal parkrun	GP · Sedibeng	South Africa	Riviera on Vaal Golf Course closed due to flooding
2023-03-11	Riviera on Vaal parkrun	GP · Sedibeng	South Africa	Riviera on Vaal parkrun route flooded
2023-05-06	Robelle Domain parkrun	Queensland	Australia	Ipswich City Council advised park in use
2023-03-26	Rushcliffe junior parkrun	East Midlands	United Kingdom	Rushcliffe 10k taking place in the park
