Date	Event	Region	Country	Cancellation Note
2023-09-02	Abbey Park parkrun	East Midlands	United Kingdom	Pride event using a large section of the route
2023-11-04	Abbey Park parkrun	East Midlands	United Kingdom	Bonfire night setup using paths and grass areas
2023-08-26	Aggeneys parkrun	Northern Cape	South Africa	Route closed due to construction of new pipeline
2023-09-02	Aggeneys parkrun	Northern Cape	South Africa	Route closed due to construction of new pipeline
2023-09-09	Aggeneys parkrun	Northern Cape	South Africa	Route closed due to construction of new pipeline
2023-09-16	Aggeneys parkrun	Northern Cape	South Africa	Route closed due to construction of new pipeline
2023-09-23	Aggeneys parkrun	Northern Cape	South Africa	Route closed due to construction of new pipeline
2023-08-26	Akrotiri parkrun	British Overseas Territories	United Kingdom	WGBT reading limits physical activity
2023-09-02	Akrotiri parkrun	British Overseas Territories	United Kingdom	WGBT reading limits physical activity
2023-09-09	Akrotiri parkrun	British Overseas Territories	United Kingdom	WGBT reading limits physical activity
2023-09-16	Akrotiri parkrun	British Overseas Territories	United Kingdom	WGBT reading limits physical activity
2023-09-23	Akrotiri parkrun	British Overseas Territories	United Kingdom	WGBT reading limits physical activity
2023-08-26	Alberton Ascot parkrun	Victoria	Australia	Shortage of volunteers
2023-09-09	Alderford Lake parkrun	West Midlands	United Kingdom	No RD available
2023-08-26	Alexandra parkrun, Moss Side	North West England	United Kingdom	Venue unavailable
2023-08-26	Alvaston parkrun	East Midlands	United Kingdom	British BMX Championships in the park
2023-08-27	Alyn Waters junior parkrun	Wales	United Kingdom	Shortage of volunteers
2023-09-09	Ararat parkrun	Victoria	Australia	Venue unavailable
2023-09-24	Avenham Park junior parkrun	North West England	United Kingdom	Venue unavailable
2023-09-09	Ayr parkrun	Scotland	United Kingdom	park being used as car park for Airshow
2023-09-16	Ayr parkrun	Scotland	United Kingdom	dog agility event in park; key paths unusable
2023-08-27	Ballincollig Regional junior parkrun	Ireland	Ireland	Shortage of volunteers
2023-08-26	Bambra Bolinda parkrun	Victoria	Australia	Shortage of volunteers
2023-09-30	Bangor parkrun, Northern Ireland	Northern Ireland	United Kingdom	The annual Bangor 10k uses part of the course
2023-09-24	Barking junior parkrun	Greater London	United Kingdom	Shortage of volunteers
2023-08-26	Barnstaple parkrun	South West England	United Kingdom	Inflatables in the park
2023-09-02	Barry Island parkrun	Wales	United Kingdom	Another event taking place
2023-11-11	Bedworth parkrun	West Midlands	United Kingdom	Bedworth Armistice Parade
2023-09-17	Belfast Victoria junior parkrun	Northern Ireland	United Kingdom	Belfast city half marathon using key paths
2023-09-09	Belton House parkrun	East Midlands	United Kingdom	Belton House closed.
2023-09-16	Belton House parkrun	East Midlands	United Kingdom	As requested by the NT
2023-09-23	Belton House parkrun	East Midlands	United Kingdom	As requested by the NT
2023-09-30	Belton House parkrun	East Midlands	United Kingdom	As requested by the NT
2023-10-07	Belton House parkrun	East Midlands	United Kingdom	As requested by the NT
2023-10-14	Belton House parkrun	East Midlands	United Kingdom	As requested by the NT
2023-10-21	Belton House parkrun	East Midlands	United Kingdom	As requested by the NT
2023-10-28	Belton House parkrun	East Midlands	United Kingdom	As requested by the NT
2023-09-03	Betteshanger junior parkrun	South East England	United Kingdom	Venue unavailable
2023-08-26	Blaise Castle parkrun	South West England	United Kingdom	Green Man runners on site
2023-09-23	Blaise Castle parkrun	South West England	United Kingdom	Venue unavailable
2023-08-27	Blickling junior parkrun	East of England	United Kingdom	Agricultural Show in Venue: no access to route
2023-08-26	Blickling parkrun	East of England	United Kingdom	Venue unavailable
2023-08-26	Blue Lagoon parkrun	KZN · Coastal	South Africa	Shortage of volunteers
2023-09-09	Bognor Regis parkrun	South East England	United Kingdom	Safety due to another event in the park
2023-09-17	Boston Road Rec junior parkrun	East Midlands	United Kingdom	Okotberfest in Park
2023-09-02	Bournemouth parkrun	South West England	United Kingdom	Bournemouth Air Festival.  Course unavailable
2023-08-26	Braidwood Showground parkrun	New South Wales	Australia	Works being done at showground; cannot use course
2023-09-02	Braidwood Showground parkrun	New South Wales	Australia	Works being done at showground; cannot use course
2023-09-09	Braidwood Showground parkrun	New South Wales	Australia	Works being done at showground; cannot use course
2023-08-26	Bramshall Road parkrun	West Midlands	United Kingdom	Venue unavailable
2023-09-23	Bredasdorp parkrun	WC · Overberg	South Africa	Voet van Africa taking place, key path unavailable
2023-09-16	Brentwood parkrun	East of England	United Kingdom	Venue unavailable
2023-10-07	Brooklands parkrun	South East England	United Kingdom	Funfair on park
2023-10-14	Brooklands parkrun	South East England	United Kingdom	Funfair on park
2023-09-23	Burnham-on-Crouch parkrun	East of England	United Kingdom	funfair coming to town for two weeks
2023-09-30	Burnham-on-Crouch parkrun	East of England	United Kingdom	funfair coming to town for two weeks
2023-08-26	Bushy parkrun, Dublin	Ireland	Ireland	Tree down along river - route is not accessible.
2023-09-03	Cambourne junior parkrun	East of England	United Kingdom	Venue unavailable
2023-12-03	Cannon Hill junior parkrun, Birmingham	West Midlands	United Kingdom	Venue unavailable
2023-08-26	Canton Lower Rouge Trail parkrun	USA	United States	Course unsafe or blocked
2023-09-09	Canyon Rim Trail parkrun	USA	United States	Rim 2 Rim event conflict
2023-09-03	Cardiff junior parkrun	Wales	United Kingdom	Venue unavailable
2023-10-01	Carlisle junior parkrun	North West England	United Kingdom	Great Cumbrian Run; uses junior parkrun route
2023-11-05	Carlisle junior parkrun	North West England	United Kingdom	Carlisle Fire Show
2024-03-17	Carlisle junior parkrun	North West England	United Kingdom	Carlisle 10K & Half; use junior parkrun route
2023-12-30	Chasewater parkrun	West Midlands	United Kingdom	Venue unavailable
2023-09-03	Cheltenham junior parkrun	South West England	United Kingdom	Cheltenham half marathon - road closures
2023-10-14	Chichester parkrun	South East England	United Kingdom	Other event in park
2023-08-26	Chichibu Muse Park parkrun	Japan	Japan	公園内で他のイベントが開催されるため中止します。
2023-09-09	Chichibu Muse Park parkrun	Japan	Japan	Venue unavailable
2023-09-16	Chichibu Muse Park parkrun	Japan	Japan	Venue unavailable
2023-08-27	Chippenham junior parkrun	South West England	United Kingdom	Fair using park
2023-08-26	Christiana parkrun	North West	South Africa	Run Director going for surgery, no body available
2023-08-26	Clapham Common parkrun	Greater London	United Kingdom	Core team unavailable
2023-08-26	Clonmel parkrun	Ireland	Ireland	As a mark of respect for a local tragedy
2023-09-02	Clonmel parkrun	Ireland	Ireland	Mark of respect for Local tragedy
2023-08-26	Cobaw Clunes parkrun	Victoria	Australia	Shortage of volunteers
2023-08-27	Cotlands Park junior parkrun	Scotland	United Kingdom	Equipment unavailable
2023-08-27	Cranleigh junior parkrun	South East England	United Kingdom	No available DBS Run Directors
2023-08-26	Cranleigh parkrun	South East England	United Kingdom	No run - park redevelopment - restart 2 Sep
2023-09-16	Crathes Castle parkrun	Scotland	United Kingdom	Course being used by PIM Running Festival
2023-08-26	Croxteth Hall parkrun	North West England	United Kingdom	Course unsafe or blocked
2023-09-23	Dalby Forest parkrun	Yorkshire and the Humber	United Kingdom	Venue unavailable
2023-08-26	Dallas Burston Polo Club parkrun	West Midlands	United Kingdom	Polo Championship taking place
2023-09-02	Dallas Burston Polo Club parkrun	West Midlands	United Kingdom	Polo Championship taking place
2023-09-09	Dallas Burston Polo Club parkrun	West Midlands	United Kingdom	Event in the Polo Club
2023-09-30	Dallas Burston Polo Club parkrun	West Midlands	United Kingdom	Polo Championship taking place
2023-09-10	Daventry Country Park junior parkrun	East Midlands	United Kingdom	Venue unavailable
2023-09-03	Derry City junior parkrun	Northern Ireland	United Kingdom	Waterside Half Marathon using St Columb’s Park
2023-08-26	Devils Peak parkrun	South Australia	Australia	Prison event Insufficient staffing to run event
2023-08-27	Dewsbury junior parkrun	Yorkshire and the Humber	United Kingdom	Shortage of volunteers
2023-09-09	Diamond Creek parkrun	Victoria	Australia	Venue unavailable
2023-09-24	Eastbourne junior parkrun	South East England	United Kingdom	Venue unavailable
2023-09-03	Eltham junior parkrun	Greater London	United Kingdom	Core team unavailable
2023-10-14	Erddig parkrun	Wales	United Kingdom	Erddig NT has special event on that date
2023-10-21	Erddig parkrun	Wales	United Kingdom	Erddig NT has special event on that date
2023-08-27	Evesham junior parkrun	West Midlands	United Kingdom	Course unsafe or blocked
2023-08-26	Evesham parkrun	West Midlands	United Kingdom	Course restricted by Evesham Fishing Festival
2023-09-03	Faversham Recreation Ground junior parkrun	South East England	United Kingdom	Venue unavailable
2023-09-03	Felixstowe Prom junior parkrun	East of England	United Kingdom	Course unsafe or blocked
2023-09-10	Felixstowe Prom junior parkrun	East of England	United Kingdom	Course unsafe or blocked
2023-08-26	Feltham parkrun	South East England	United Kingdom	staff shortages
2023-09-02	Festningen parkrun	Norway	Norway	Other event in the park
2023-09-02	Fingal Bay parkrun	New South Wales	Australia	Another event on parkrun course
2023-09-02	Ford parkrun	North West England	United Kingdom	Comedy Festival setting up on course
2023-08-27	Forest Rec junior parkrun	East Midlands	United Kingdom	Fil-Brit Festival at Forest Rec
2023-10-01	Forest Rec junior parkrun	East Midlands	United Kingdom	Goose Fair happening at Forest Rec
2023-10-08	Forest Rec junior parkrun	East Midlands	United Kingdom	Goose Fair happening at Forest Rec
2023-09-09	Fulham Palace parkrun	Greater London	United Kingdom	Action Challenge Event - paths will be congested
2023-08-27	Gardenhurst Estate junior parkrun	North West England	United Kingdom	No availability of core team
2023-09-09	George Lane Memorial parkrun	Alberta	Canada	Venue unavailable
2024-01-06	Globe parkrun	Germany	Germany	Dreikönigslauf www.3koenigslauf.de
2023-09-09	Gloucester City parkrun	South West England	United Kingdom	Venue unavailable
2023-08-27	Gnoll junior parkrun	Wales	United Kingdom	No RD available.
2024-04-27	Goffert parkrun	Netherlands	Netherlands	Goffertpark is unavailable for parkrun on Kingsday
2023-11-12	Goudhurst junior parkrun	South East England	United Kingdom	Remembrance Sunday Commemorations
2023-09-16	Great Dunmow parkrun	East of England	United Kingdom	Venue unavailable
2023-08-26	Groeneweide parkrun	WC · Overberg	South Africa	Weather
2023-10-15	Guildford junior parkrun	South East England	United Kingdom	Oktoborfest
2023-10-14	Guildford parkrun	South East England	United Kingdom	Oktoberfest
2023-11-04	Guildford parkrun	South East England	United Kingdom	Fireworks in Stoke Park
2023-12-02	Guildford parkrun	South East England	United Kingdom	Kelly's Santa Fun Run in the park
2023-09-16	Hadleigh parkrun, Essex	East of England	United Kingdom	Another large scale event taking place in the park
2023-08-26	Halls parkrun, Nelspruit	Kruger Lowveld	South Africa	Venue unavailable
2023-08-26	Hamilton Island parkrun	Queensland	Australia	Hamilton Island Race Week
2023-08-26	Harkerville parkrun	WC · Garden Route	South Africa	Gale force winds forecast. Danger of trees falling
2023-08-26	Hart & Bosch Village parkrun	WC · Garden Route	South Africa	Renovation of venue
2023-09-02	Hart & Bosch Village parkrun	WC · Garden Route	South Africa	Renovation of parkrun venue
2023-09-23	Hasenheide parkrun	Germany	Germany	Bauarbeiten und Marathonwochenende
2023-08-26	Hastings parkrun	South East England	United Kingdom	EVENT ON COURSE
2023-09-23	Havelkanal parkrun	Germany	Germany	Berlin Marathon
2023-09-03	Hawkwell junior parkrun	East of England	United Kingdom	Core volunteer team unavailable
2023-09-02	Hay Lodge parkrun	Scotland	United Kingdom	Venue unavailable
2023-08-26	Heartlands parkrun	South West England	United Kingdom	Site unavailable due to Geek Fest
2023-08-26	Henstridge Airfield parkrun	South West England	United Kingdom	Venue unavailable
2023-09-09	Henstridge Airfield parkrun	South West England	United Kingdom	No ED cover (land use requirement)
2023-09-16	Heslington parkrun	Yorkshire and the Humber	United Kingdom	Student moving day - access & car park unavailable
2023-08-27	Hillsborough junior parkrun	Yorkshire and the Humber	United Kingdom	Course unsafe or blocked
2023-08-26	Hillsborough parkrun	Yorkshire and the Humber	United Kingdom	Unsafe to run event due to ongoing Tramlines works
2023-08-26	Holkham parkrun	East of England	United Kingdom	Wedding traffic using parkrun route
2023-09-02	Holkham parkrun	East of England	United Kingdom	Food Festival
2023-09-23	Holkham parkrun	East of England	United Kingdom	Food Fair
2023-12-09	Holkham parkrun	East of England	United Kingdom	Christmas Fair
2023-11-25	Hopkins Land parkrun	WC · Garden Route	South Africa	Vlakte Marathan, 42km.21km.10.4km and 5km
2023-08-27	Horsforth Hall junior parkrun	Yorkshire and the Humber	United Kingdom	Venue unavailable
2023-08-26	Hoërskool Ben Viljoen parkrun	Limpopo	South Africa	Clash of events
2023-11-11	Huddersfield parkrun	Yorkshire and the Humber	United Kingdom	Armistice Day Parade - key paths unavailable
2023-08-27	Hutton Recreation Ground junior parkrun	East of England	United Kingdom	Venue unavailable
2023-09-03	Hutton Recreation Ground junior parkrun	East of England	United Kingdom	Course unsafe or blocked
2023-08-27	Hyde junior parkrun	North West England	United Kingdom	Venue unavailable
2023-09-03	Jacks Road junior parkrun	Scotland	United Kingdom	Track closed for North Ayrhire Athletics Club 10k
2023-09-16	Joe Creason parkrun	USA	United States	Park Unavailable - Nightingale 5K
2023-10-21	Joe Creason parkrun	USA	United States	Park Unavailable - Bellarmine Run for Ryann 5K
2023-09-02	Kameeldoring parkrun	Limpopo	South Africa	Venue unavailable
2023-09-23	Kameeldoring parkrun	Limpopo	South Africa	Venue unavailable
2023-09-03	Kennington Park junior parkrun	Greater London	United Kingdom	Shortage of volunteers
2023-09-09	Keswick parkrun	North West England	United Kingdom	Venue unavailable
2023-09-03	King George V junior parkrun	South West England	United Kingdom	Food and River Festival in park, course unusable.
2023-08-27	Kings Weston junior parkrun	South West England	United Kingdom	Shortage of volunteers on the bank holiday weekend
2023-08-26	Kleinplaas parkrun	North West	South Africa	Venue unavailable
2023-09-10	Knavesmire junior parkrun	Yorkshire and the Humber	United Kingdom	Horses on the course!
2023-09-02	Koster parkrun	North West	South Africa	Another event at venue
2023-08-26	Küchenholz parkrun	Germany	Germany	Course unsafe or blocked
2023-08-27	Larne junior parkrun	Northern Ireland	United Kingdom	Larne Half Marathon event on at same time
2023-08-26	Leazes parkrun	North East England	United Kingdom	Venue unavailable
2023-09-16	Leazes parkrun	North East England	United Kingdom	Venue unavailable
2023-09-16	Leicester Victoria parkrun	East Midlands	United Kingdom	Radio 2 concert
2023-09-09	Levengrove parkrun	Scotland	United Kingdom	Venue unavailable
2023-09-16	Living Colour parkrun	WC · West Coast	South Africa	Another event on site
2023-08-26	Loch Neaton parkrun, Watton	East of England	United Kingdom	Bike event at the sports centre
2023-11-05	Long Eaton junior parkrun	East Midlands	United Kingdom	Venue unavailable
2023-11-04	Long Eaton parkrun	East Midlands	United Kingdom	Bonfire event; key paths unusable & vehicles
2023-08-27	Longford junior parkrun	Ireland	Ireland	Shortage of volunteers
2023-09-03	Lough Key junior parkrun	Ireland	Ireland	Venue unavailable
2023-09-09	Ludlow parkrun	West Midlands	United Kingdom	Venue unavailable
2023-08-26	Lytham Hall parkrun	North West England	United Kingdom	Last night of the proms event
2023-09-09	Lytham Hall parkrun	North West England	United Kingdom	Wedding at Hall requiring access to setup
2023-11-18	Lytham Hall parkrun	North West England	United Kingdom	Arts and Crafts event at Hall
2023-12-02	Lytham Hall parkrun	North West England	United Kingdom	Venue unavailable
2023-08-27	Malahide Castle junior parkrun	Ireland	Ireland	Venue unavailable
2023-09-10	Mallow Castle junior parkrun	Ireland	Ireland	Local half marathon on
2023-09-02	March parkrun	East of England	United Kingdom	Venue unavailable
2023-09-02	Marine Parade parkrun	South West England	United Kingdom	High Tide
2023-09-16	Marine Parade parkrun	South West England	United Kingdom	Enduro Preparations (course un-usable)
2023-09-23	Marine Parade parkrun	South West England	United Kingdom	Enduro Weekend (course un-usable)
2023-09-30	Marine Parade parkrun	South West England	United Kingdom	High Tide
2023-09-09	Markeaton parkrun	East Midlands	United Kingdom	Derby PRIDE event in park.
2023-09-16	Markeaton parkrun	East Midlands	United Kingdom	ColourRun event in park.
2023-12-02	Markeaton parkrun	East Midlands	United Kingdom	Family Festival event in park.
2023-09-30	Market Rasen Racecourse parkrun	East Midlands	United Kingdom	Horse racing taking place on the racecourse
2023-10-21	Market Rasen Racecourse parkrun	East Midlands	United Kingdom	Horse racing taking place on the racecourse
2023-09-16	Markshall Estate parkrun	East of England	United Kingdom	Classic Car Show at the venue today.
2023-12-02	Markshall Estate parkrun	East of England	United Kingdom	Christmas Event at Markshall Estate
2023-08-26	Marlborough Common parkrun	South West England	United Kingdom	Venue unavailable
2023-09-02	Marlborough Common parkrun	South West England	United Kingdom	Venue unavailable
2023-08-26	Meadowmill parkrun	Scotland	United Kingdom	Venue unavailable
2023-08-26	Meijo koen parkrun	Japan	Japan	Weather
2023-09-02	Melksham parkrun	South West England	United Kingdom	Venue unavailable
2023-08-27	Mellowes Park junior parkrun	Ireland	Ireland	Summer Break
2023-09-02	Millennium Country parkrun, Forest of Marston Vale	East of England	United Kingdom	Course unavailable - Forest Family Fun Day
2023-08-27	Milton Keynes junior parkrun	South East England	United Kingdom	Venue unavailable
2023-09-02	Moreletapark Gemeente parkrun	GP · Tshwane - Pretoria	South Africa	Venue unavailable
2023-09-09	Moreletapark Gemeente parkrun	GP · Tshwane - Pretoria	South Africa	Venue unavailable
2023-08-26	Mount Beauty parkrun	Victoria	Australia	Kangaroo Hoppet race volunteers busy skiing
2023-08-26	Mtunzini parkrun	KZN · Coastal	South Africa	Venue unavailable
2023-08-27	Musgrave junior parkrun	Northern Ireland	United Kingdom	Shortage of volunteers
2023-10-14	Naas parkrun	Ireland	Ireland	Horse racing meeting taking place
2023-11-11	Naas parkrun	Ireland	Ireland	Horse racing meeting taking place
2023-10-07	Nathalia Showgrounds parkrun	Victoria	Australia	Nathalia Agricultural Show using area
2023-09-16	Nepean River parkrun	New South Wales	Australia	Venue unavailable
2023-10-21	New York Central Fitness Trail parkrun	Ontario	Canada	Russell Run
2023-09-09	Newborough Forest parkrun	Wales	United Kingdom	Sandman triathlon event
2023-08-26	Norm-Hudlin Trails parkrun	EC · Coastal	South Africa	adverse weather conditions
2023-09-23	Normanby Hall parkrun	Yorkshire and the Humber	United Kingdom	Venue unavailable
2023-09-10	North Marine junior parkrun	North East England	United Kingdom	Great North Run
2023-09-03	Norton Common junior parkrun	East of England	United Kingdom	Venue unavailable
2023-09-23	Oiso undokoen parkrun	Japan	Japan	Silver week
2023-12-09	Onderstepoort Campus parkrun	GP · Tshwane - Pretoria	South Africa	Christmas Holiday - Campus Closed For Holiday
2023-12-16	Onderstepoort Campus parkrun	GP · Tshwane - Pretoria	South Africa	Christmas Holiday - Campus Closed For Holiday
2023-12-23	Onderstepoort Campus parkrun	GP · Tshwane - Pretoria	South Africa	Christmas Holiday - Campus Closed For Holiday
2023-12-30	Onderstepoort Campus parkrun	GP · Tshwane - Pretoria	South Africa	Christmas Holiday - Campus Closed For Holiday
2023-09-23	Ormskirk parkrun	North West England	United Kingdom	Venue unavailable
2023-08-26	PE Hobie Beach parkrun	EC · Coastal	South Africa	Weather
2023-08-26	Pendle parkrun	North West England	United Kingdom	Campers
2023-09-02	Penistone parkrun	Yorkshire and the Humber	United Kingdom	Penistone Show set up
2023-09-09	Penistone parkrun	Yorkshire and the Humber	United Kingdom	Penistone Show using the show field
2023-08-27	Phoenix junior parkrun	North West England	United Kingdom	No core team available
2023-08-26	Pirates Sport Club parkrun	EC · Inland	South Africa	course under repair
2023-09-24	Pitshanger junior parkrun	Greater London	United Kingdom	Ealing Half Marathon
2023-08-27	Plas Newydd junior parkrun	Wales	United Kingdom	Event begins on September 3rd
2023-09-03	Play Close Park junior parkrun	East Midlands	United Kingdom	It's a Knockout event require access for set up
2023-09-16	Pokkinen parkrun	Finland	Finland	Oulun Juoksu 10k race. Key paths unusable.
2023-08-26	Pongola parkrun	KZN · Inland	South Africa	Inniriet Fun Run
2023-09-02	Pongola parkrun	KZN · Inland	South Africa	Bergsig fun run
2023-11-19	Pontefract junior parkrun	Yorkshire and the Humber	United Kingdom	Venue unavailable
2023-08-26	Pontypridd parkrun	Wales	United Kingdom	RCTCBC event in the park - sorry guys
2023-08-26	Port Alfred parkrun	EC · Coastal	South Africa	Weather
2023-08-26	Potternewton parkrun	Yorkshire and the Humber	United Kingdom	Carnival in the park
2023-09-03	Prudhoe Riverside junior parkrun	North East England	United Kingdom	Venue unavailable
2023-10-01	Queen’s Parade junior parkrun, Aldershot	South East England	United Kingdom	Rushmoor 10k in the field
2023-11-12	Queen’s Parade junior parkrun, Aldershot	South East England	United Kingdom	Truce tournament
2023-09-03	Queen’s Park junior parkrun, Rochdale	North West England	United Kingdom	Annual charities fete using park
2023-09-23	Rec Plex North parkrun	USA	United States	UWF hostimg High Schools cross-country meet.
2023-09-02	Red Point Church parkrun	KZN · Inland	South Africa	Venue unavailable
2023-08-26	Red Star parkrun	Mpumalanga	South Africa	RED STAR MARATHON AT RED STAR RACEWAY
2023-09-10	Reigate Priory junior parkrun	South East England	United Kingdom	Venue unavailable
2023-09-17	Reigate Priory junior parkrun	South East England	United Kingdom	Venue unavailable
2023-09-09	Reigate Priory parkrun	South East England	United Kingdom	Pride in the Park event - course blocked
2023-09-02	Rheinpark parkrun	Germany	Germany	Venue unavailable
2023-08-26	River Valley parkrun, Edmonton	Alberta	Canada	Venue unavailable
2023-09-02	Riverfront parkrun	Wales	United Kingdom	Venue unavailable
2023-08-27	Riverside junior parkrun, St Neots	East of England	United Kingdom	No RD’s available
2023-08-26	Riverside parkrun, Grand Rapids	USA	United States	Course unsafe or blocked
2023-09-16	Riverside parkrun, Grand Rapids	USA	United States	Venue unavailable
2023-10-07	Riverside parkrun, Grand Rapids	USA	United States	Venue unavailable
2023-10-21	Riverside parkrun, Grand Rapids	USA	United States	Venue unavailable
2023-11-11	Riverside parkrun, Grand Rapids	USA	United States	Venue unavailable
2023-12-09	Riverside parkrun, Grand Rapids	USA	United States	Venue unavailable
2023-11-12	Riversley Park junior parkrun	West Midlands	United Kingdom	Remembrance Sunday event in park
2023-08-26	Riverway parkrun	Queensland	Australia	Course unsafe or blocked
2023-09-16	Roberts Park parkrun	Yorkshire and the Humber	United Kingdom	Saltaire Festival on the course
2023-09-09	Rockingham parkrun	Western Australia	Australia	Royal Australian Navy Freedom to the City Parade
2023-09-03	Rossmere junior parkrun	North East England	United Kingdom	Another Event
2023-09-02	Rotherham parkrun	Yorkshire and the Humber	United Kingdom	Venue unavailable
2023-09-16	Russborough parkrun	Ireland	Ireland	Event on at venue
2023-09-10	Rutland Water junior parkrun	East Midlands	United Kingdom	Course being used for another event
2023-09-17	Rutland Water junior parkrun	East Midlands	United Kingdom	Course being used for another event
2023-08-27	Salt Hill junior parkrun	South East England	United Kingdom	Run Directors not available
2023-09-10	Saltaire junior parkrun	Yorkshire and the Humber	United Kingdom	Venue unavailable
2023-09-17	Saltaire junior parkrun	Yorkshire and the Humber	United Kingdom	Venue unavailable
2023-09-02	Sandhurst Memorial parkrun	South East England	United Kingdom	Venue unavailable
2023-11-25	Sandhurst Memorial parkrun	South East England	United Kingdom	Access unavailable for council event set up
2023-08-26	Sandringham parkrun	East of England	United Kingdom	Music event at Sandringham
2023-08-26	Sands Lane parkrun	Yorkshire and the Humber	United Kingdom	Hardware /Software problems
2023-09-10	Sedgefield junior parkrun	North East England	United Kingdom	No Run director available due to Great North Run
2023-09-02	Shawnigan Hills parkrun	British Columbia	Canada	Lack of volunteers
2023-09-03	Shipley Country junior parkrun	East Midlands	United Kingdom	Venue unavailable
2023-09-10	Shipley Country junior parkrun	East Midlands	United Kingdom	Venue unavailable
2023-09-17	Shipley Country junior parkrun	East Midlands	United Kingdom	Venue unavailable
2023-11-19	Shipley Country junior parkrun	East Midlands	United Kingdom	Venue unavailable
