Date	Event	Country	Cancellation Note	Website
2024-12-14	Carrickfergus parkrun	United Kingdom	Someone dug a damn great hole across the start!	https://www.parkrun.org.uk/carrickfergus
2024-12-14	Huddinge parkrun	Sweden	The ice age is coming ...	https://www.parkrun.se/huddinge
2024-12-14	Lackawanna Rail Trail parkrun	United States	Shortage of volunteers	https://www.parkrun.us/lackawannarailtrail
2024-12-14	Naturlehrpfad parkrun, Wetzlar	Germany	Shortage of volunteers	https://www.parkrun.com.de/naturlehrpfadwetzlar
2024-12-14	New Earswick parkrun	United Kingdom	Ground is too wet	https://www.parkrun.org.uk/newearswick
2024-12-14	Roding Valley parkrun	United Kingdom	Shortage of volunteers	https://www.parkrun.org.uk/rodingvalley
2024-12-14	Woodgate Valley Country Park parkrun	United Kingdom	Course unsafe or blocked	https://www.parkrun.org.uk/woodgatevalleycountrypark
2024-12-12 21:17:39.311540			
