Date	Event	Country	Cancellation Note	Website	Added or Removed
2023-08-19	Avondale Forest parkrun	Ireland	Orange Weather Warning in Place for area	https://www.parkrun.ie/avondaleforest	Added
2023-08-19	Nagaragawa koen parkrun	Japan	熱中症警戒アラートが発令された為、中止します。	https://www.parkrun.jp/nagaragawakoen	Added
2023-08-19	Penrhyn parkrun	United Kingdom	Forecast high wind and risk of falling trees	https://www.parkrun.org.uk/penrhyn	Added
2023-08-20	Tyne Green junior parkrun	United Kingdom	Covid impacting both available RD's.	https://www.parkrun.org.uk/tynegreen-juniors	Added
2023-08-20	Woodley junior parkrun	United Kingdom	Course unsafe or blocked	https://www.parkrun.org.uk/woodley-juniors	Added
2023-08-18 12:31:20.166280				
