Date	Event	Country	Cancellation Note	Website	Added or Removed
2026-07-04	Benalla Botanical Gardens parkrun	Australia	Course unsafe or blocked	https://www.parkrun.com.au/benallabotanicalgardens	Added
2026-07-04	Branch Brook Park parkrun	United States	Weather	https://www.parkrun.us/branchbrookpark	Added
2026-07-04	Campaspe parkrun	Australia	Course unsafe or blocked	https://www.parkrun.com.au/campaspe	Added
2026-07-04	Euroa parkrun	Australia	Course unsafe or blocked	https://www.parkrun.com.au/euroa	Added
2026-07-04	Mashikimachi sogoundo koen parkrun	Japan	Weather	https://www.parkrun.jp/mashikimachisogoundokoen	Added
2026-07-04	Ovens River Trail parkrun	Australia	Weather	https://www.parkrun.com.au/ovensrivertrail	Added
2026-07-03 03:53:24.283133				
