Date	Event	Country	Cancellation Note	Website
2023-01-21	Bedfont Lakes parkrun	United Kingdom	Safety reasons, icy conditions	https://www.parkrun.org.uk/bedfont
2023-01-21	Great Denham parkrun	United Kingdom	Course is more likely to host dancing on ice!	https://www.parkrun.org.uk/greatdenham
2023-01-21	Mildura Weir parkrun	Australia	flooding and no approved alternate course	https://www.parkrun.com.au/milduraweir
2023-01-21	Newport parkrun	United Kingdom	Temporary closure due to groundworks on site	https://www.parkrun.org.uk/newport
2023-01-21	Sunny Hill parkrun	United Kingdom	dangerous icy patches on route	https://www.parkrun.org.uk/sunnyhill
2023-01-19 12:29:41.465338			
