Date	Event	Country	Cancellation Note	Website	Added or Removed
2024-12-01	Clough Hall junior parkrun	United Kingdom	Weather	https://www.parkrun.org.uk/cloughhall-juniors	Added
2024-12-01	Forest of Dean junior parkrun	United Kingdom	Not enough buoyancy aids for junior duathlon	https://www.parkrun.org.uk/forestofdean-juniors	Added
2024-12-01	Hereford Leisure Centre junior parkrun	United Kingdom	Course unsafe or blocked	https://www.parkrun.org.uk/herefordleisurecentre-juniors	Added
2024-12-01	Medway junior parkrun	United Kingdom	Bert being a vandal! - broken trees	https://www.parkrun.org.uk/medway-juniors	Added
2024-12-01	Page Park junior parkrun	United Kingdom	Equipment unavailable	https://www.parkrun.org.uk/pagepark-juniors	Added
2024-12-01 09:13:09.577597				
