Date	Event	Country	Cancellation Note	Website	Added or Removed
2025-04-19	Coler Mountain Bike Preserve parkrun	United States	Weather	https://www.parkrun.us/colermountainbikepreserve	Added
2025-04-19	Mansfield OH parkrun	United States	Weather	https://www.parkrun.us/mansfieldoh	Added
2025-04-19	Ohio and Erie Canal Reservation parkrun	United States	Weather	https://www.parkrun.us/ohioanderiecanalreservation	Added
2025-04-19	White Lick Creek parkrun	United States	Weather	https://www.parkrun.us/whitelickcreek	Added
2025-04-19 15:17:04.188366				
