Date	Event	Country	Cancellation Note	Website	Added or Removed
2022-08-13	Chaffey Park parkrun	Australia	trail run is too slippery,	https://www.parkrun.com.au/chaffeypark	Added
2022-08-13	Chuo koen parkrun	Japan	悪天候のため中止とします。	https://www.parkrun.jp/chuokoen	Added
2022-08-13	Garvey Park parkrun	Australia	Too much water on course, and very slippery	https://www.parkrun.com.au/garveypark	Added
2022-08-13	Horseshoe Bay Reserve parkrun	Australia	Bad weather too much risk for athletes & volunteer	https://www.parkrun.com.au/horseshoebayreserve	Added
2022-08-13	Jamestown Golf Course parkrun	Australia	Weather	https://www.parkrun.com.au/jamestowngolfcourse	Added
2022-08-13	Riverbank parkrun	Australia	Damaged and flooded course.	https://www.parkrun.com.au/riverbank	Added
2022-08-14	Barking and Dagenham junior parkrun	United Kingdom	Elrow festival set up on course	https://www.parkrun.org.uk/barkinganddagenham-juniors	Added
2022-08-14	Whitley Bay junior parkrun	United Kingdom	Too few volunteers and added hazard of bus rally	https://www.parkrun.org.uk/whitleybay-juniors	Added
2022-08-13 03:18:46.118399				
