Date	Event	Country	Cancellation Note	Website	Added or Removed
2023-12-16	Aspen parkrun	United States	closed for winter season	https://www.parkrun.us/aspen	Added
2023-12-16	Humber Bridge parkrun	United Kingdom	both routes unsuitable due to flooding	https://www.parkrun.org.uk/humberbridge	Added
2023-12-16	Millennium parkrun	Canada	Venue unavailable	https://www.parkrun.ca/millennium	Added
2023-12-16	Rostrevor parkrun	United Kingdom	Course unsafe or blocked	https://www.parkrun.org.uk/rostrevor	Added
2023-12-16	Somerdale Pavilion parkrun	United Kingdom	Water above plimsoll line (and RD's wellies)	https://www.parkrun.org.uk/somerdalepavilion	Added
2023-12-13 18:16:22.313653				
