Date	Event	Country	Cancellation Note	Website	Added or Removed
2022-07-02	Akrotiri parkrun	United Kingdom	Restrictions according to WBGT readings		Added
2022-07-02	Glass House Mountains Conservation parkrun	Australia	Landslide on trail	https://www.parkrun.com.au/glasshousemountainsconservation	Added
2022-07-02	Mount Barker parkrun	Australia	path closure due to sewer pipe works	https://www.parkrun.com.au/mountbarker	Added
2022-07-02	Mount Pleasant parkrun	United Kingdom	No staff due to other working commitments		Added
2022-07-02	Red Star parkrun	South Africa	Key paths unusable	https://www.parkrun.co.za/redstar	Added
2022-06-29 15:48:42.168223				
