Date	Event	Country	Cancellation Note	Website
2022-05-21	Century City parkrun	South Africa	Event cancelled on 21 May 2022	https://www.parkrun.co.za/centurycity
2022-05-21	Inibos parkrun	South Africa	Waterlogged due to heavy rain	https://www.parkrun.co.za/inibos
2022-05-21	Jock Trail parkrun	South Africa	due to heavy rainfall predicted	https://www.parkrun.co.za/jocktrail
2022-05-21	Maribyrnong parkrun	Australia	insufficient number of volunteers	https://www.parkrun.com.au/maribyrnong
2022-05-21	Middelburg parkrun	South Africa	Inclement weather. Course will also not be safe.	https://www.parkrun.co.za/middelburg
2022-05-21	Stutterheim parkrun	South Africa	Unfavorable weather conditions, course hazardous	https://www.parkrun.co.za/stutterheim
2022-05-21	TYTO Wetlands parkrun	Australia	Crocodile on course	https://www.parkrun.com.au/tytowetlands
2022-05-21	Toboshane Valley Estate parkrun	South Africa	the overnight rain has made conditions unsuitable	https://www.parkrun.co.za/toboshanevalleyestate
2022-05-20 12:45:07.394002			
