Date	Event	Country	Cancellation Note	Website	Added or Removed
2022-06-05	Bailey junior parkrun	United Kingdom	Steam rally vehicles still in park and exiting	https://www.parkrun.org.uk/bailey-juniors	Added
2022-06-05	Central Park junior parkrun, Boston	United Kingdom	Atrocious weather - thunder & lightning warning	https://www.parkrun.org.uk/centralparkboston-juniors	Added
2022-06-05	Desborough Green Space junior parkrun	United Kingdom	Water on the course and fallen branches.	https://www.parkrun.org.uk/desboroughgreenspace-juniors	Added
2022-06-05	Stevens Park junior parkrun, Wollescote	United Kingdom	adverse weather, unsafe ground conditions	https://www.parkrun.org.uk/stevenspark-juniors	Added
2022-06-05 12:18:43.833714				
