Date	Event	Country	Cancellation Note	Website
2024-02-10	Barclay parkrun	United Kingdom	Cancelled due to flooding around the lake.	https://www.parkrun.org.uk/barclay
2024-02-10	Evesham parkrun	United Kingdom	Flooding on the course.	https://www.parkrun.org.uk/evesham
2024-02-10	Fuldaaue parkrun	Germany	Course unsafe or blocked	https://www.parkrun.com.de/fuldaaue
2024-02-10	Grove Fields parkrun	United Kingdom	Waterlogged course	https://www.parkrun.org.uk/grovefields
2024-02-10	Minehead parkrun	United Kingdom	Works on the course making it too narrow	https://www.parkrun.org.uk/minehead
2024-02-11	Evesham junior parkrun	United Kingdom	Weather	https://www.parkrun.org.uk/evesham-juniors
2024-02-11	Wotton Community PARC junior parkrun	United Kingdom	Weather	https://www.parkrun.org.uk/wottoncommunityparc-juniors
2024-02-08 21:12:30.254350			
