Date	Event	Country	Cancellation Note	Website	Added or Removed
2024-05-11	Beckton parkrun	United Kingdom	Venue unavailable	https://www.parkrun.org.uk/beckton	Added
2024-05-11	Tramore parkrun, Waterford	Ireland	Truck show on and access to route will be blocked	https://www.parkrun.ie/tramore	Added
2024-05-12	Bellevue Park junior parkrun	Australia	Shortage of volunteers	https://www.parkrun.com.au/bellevuepark-juniors	Added
2024-05-12	Paddington Rec junior parkrun	United Kingdom	Course unsafe or blocked	https://www.parkrun.org.uk/paddingtonrec-juniors	Added
2024-05-12	Whaley Bridge junior parkrun	United Kingdom	Course unsafe or blocked	https://www.parkrun.org.uk/whaleybridge-juniors	Added
2024-05-09 21:14:56.501546				
