Date	Event	Country	Cancellation Note	Website	Added or Removed
2022-03-26	Brighouse parkrun	United Kingdom	Flood damage to the park	https://www.parkrun.org.uk/brighouse	Added
2022-03-26	Chipping Norton parkrun	Australia	Wet and muddy course	https://www.parkrun.com.au/chippingnorton	Added
2022-03-26	Dreiländergarten parkrun	Germany	Due to lack of volunteers	https://www.parkrun.com.de/dreilaendergarten	Added
2022-03-26	Menai parkrun	Australia	Course not safe due to weather.	https://www.parkrun.com.au/menai	Added
2022-03-26	Shepparton parkrun	Australia	major event on at the lake and course safety	https://www.parkrun.com.au/shepparton	Added
2022-03-26	Toboshane Valley Estate parkrun	South Africa	Route inaccessible due to heavy rain		Added
2022-03-26	Western Springs parkrun	New Zealand	Couldnt get enough volunteers	https://www.parkrun.co.nz/westernsprings	Added
2022-03-26	White Rock parkrun	Australia	Trail damage - advised by ICC to close	https://www.parkrun.com.au/whiterock	Added
2022-03-25 13:08:24.055548				
