Date	Event	Country	Cancellation Note	Website	Added or Removed
2023-06-17	Bellville parkrun	South Africa	Course waterlogged and unsafe. Extreme weather pre	https://www.parkrun.co.za/bellville	Added
2023-06-17	Betty’s Bay parkrun	South Africa	sinkhole on route with extreme weather conditions	https://www.parkrun.co.za/bettysbay	Added
2023-06-17	Duikersdrift parkrun, Tulbagh	South Africa	Course flooded due to heavy rains	https://www.parkrun.co.za/duikersdrift	Added
2023-06-17	Greenpoint parkrun	South Africa	Inclement weather. Flooding on the course.	https://www.parkrun.co.za/greenpoint	Added
2023-06-17	Melkbosstrand parkrun	South Africa	Extreme weather predicted	https://www.parkrun.co.za/melkbosstrand	Added
2023-06-17	Morecambe Prom parkrun	United Kingdom	Course unsafe or blocked	https://www.parkrun.org.uk/morecambeprom	Added
2023-06-17	Somerset West parkrun	South Africa	Course too flooded Causeway washed away, Hazardous	https://www.parkrun.co.za/somersetwest	Added
2023-06-17	University of Western Australia parkrun	Australia	Path closures near Student Central	https://www.parkrun.com.au/universityofwesternaustralia	Added
2023-06-16 12:35:14.503764				
