Date	Event	Country	Cancellation Note	Website
2023-04-01	Beverley Westwood parkrun	United Kingdom	Saturated course	https://www.parkrun.org.uk/beverleywestwood
2023-04-01	Hondajima parkrun	Japan	ボランティア不足のため	https://www.parkrun.jp/hondajima
2023-04-01	Maribyrnong parkrun	Australia	path upgrade works (Maribyrnong City Council)	https://www.parkrun.com.au/maribyrnong
2023-04-01	Somerdale Pavilion parkrun	United Kingdom	parts of course are under water (again)	https://www.parkrun.org.uk/somerdalepavilion
2023-04-01	Stratford Park parkrun, Stroud	United Kingdom	Course unsafe - wet and muddy due to heavy rain	https://www.parkrun.org.uk/stratfordparkstroud
2023-03-31 01:34:42.627477			
