Date	Event	Country	Cancellation Note	Website	Added or Removed
2022-07-23	Braidwood Showground parkrun	Australia	Course too wet.Would need flippers , not joggers.	https://www.parkrun.com.au/braidwoodshowground	Added
2022-07-23	Finsbury parkrun	United Kingdom	Site not cleared after festival due to hot weather	https://www.parkrun.org.uk/finsbury	Added
2022-07-23	Rouse Hill parkrun	Australia	Course too slippery and wet	https://www.parkrun.com.au/rousehill	Added
2022-07-23	The Venue parkrun	South Africa	No volunteers available	https://www.parkrun.co.za/thevenue	Added
2022-07-23	Yuuka Family Road parkrun	Japan	コロナウイルス感染症急拡大のため	https://www.parkrun.jp/yuukafamilyroad	Added
2022-07-24	Daventry Country Park junior parkrun	United Kingdom	There is a wasp nest on the run route	https://www.parkrun.org.uk/daventrycountrypark-juniors	Added
2022-07-22 15:25:14.002597				
