Event	Country	Cancellation Note	Website	Added or Removed
Eastbourne junior parkrun	United Kingdom	Lack of volunteers	https://www.parkrun.org.uk/eastbourne-juniors	Added
Prudhoe Riverside junior parkrun	United Kingdom	Poor weather conditions - likely icy on the course	https://www.parkrun.org.uk/prudhoeriverside-juniors	Added
Shelley junior parkrun	United Kingdom	The course is waterlogged and unsafe for runners	https://www.parkrun.org.uk/shelley-juniors	Added
parkrun Wolbrom	Poland	szukamy zespołu do prowadzenia spotkań	https://www.parkrun.pl/wolbrom	Added
2021-12-05 00:38:39.413475				
