Date	Event	Country	Cancellation Note	Website	Added or Removed
2024-09-28	Canons Park parkrun	United Kingdom	Course unsafe or blocked	https://www.parkrun.org.uk/canonspark	Added
2024-09-28	George Lane Memorial parkrun	Canada	Shortage of volunteers	https://www.parkrun.ca/georgelanememorial	Added
2024-09-28	Kingsbury Water parkrun	United Kingdom	Course unsafe or blocked	https://www.parkrun.org.uk/kingsburywater	Added
2024-09-28	Kirra parkrun	Australia	Weather	https://www.parkrun.com.au/kirra	Added
2024-09-28	Sixfields Upton parkrun	United Kingdom	Course unsafe or blocked	https://www.parkrun.org.uk/sixfieldsupton	Added
2024-09-28	Weedon Island Preserve parkrun	United States	Hurricane Helene Storm Surge Preventing Access	https://www.parkrun.us/weedonislandpreserve	Added
2024-09-29	Mallow Castle junior parkrun	Ireland	Weather	https://www.parkrun.ie/mallowcastle-juniors	Added
2024-09-29	St Mary’s Campus junior parkrun	Ireland	Weather	https://www.parkrun.ie/stmaryscampus-juniors	Added
2024-09-27 18:29:50.032530				
