Date	Event	Country	Cancellation Note	Website
2022-01-29	Jock Trail parkrun	South Africa	Due to heavy rain resulting in safety concerns.	https://www.parkrun.co.za/jocktrail
2022-01-29	Kariyashi sogoundo koen parkrun	Japan	COVID-19 (Coronavirus)	https://www.parkrun.jp/kariyashisogoundokoen
2022-01-29	Kathu parkrun	South Africa	Kathu Equestrain Club have Competitions on	https://www.parkrun.co.za/kathu
2022-01-29	Kungsängen parkrun	Sweden	Mycket is kvar på banan	https://www.parkrun.se/kungsangen
2022-01-29	Shimanami Earthland parkrun	Japan	COVID-19 (Coronavirus)	https://www.parkrun.jp/shimanamiearthland
2022-01-29	The Grand Canal Way parkrun, Tullamore	Ireland	Due to recent tragic events, parkrun cancelled.	https://www.parkrun.ie/thegrandcanalway
2022-01-29	parkrun Buzuluk Park Pushkina	Russia	трасса непригодна(заметена)	https://www.parkrun.ru/buzulukparkpushkina
2022-01-27 12:24:32.173890			
