Date	Event	Country	Cancellation Note	Website
2023-12-16	Aspen parkrun	United States	closed for winter season	https://www.parkrun.us/aspen
2023-12-16	Humber Bridge parkrun	United Kingdom	both routes unsuitable due to flooding	https://www.parkrun.org.uk/humberbridge
2023-12-16	Millennium parkrun	Canada	Venue unavailable	https://www.parkrun.ca/millennium
2023-12-16	Rostrevor parkrun	United Kingdom	Course unsafe or blocked	https://www.parkrun.org.uk/rostrevor
2023-12-16	Somerdale Pavilion parkrun	United Kingdom	Water above plimsoll line (and RD's wellies)	https://www.parkrun.org.uk/somerdalepavilion
2023-12-13 18:16:22.313563			
