Date	Event	Country	Cancellation Note	Website	Added or Removed
2022-04-16	New Farm parkrun	Australia	Cutter's Landing path works by BCC	https://www.parkrun.com.au/newfarm	Added
2022-04-16	Northparkes Oval parkrun	Australia	Not enough volunteers	https://www.parkrun.com.au/northparkesoval	Added
2022-04-16	Petrie parkrun	Australia	Part of course is damaged from recent rain/flood	https://www.parkrun.com.au/petrie	Added
2022-04-16	Rouse Hill parkrun	Australia	The course is wet and flooded in areas, unstable	https://www.parkrun.com.au/rousehill	Added
2022-04-16	The Terrace parkrun	Australia	flood damage to course	https://www.parkrun.com.au/theterrace	Added
2022-04-14 06:21:41.188883				
