Date	Event	Country	Cancellation Note	Website	Added or Removed
2025-01-18	Baltimore and Annapolis Trail parkrun	United States	Course unsafe or blocked	https://www.parkrun.us/baltimoreandannapolistrail	Added
2025-01-18	Ehrenbreitstein parkrun	Germany	Treibgut auf der Strecke nach Hochwasser	https://www.parkrun.com.de/ehrenbreitstein	Added
2025-01-18	Lousberg parkrun	Germany	Course unsafe or blocked	https://www.parkrun.com.de/lousberg	Added
2025-01-18	Ury Riverside parkrun	United Kingdom	course flooded in places..	https://www.parkrun.org.uk/uryriverside	Added
2025-01-18	Wolford Wood parkrun	United Kingdom	Course waterlogged	https://www.parkrun.org.uk/wolfordwood	Added
2025-01-19	Harold Park junior parkrun	United Kingdom	Weather	https://www.parkrun.org.uk/haroldpark-juniors	Added
2025-01-16 18:23:00.727616				
