Date	Event	Country	Cancellation Note	Website	Added or Removed
2022-08-20	Red Star parkrun	South Africa	Core Volunteer Team not available	https://www.parkrun.co.za/redstar	Added
2022-08-20	Shawnigan Hills parkrun	Canada	Not enough volunteers.	https://www.parkrun.ca/shawniganhills	Added
2022-08-21	Peoples Park junior parkrun	United Kingdom	event preparing to restart		Added
2022-08-21	Prudhoe Riverside junior parkrun	United Kingdom	The Jelly Tea race is using the park facilities	https://www.parkrun.org.uk/prudhoeriverside-juniors	Added
2022-08-18 18:20:36.845877				
