Date	Event	Country	Cancellation Note	Website
2025-11-22	Cypress Creek Park at Timberlane parkrun	United States	Weather	https://www.parkrun.us/cypresscreekparkattimberlane
2025-11-23	Belfast YMCA junior parkrun	United Kingdom	Shortage of volunteers	https://www.parkrun.org.uk/belfastymca-juniors
2025-11-23	Bretton Park junior parkrun	United Kingdom	Weather	https://www.parkrun.org.uk/brettonpark-juniors
2025-11-23	Des Connor Park junior parkrun	Australia	Weather	https://www.parkrun.com.au/desconnorpark-juniors
2025-11-23	Kellands Park junior parkrun	United Kingdom	Weather	https://www.parkrun.org.uk/kellandspark-juniors
2025-11-23	The Old Rail Trail junior parkrun	Ireland	Shortage of volunteers	https://www.parkrun.ie/theoldrailtrail-juniors
2025-11-22 21:16:43.563696			
