Date	Event	Country	Cancellation Note	Website
2023-05-27	Guildford parkrun	United Kingdom	Unauthorised encampment in Stoke Park	https://www.parkrun.org.uk/guildford
2023-05-27	Hart & Bosch Village parkrun	South Africa	Course waterlogged and unsafe due to heavy rains	https://www.parkrun.co.za/hartenboschvillage
2023-05-27	Lancefield parkrun	Australia	Equestrian event denying access to our course	https://www.parkrun.com.au/lancefield
2023-05-27	Sharpham Road Playing Fields parkrun	United Kingdom	Travellers’ vehicles on the course	https://www.parkrun.org.uk/sharphamroadplayingfields
2023-05-28	Guildford junior parkrun	United Kingdom	Travelling encampment on the route currently.	https://www.parkrun.org.uk/guildford-juniors
2023-05-28	Ormeau junior parkrun	United Kingdom	Core team unavailable	https://www.parkrun.org.uk/ormeau-juniors
2023-05-25 12:27:55.319684			
