Date	Event	Country	Cancellation Note	Website	Added or Removed
2022-11-19	Albury Wodonga parkrun	Australia	Flooding	https://www.parkrun.com.au/alburywodonga	Added
2022-11-19	Carlisle Park parkrun, Morpeth	United Kingdom	River has flooded and routes are not accessible.	https://www.parkrun.org.uk/carlislepark	Added
2022-11-19	Crathes Castle parkrun	United Kingdom	Severe weather today; flooding. Paths not safe	https://www.parkrun.org.uk/crathescastle	Added
2022-11-19	Shepparton parkrun	Australia	Course unsafe after flooding.	https://www.parkrun.com.au/shepparton	Added
2022-11-19	Ury Riverside parkrun	United Kingdom	Majority of the route is heavily flooded	https://www.parkrun.org.uk/uryriverside	Added
2022-11-18 09:22:08.092091				
