Date	Event	Country	Cancellation Note	Website	Added or Removed
2024-12-14	Abingdon parkrun	United Kingdom	Flooding	https://www.parkrun.org.uk/abingdon	Added
2024-12-14	Moreletapark Gemeente parkrun	South Africa	Course unsafe or blocked	https://www.parkrun.co.za/moreletaparkgemeente	Added
2024-12-14	parkrun Bulwar nad Wisłą	Poland	Zawody na trasie.	https://www.parkrun.pl/bulwarnadwisla	Added
2024-12-15	Clough Hall junior parkrun	United Kingdom	park remains closed due to fallen trees.	https://www.parkrun.org.uk/cloughhall-juniors	Added
2024-12-15	Ramsbottom junior parkrun	United Kingdom	Course unsafe or blocked	https://www.parkrun.org.uk/ramsbottom-juniors	Added
2024-12-12 12:37:38.799418				
