Date	Event	Country	Cancellation Note	Website	Added or Removed
2022-08-27	KM Reedy Reserve parkrun	Australia	Flooded course	https://www.parkrun.com.au/kmreedyreserve	Added
2022-08-27	Old Thomson River Road parkrun	Australia	Unable to attract sufficient volunteers	https://www.parkrun.com.au/oldthomsonriverroad	Added
2022-08-27	Peacehaven parkrun	United Kingdom	Obstructions on the course and safety issues.	https://www.parkrun.org.uk/peacehaven	Added
2022-08-27	Somerset West parkrun	South Africa	Course too flooded-Sections unpassable/dangerous	https://www.parkrun.co.za/somersetwest	Added
2022-08-27	The Terrace parkrun	Australia	mud on course making it slippery	https://www.parkrun.com.au/theterrace	Added
2022-08-26 12:45:55.070244				
