Date	Event	Country	Cancellation Note	Website
2022-01-15	Ally Pally parkrun	United Kingdom	Continuing repair works to paths on the course	https://www.parkrun.org.uk/allypally
2022-01-15	Jamaica Pond parkrun	United States	Cancelled: extreme cold!	https://www.parkrun.us/jamaicapond
2022-01-15	Kurt-Schumacher-Promenade parkrun	Germany	Aufgrund der aktuellen Infektionslage	https://www.parkrun.com.de/kurtschumacherpromenade
2022-01-15	The Grand Canal Way parkrun, Tullamore	Ireland	Due to tragic circumstances, event cancelled.	https://www.parkrun.ie/thegrandcanalway
2022-01-12 21:14:08.355181			
