Date	Event	Country	Cancellation Note	Website	Added or Removed
2024-09-28	Abingdon parkrun	United Kingdom	Flooding on the course and waterlogged ground	https://www.parkrun.org.uk/abingdon	Added
2024-09-28	Banbury parkrun	United Kingdom	Bad Weather and Course Waterlogged in places	https://www.parkrun.org.uk/banbury	Added
2024-09-28	Milton Keynes parkrun	United Kingdom	Course unsafe or blocked	https://www.parkrun.org.uk/miltonkeynes	Added
2024-09-28	Reading parkrun	United Kingdom	Course unsafe or blocked	https://www.parkrun.org.uk/reading	Added
2024-09-28	Ross-on-Wye parkrun	United Kingdom	Bruce Bogtrotter regurgitated mud cake on course	https://www.parkrun.org.uk/rossonwye	Added
2024-09-26 18:22:15.372794				
