Date	Event	Country	Cancellation Note	Website
2022-08-20	Balyang Sanctuary parkrun	Australia	Course flooded at 1.6km mark	https://www.parkrun.com.au/balyangsanctuary
2022-08-20	Jamestown Golf Course parkrun	Australia	Wet, slippery conditions and poor visibility.	https://www.parkrun.com.au/jamestowngolfcourse
2022-08-20	KM Reedy Reserve parkrun	Australia	Flooding on course	https://www.parkrun.com.au/kmreedyreserve
2022-08-20	Sanukikodomonokuni parkrun	Japan	熱中症警戒アラート	https://www.parkrun.jp/sanukikodomonokuni
2022-08-20 01:43:39.610249			
