Date	Event	Country	Cancellation Note	Website
2022-03-12	Bega parkrun	Australia	Flooding	https://www.parkrun.com.au/bega
2022-03-12	Kedron parkrun	Australia	Obstructions on course path	https://www.parkrun.com.au/kedron
2022-03-12	Meadowbrook parkrun	Australia	Flood damage and mud on paths. Course unsafe.	https://www.parkrun.com.au/meadowbrook
2022-03-12	Nulkaba parkrun	Australia	course uavailalble due to recent rain events	https://www.parkrun.com.au/nulkaba
2022-03-12	Petrie parkrun	Australia	Extensive flood damage to park; Machinery on site	https://www.parkrun.com.au/petrie
2022-03-12	Yowie parkrun	Australia	waiting for council approval (for safety)	https://www.parkrun.com.au/yowie
2022-03-10 03:20:12.959012			
