Date	Event	Country	Cancellation Note	Website	Added or Removed
2022-10-29	Southern Highlands Botanic Gardens parkrun	Australia	Course unavailable due to spring event in gardens	https://www.parkrun.com.au/southernhighlandsbotanicgardens	Added
2022-10-29	Victory Heights Trail parkrun	Australia	Trail maintenance taking place	https://www.parkrun.com.au/victoryheightstrail	Added
2022-10-29	Weedon Island Preserve parkrun	United States	The Preserve is holding its annual fundraiser 8K	https://www.parkrun.us/weedonislandpreserve	Added
2022-10-29	Welkom parkrun	South Africa	School Sport	https://www.parkrun.co.za/welkom	Added
2022-10-30	Brayton Academy junior parkrun	United Kingdom	Due to clashing with another event	https://www.parkrun.org.uk/braytonacademy-juniors	Added
2022-10-30	Bury St Edmunds junior parkrun	United Kingdom	St Ed’s Running Festival clashes with date	https://www.parkrun.org.uk/burystedmunds-juniors	Added
2022-10-30	Central Park junior parkrun, Boston	United Kingdom	The fair is in the park	https://www.parkrun.org.uk/centralparkboston-juniors	Added
2022-10-30	Cherry Orchard junior parkrun	Ireland	Core Team running and marshaling DCM	https://www.parkrun.ie/cherryorchard-juniors	Added
2022-10-30	Deerpark junior parkrun	Ireland	Dublin Marathon is on so not enough volunteers.	https://www.parkrun.ie/deerpark-juniors	Added
2022-10-30	Gnoll junior parkrun	United Kingdom	No run director available.	https://www.parkrun.org.uk/gnoll-juniors	Added
2022-10-30	Marlay junior parkrun	Ireland	Samhain Halloween event in park. Paths impacted	https://www.parkrun.ie/marlay-juniors	Added
2022-10-30	Play Close Park junior parkrun	United Kingdom	Aftermath of bonfire night event in park.	https://www.parkrun.org.uk/playclosepark-juniors	Added
2022-10-30	St Anne’s junior parkrun	Ireland	Event Team participating in Dublin City Marathon	https://www.parkrun.ie/stannes-juniors	Added
2022-10-30	Wardown junior parkrun	United Kingdom	Love Luton RunFest is taking place that day	https://www.parkrun.org.uk/wardown-juniors	Added
2022-10-30	Worksop College junior parkrun	United Kingdom	Local half marathon road closures	https://www.parkrun.org.uk/worksopcollege-juniors	Added
2022-10-24 02:19:53.147617				
