Date	Event	Country	Cancellation Note	Website	Added or Removed
2022-08-06	Eagan parkrun	United States	Lightning during start of race, and forecast	https://www.parkrun.us/eagan	Added
2022-08-07	Carmarthen junior parkrun	United Kingdom	Covid-19	https://www.parkrun.org.uk/carmarthen-juniors	Added
2022-08-07	Gadebridge Park junior parkrun	United Kingdom	Main footpath of route closed for resurfacing	https://www.parkrun.org.uk/gadebridgepark-juniors	Added
2022-08-07	Highbury Fields junior parkrun	United Kingdom	Police investigation - course unavailable	https://www.parkrun.org.uk/highburyfields-juniors	Added
2022-08-07	Telford junior parkrun	United Kingdom	Insufficient volunteers to safely run event	https://www.parkrun.org.uk/telford-juniors	Added
2022-08-06 21:14:56.757306				
