Date	Event	Country	Cancellation Note	Website	Added or Removed
2024-03-23	Canton Lower Rouge Trail parkrun	United States	Course unsafe or blocked	https://www.parkrun.us/cantonlowerrougetrail	Added
2024-03-23	Feltham parkrun	United Kingdom	short of staff		Added
2024-03-24	Gadebridge Park junior parkrun	United Kingdom	Course unsafe or blocked	https://www.parkrun.org.uk/gadebridgepark-juniors	Added
2024-03-24	Lovelace Primary School junior parkrun	United Kingdom	Course unsafe or blocked	https://www.parkrun.org.uk/lovelaceprimaryschool-juniors	Added
2024-03-23 15:14:27.487702				
