Date	Event	Country	Cancellation Note	Website	Added or Removed
2022-12-17	Aberdare parkrun	United Kingdom	Snow and Ice	https://www.parkrun.org.uk/aberdare	Added
2022-12-17	Ballincollig parkrun	Ireland	Dangerous icy conditions	https://www.parkrun.ie/ballincollig	Added
2022-12-17	Barnstaple parkrun	United Kingdom	Ice on course	https://www.parkrun.org.uk/barnstaple	Added
2022-12-17	Bickershaw parkrun	United Kingdom	Black Ice, paths slippery.		Added
2022-12-17	Bideford parkrun	United Kingdom	Icy conditions	https://www.parkrun.org.uk/bideford	Added
2022-12-17	Borrisokane Town parkrun	Ireland	Icy and slippy conditions	https://www.parkrun.ie/borrisokanetown	Added
2022-12-17	Bradford parkrun	United Kingdom	icy paths in park. Risk of injury too high	https://www.parkrun.org.uk/bradford	Added
2022-12-17	Bramley parkrun	United Kingdom	Icy paths.	https://www.parkrun.org.uk/bramley	Added
2022-12-17	Clevedon Salthouse Fields parkrun	United Kingdom	Ice	https://www.parkrun.org.uk/clevedonsalthousefields	Added
2022-12-17	Clonmel parkrun	Ireland	Black ice	https://www.parkrun.ie/clonmel	Added
2022-12-17	Colin Glen parkrun	United Kingdom	Ice on paths	https://www.parkrun.org.uk/colinglen	Added
2022-12-17	Corkagh parkrun	Ireland	Ice on course	https://www.parkrun.ie/corkagh	Added
2022-12-17	Crane Park parkrun	United Kingdom	Slippery conditions.	https://www.parkrun.org.uk/crane	Added
2022-12-17	Derry City parkrun	United Kingdom	ice on course.	https://www.parkrun.org.uk/derrycity	Added
2022-12-17	Derrynoid Forest parkrun	United Kingdom	Paths are unsafe because of weather	https://www.parkrun.org.uk/derrynoidforest	Added
2022-12-17	Dolgellau parkrun	United Kingdom	car park and course path iced over	https://www.parkrun.org.uk/dolgellau	Added
2022-12-17	Eden Project parkrun	United Kingdom	Black ice after rainfall on course. Too slippy	https://www.parkrun.org.uk/edenproject	Added
2022-12-17	Fairview parkrun	Ireland	Cancelled -  ice over night/dangerous paths	https://www.parkrun.ie/fairview	Added
2022-12-17	Fethard Town parkrun	Ireland	Paths dangerous	https://www.parkrun.ie/fethardtown	Added
2022-12-17	Garvagh Forest parkrun	United Kingdom	Route is frozen solid and unsafe to run.	https://www.parkrun.org.uk/garvaghforest	Added
2022-12-17	Glen River parkrun	Ireland	Ice and extremely slippy conditions on paths.	https://www.parkrun.ie/glenriver	Added
2022-12-17	Glengarriff parkrun	Ireland	Icy conditions on route and local roads	https://www.parkrun.ie/glengarriff	Added
2022-12-17	Gorey parkrun	Ireland	Paths too slippery. Sorry for the late notice.	https://www.parkrun.ie/gorey	Added
2022-12-17	Great Cornard parkrun	United Kingdom	Weather, unsafe	https://www.parkrun.org.uk/greatcornard	Added
2022-12-17	Haldon Forest parkrun	United Kingdom	Ice	https://www.parkrun.org.uk/haldonforest	Added
2022-12-17	Hanley parkrun	United Kingdom	Ice on paths	https://www.parkrun.org.uk/hanley	Added
2022-12-17	Heartlands parkrun	United Kingdom	Icy conditions	https://www.parkrun.org.uk/heartlands	Added
2022-12-17	Heslington parkrun	United Kingdom	Track closed due to icy conditions.	https://www.parkrun.org.uk/heslington	Added
2022-12-17	Kilkenny parkrun	Ireland	Weather Conditions not safe	https://www.parkrun.ie/kilkenny	Added
2022-12-17	Killerton parkrun	United Kingdom	Ice on course, too dangerous	https://www.parkrun.org.uk/killerton	Added
2022-12-17	Knocknacarra parkrun	Ireland	Icy footpaths	https://www.parkrun.ie/knocknacarra	Added
2022-12-17	Limerick parkrun	Ireland	Icy conditions	https://www.parkrun.ie/limerick	Added
2022-12-17	Linwood parkrun	United Kingdom	Tarmac paths icy	https://www.parkrun.org.uk/linwood	Added
2022-12-17	Listowel parkrun	Ireland	Unsafe, icy conditions around the park	https://www.parkrun.ie/listowel	Added
2022-12-17	Loch Leven parkrun	United Kingdom	ice, car park and course dangerous	https://www.parkrun.org.uk/lochleven	Added
2022-12-17	Lough Key parkrun	Ireland	Roads, paths + car park surface frozen + slippery	https://www.parkrun.ie/loughkey	Added
2022-12-17	Lower Drummans parkrun	United Kingdom	Frozen pathways		Added
2022-12-17	Lowestoft parkrun	United Kingdom	Ice conditions	https://www.parkrun.org.uk/lowestoft	Added
2022-12-17	MUSA Cookstown parkrun	United Kingdom	Icy patches around the course	https://www.parkrun.org.uk/musacookstown	Added
2022-12-17	Macroom Castle Demesne parkrun	Ireland	Black ice on the course	https://www.parkrun.ie/macroomcastledemesne	Added
2022-12-17	Mallow Castle parkrun	Ireland	Paths extremely icy. Unsafe for running	https://www.parkrun.ie/mallowcastle	Added
2022-12-17	Milford Waterfront parkrun	United Kingdom	Ice on course	https://www.parkrun.org.uk/milfordwaterfront	Added
2022-12-17	Montrose parkrun	United Kingdom	Unsafe due to black ice on majority of route.	https://www.parkrun.org.uk/montrose	Added
2022-12-17	Mullingar parkrun	Ireland	Parkrun route too dangerous with frost and ice	https://www.parkrun.ie/mullingar	Added
2022-12-17	Mungret parkrun	Ireland	The route is unsafe due to icy conditions.	https://www.parkrun.ie/mungret	Added
2022-12-17	Navan parkrun	Ireland	Course conditions unsafe due to weather, paths uns	https://www.parkrun.ie/navan	Added
2022-12-17	Newcastle West parkrun	Ireland	Ice on Park Run Route	https://www.parkrun.ie/newcastlewest	Added
2022-12-17	Northallerton parkrun	United Kingdom	Due to snow	https://www.parkrun.org.uk/northallerton	Added
2022-12-17	Penallta parkrun	United Kingdom	Weather	https://www.parkrun.org.uk/penallta	Added
2022-12-17	Penrose parkrun	United Kingdom	Dangerous ice in the car park and on the course	https://www.parkrun.org.uk/penrose	Added
2022-12-17	Plean parkrun	United Kingdom	Due to ice	https://www.parkrun.org.uk/plean	Added
2022-12-17	Portobello parkrun, Edinburgh	United Kingdom	Course is icy and unsafe	https://www.parkrun.org.uk/portobello	Added
2022-12-17	Portrack parkrun	United Kingdom	Ice on paths, unsafe to run the route		Added
2022-12-17	Royal Canal parkrun, Kilcock	Ireland	Icy dangerous path	https://www.parkrun.ie/royalcanalkilcock	Added
2022-12-17	Sandy Water parkrun	United Kingdom	Black ice on course	https://www.parkrun.org.uk/sandywater	Added
2022-12-17	Seaton parkrun	United Kingdom	Icy esplanade	https://www.parkrun.org.uk/seaton	Added
2022-12-17	Skipton parkrun	United Kingdom	Rain falling turnimg to ice on course	https://www.parkrun.org.uk/skipton	Added
2022-12-17	Somerset West parkrun	South Africa	Drift too flooded to cross after heavy rain	https://www.parkrun.co.za/somersetwest	Added
2022-12-17	Springburn parkrun, Glasgow	United Kingdom	Frozen course. Treacherous conditions	https://www.parkrun.org.uk/springburn	Added
2022-12-17	Stormont parkrun	United Kingdom	Weather. Paths are icy and slippery.	https://www.parkrun.org.uk/stormont	Added
2022-12-17	Stretford parkrun	United Kingdom	Too icy just before we started	https://www.parkrun.org.uk/stretford	Added
2022-12-17	Templemore parkrun	Ireland	Ice on the route due to overnight rain freezing.	https://www.parkrun.ie/templemore	Added
2022-12-17	Tern Hill parkrun	United Kingdom	Unsafe course due to hard frost.		Added
2022-12-17	The Spinney parkrun	United Kingdom	Health and Safety concerns.		Added
2022-12-17	The Wammy parkrun	United Kingdom	current rain is freezing on paths, unsafe to run	https://www.parkrun.org.uk/thewammy	Added
2022-12-17	Tolka Valley parkrun	Ireland	Dangerous due to ice after inspection.	https://www.parkrun.ie/tolkavalley	Added
2022-12-17	Tullow parkrun	Ireland	Ice on course	https://www.parkrun.ie/tullow	Added
2022-12-17	Wakefield Thornes parkrun	United Kingdom	Incident in park just prior to start	https://www.parkrun.org.uk/wakefieldthornes	Added
2022-12-17	Waterford Nature parkrun	Ireland	Safety concerns due to icy patches on the course	https://www.parkrun.ie/waterfordnature	Added
2022-12-17	West Links parkrun	United Kingdom	Slippy patches concealed by frost: unsafe	https://www.parkrun.org.uk/westlinks	Added
2022-12-17	Whinlatter Forest parkrun	United Kingdom	Course Inspection found the course to be too icy	https://www.parkrun.org.uk/whinlatterforest	Added
2022-12-17	Whitstable parkrun	United Kingdom	Ice on course	https://www.parkrun.org.uk/whitstable	Added
2022-12-17	Woodbank parkrun	United Kingdom	Park has turned into an ice rink - very slippery	https://www.parkrun.org.uk/woodbank	Added
2022-12-17	Workington parkrun	United Kingdom	Extensive black ice	https://www.parkrun.org.uk/workington	Added
2022-12-18	Beehive junior parkrun	United Kingdom	Frozen car park, frozen paths and unsafe.	https://www.parkrun.org.uk/beehive-juniors	Added
2022-12-18	Brighouse junior parkrun	United Kingdom	Freezing temperatures overnight	https://www.parkrun.org.uk/brighouse-juniors	Added
2022-12-18	Cambourne junior parkrun	United Kingdom	Snow and ice on the course	https://www.parkrun.org.uk/cambourne-juniors	Added
2022-12-18	Crystal Palace junior parkrun	United Kingdom	route unsafe due to ice.	https://www.parkrun.org.uk/crystalpalace-juniors	Added
2022-12-18	Dartford junior parkrun	United Kingdom	Course unsafe due to ice	https://www.parkrun.org.uk/dartford-juniors	Added
2022-12-18	Eastbourne junior parkrun	United Kingdom	Lack of volunteers and ice.	https://www.parkrun.org.uk/eastbourne-juniors	Added
2022-12-18	Eaton junior parkrun	United Kingdom	Ice, ice and more ice	https://www.parkrun.org.uk/eaton-juniors	Added
2022-12-18	Fife Cycle Park junior parkrun	United Kingdom	Too slippy on the track. Been frozen all week	https://www.parkrun.org.uk/fifecyclepark-juniors	Added
2022-12-18	Kenton Rec junior parkrun	United Kingdom	Course is unsafe due to ice.	https://www.parkrun.org.uk/kentonrec-juniors	Added
2022-12-18	King George junior parkrun	United Kingdom	Icy conditions on footpaths	https://www.parkrun.org.uk/kinggeorge-juniors	Added
2022-12-18	Leyton Jubilee junior parkrun	United Kingdom	Icy paths in the park	https://www.parkrun.org.uk/leytonjubilee-juniors	Added
2022-12-18	Manor Park junior parkrun	United Kingdom	Snow and ice very likely on the course.	https://www.parkrun.org.uk/manorpark-juniors	Added
2022-12-18	Marlay junior parkrun	Ireland	Paths unsafe due to frost	https://www.parkrun.ie/marlay-juniors	Added
2022-12-18	Park Wood junior parkrun	United Kingdom	Snow and ice on the field .	https://www.parkrun.org.uk/parkwood-juniors	Added
2022-12-18	Pinner Village Gardens junior parkrun	United Kingdom	Icy paths predicted with sub 0° overnight	https://www.parkrun.org.uk/pinnervillagegardens-juniors	Added
2022-12-18	Ramsbottom junior parkrun	United Kingdom	Impacted ice and snow on the course - dangerous	https://www.parkrun.org.uk/ramsbottom-juniors	Added
2022-12-18	Redcar junior parkrun	United Kingdom	Sleet showers and -2 degrees forecast	https://www.parkrun.org.uk/redcar-juniors	Added
2022-12-18	Riverside junior parkrun	United Kingdom	The paths are icy and dangerous.	https://www.parkrun.org.uk/riverside-juniors	Added
2022-12-18	Ryelands Park junior parkrun	United Kingdom	Lack of volunteers means we can't run the event sa	https://www.parkrun.org.uk/ryelandspark-juniors	Added
2022-12-18	Sedgefield junior parkrun	United Kingdom	Continued icy conditions making the course unsafe	https://www.parkrun.org.uk/sedgefield-juniors	Added
2022-12-18	Skelmersdale junior parkrun	United Kingdom	Ice on the course, unsafe to proceed	https://www.parkrun.org.uk/skelmersdale-juniors	Added
2022-12-18	South Beach Estate junior parkrun	United Kingdom	Ive on course	https://www.parkrun.org.uk/southbeachestate-juniors	Added
2022-12-18	Torvean junior parkrun	United Kingdom	Icy paths- unsafe conditions	https://www.parkrun.org.uk/torvean-juniors	Added
2022-12-18	West End junior parkrun	United Kingdom	Lack of volunteers and weather warning for Ice.	https://www.parkrun.org.uk/westend-juniors	Added
2022-12-18	Whitelands Farm junior parkrun	United Kingdom	Icy conditions, course unsafe	https://www.parkrun.org.uk/whitelandsfarm-juniors	Added
2022-12-18	Wilton Park junior parkrun	United Kingdom	Paths icy and too unsafe for running	https://www.parkrun.org.uk/wiltonpark-juniors	Added
2022-12-18	Wycombe Rye junior parkrun	United Kingdom	Icy ground conditions on course	https://www.parkrun.org.uk/wycomberye-juniors	Added
2022-12-17 12:23:49.676826				
