Date	Event	Country	Cancellation Note	Website
2022-11-19	Alderford Lake parkrun	United Kingdom	No RD available	https://www.parkrun.org.uk/alderfordlake
2022-11-19	Avery Beach parkrun, Huntsville	Canada	Closed for Season - Unsuitable course conditions	https://www.parkrun.ca/averybeach
2022-11-19	Bathurst parkrun	Australia	Flooding of river	https://www.parkrun.com.au/bathurst
2022-11-19	Braidwood Showground parkrun	Australia	Showground closed due to works being done	https://www.parkrun.com.au/braidwoodshowground
2022-11-19	Cobram parkrun	Australia	River flooding	https://www.parkrun.com.au/cobram
2022-11-19	Cranleigh parkrun	United Kingdom	ongoing park redevelopment	https://www.parkrun.org.uk/cranleigh
2022-11-19	Croxteth Hall parkrun	United Kingdom	Movember 5k, 10k & half marathon event in park	https://www.parkrun.org.uk/croxtethhall
2022-11-19	Deep Run parkrun	United States	Another event in the park	https://www.parkrun.us/deeprun
2022-11-19	Echuca Moama parkrun	Australia	Safety: Course flooding	https://www.parkrun.com.au/echucamoama
2022-11-19	Edwin Carolan Community parkrun	Ireland	Building Works on Track For For-seeable Future	https://www.parkrun.ie/edwincarolancommunity
2022-11-19	Exploration Place parkrun	United States	Route conflict with Wichita Turkey Trot	https://www.parkrun.us/explorationplace
2022-11-19	Ficksburg parkrun	South Africa	Cherry Festival Golf Classic on course.	https://www.parkrun.co.za/ficksburg
2022-11-19	Greenpoint parkrun	South Africa	Road works. New route to be approved.	https://www.parkrun.co.za/greenpoint
2022-11-19	Guysborough Nature Trail parkrun	Canada	bereavement in community	
2022-11-19	Heaton parkrun	United Kingdom	Morunning Event taking place in the park	https://www.parkrun.org.uk/heaton
2022-11-20	Helix junior parkrun	United Kingdom	Falkirk Half Marathon using park and facilities	https://www.parkrun.org.uk/helix-juniors
2022-11-19	Iron Throne Trail parkrun	South Africa	looking for new route	https://www.parkrun.co.za/ironthronetrail
2022-11-19	Kameeldoring parkrun	South Africa	Bushveld Classic Golfday	https://www.parkrun.co.za/kameeldoring
2022-11-19	Kathu parkrun	South Africa	Horse club have compitions on.	https://www.parkrun.co.za/kathu
2022-11-19	Kerang Regional parkrun	Australia	Flooding, part of alternate track is unusable.	https://www.parkrun.com.au/kerangregional
2022-11-19	Lancing Beach Green parkrun	United Kingdom	Beach Green waterlogged and very muddy	https://www.parkrun.org.uk/lancingbeachgreen
2022-11-19	Lytham Hall parkrun	United Kingdom	Hopeful and Glorious craft fair	https://www.parkrun.org.uk/lythamhall
2022-11-19	McAllister parkrun	United States	This event is closed until further notice.	
2022-11-19	Melaleuca parkrun	Australia	Insufficient Rec Staff Available	
2022-11-19	Middelburg parkrun	South Africa	Venue no longer available.	https://www.parkrun.co.za/middelburg
2022-11-19	Mildura Weir parkrun	Australia	Flooding	https://www.parkrun.com.au/milduraweir
2022-11-19	Murray Bridge parkrun	Australia	course has been affected by recent weather	https://www.parkrun.com.au/murraybridge
2022-11-19	Nagaragawa koen parkrun	Japan	他のイベント開催のため、中止します。	https://www.parkrun.jp/nagaragawakoen
2022-11-19	Narromine Wetlands parkrun	Australia	Water on the track making it unsafe	https://www.parkrun.com.au/narrominewetlands
2022-11-19	Newport parkrun	United Kingdom	Temporary closure due to groundworks on site	https://www.parkrun.org.uk/newport
2022-11-19	Ormskirk parkrun	United Kingdom	University open day	https://www.parkrun.org.uk/ormskirk
2022-11-19	Pakapakanthi parkrun	Australia	Car race setup and packdown using parts of course	https://www.parkrun.com.au/pakapakanthi
2022-11-19	Pont y Bala parkrun	United Kingdom	Course closed due to flood defence work	https://www.parkrun.org.uk/pontybala
2022-11-19	Port Augusta parkrun	Australia	Triathlon event on the path, area unusable	https://www.parkrun.com.au/portaugusta
2022-11-19	Presint 18 parkrun, Putrajaya	Malaysia	general election	https://www.parkrun.my/presint18
2022-11-19	Queenstown parkrun	New Zealand	Queenstown Marathon	https://www.parkrun.co.nz/queenstown
2022-11-20	Riverside junior parkrun, St Neots	United Kingdom	St Neots half marathon	https://www.parkrun.org.uk/riversidestneots-juniors
2022-11-20	Shipley Country junior parkrun	United Kingdom	10k event on in park, using key parts of route	https://www.parkrun.org.uk/shipleycountry-juniors
2022-11-19	Shirahama koen parkrun	Japan	WRC関連イベント開催のため公園使用不可	https://www.parkrun.jp/shirahamakoen
2022-11-19	Tamagawa chuo koen parkrun	Japan	第31回西多摩地域広域行政圏体育大会と福生市市民輝きフェスティバルが開催。公園の使用不可のため。	https://www.parkrun.jp/tamagawachuokoen
2022-11-19	Taman Pudu Ulu parkrun	Malaysia	general election	https://www.parkrun.my/tamanpuduulu
2022-11-19	Taman Tasik Danau Kota parkrun	Malaysia	This event is closed until further notice.	https://www.parkrun.my/tamantasikdanaukota
2022-11-20	Torbay Velopark junior parkrun	United Kingdom	National Trophy Cyclocross on Velopark	https://www.parkrun.org.uk/torbayvelopark-juniors
2022-11-19	Torbay Velopark parkrun	United Kingdom	Cycle event at Torbay Velopark	https://www.parkrun.org.uk/torbayvelopark
2022-11-20	Tyne Green junior parkrun	United Kingdom	No event. Starts on 27/11	
2022-11-19	Upton House parkrun	United Kingdom	MoRun taking place in the park	https://www.parkrun.org.uk/uptonhouse
2022-11-19	Warrandyte River Reserve parkrun	Australia	Path damage from flooding	https://www.parkrun.com.au/warrandyteriverreserve
2022-11-19	Waterfall parkrun	South Africa	True Love: All a Women Needs Event MOA	https://www.parkrun.co.za/waterfall
2022-11-19	Werribee Park Mansion parkrun	Australia	Damage to course	https://www.parkrun.com.au/werribeeparkmansion
2022-11-19	Windhoek parkrun	South Africa	Golf tournament on course	https://www.parkrun.co.za/windhoek
2022-11-19	parkrun de Fontainebleau	France	parkrun est actuellement suspendu en France	https://www.parkrun.fr/fontainebleau
2022-11-19	parkrun de Montsouris	France	parkrun est actuellement suspendu en France	https://www.parkrun.fr/montsouris
2022-11-19	parkrun de Rouen	France	parkrun est actuellement suspendu en France	https://www.parkrun.fr/rouen
2022-11-19	parkrun de la Ramée	France	parkrun est actuellement suspendu en France	https://www.parkrun.fr/laramee
2022-11-19	parkrun des Dougnes, Cubnezais	France	parkrun est actuellement suspendu en France	https://www.parkrun.fr/lesdougnes
2022-11-19	parkrun du Bois de Boulogne, Paris	France	parkrun est actuellement suspendu en France	https://www.parkrun.fr/boisdeboulogne
2022-11-19	parkrun du Château de Pierre de Bresse	France	parkrun est actuellement suspendu en France	https://www.parkrun.fr/chateaudepierredebresse
2022-11-19	parkrun du Lac de Divonne	France	parkrun est actuellement suspendu en France	https://www.parkrun.fr/lacdedivonne
