Date	Event	Country	Cancellation Note	Website	Added or Removed
2024-01-13	Butter Trail parkrun	Canada	Course unsafe or blocked	https://www.parkrun.ca/buttertrail	Added
2024-01-13	Canton Lower Rouge Trail parkrun	United States	Weather	https://www.parkrun.us/cantonlowerrougetrail	Added
2024-01-13	Courthouse Lake parkrun	United States	Weather	https://www.parkrun.us/courthouselake	Added
2024-01-13	Eramosa River Trail parkrun	Canada	Weather	https://www.parkrun.ca/eramosarivertrail	Added
2024-01-13	Mary S. Young parkrun	United States	winter storm warning in affect	https://www.parkrun.us/marysyoung	Added
2024-01-13	Sippo Lake parkrun	United States	Weather	https://www.parkrun.us/sippolake	Added
2024-01-13	Victoria parkrun, Kitchener	Canada	due to poor weather conditions	https://www.parkrun.ca/victoriakitchener	Added
2024-01-13 01:00:43.598007				
