Date	Event	Country	Cancellation Note	Website	Added or Removed
2023-06-24	Guildford parkrun	United Kingdom	Unauthorised encampment in Stoke Park	https://www.parkrun.org.uk/guildford	Removed
2023-06-24	Mapetla parkrun	South Africa	The key volunteers are not available	https://www.parkrun.co.za/mapetla	Added
2023-06-24	Torbay Velopark parkrun	United Kingdom	Course unsafe or blocked	https://www.parkrun.org.uk/torbayvelopark	Added
2023-06-25	Torbay Velopark junior parkrun	United Kingdom	Course unsafe or blocked	https://www.parkrun.org.uk/torbayvelopark-juniors	Added
2023-06-23 18:23:32.682356				
