Date	Event	Country	Cancellation Note	Website	Added or Removed
2024-10-12	Ford parkrun	United Kingdom	Building work in park	https://www.parkrun.org.uk/ford	Added
2024-10-12	New Earswick parkrun	United Kingdom	Venue unavailable	https://www.parkrun.org.uk/newearswick	Added
2024-10-12	Ury Riverside parkrun	United Kingdom	path upgrade work means route blocked in places.	https://www.parkrun.org.uk/uryriverside	Added
2024-10-13	Washingbay Wetlands junior parkrun	United Kingdom	Event in community center, and can’t close carpark	https://www.parkrun.org.uk/washingbaywetlands-juniors	Added
2024-10-08 01:18:17.315762				
