Date	Event	Country	Cancellation Note	Website
2022-12-31	Bellevue parkrun	Canada	CLOSED FOR THE WINTER ! BE SAFE OUT THERE	https://www.parkrun.ca/bellevue
2022-12-31	Dusi parkrun	South Africa	Flooding has made part of the course unusable	https://www.parkrun.co.za/dusi
2022-12-31	Stonehouse parkrun	United Kingdom	Waterlogged course; likely damage to the field.	https://www.parkrun.org.uk/stonehouse
2023-01-01	Arklow Duck Pond junior parkrun	Ireland	No event	https://www.parkrun.ie/arklowduckpond-juniors
2022-12-30 12:33:59.894979			
