Date	Event	Country	Cancellation Note	Website
2024-01-20	Butter Trail parkrun	Canada	Course unsafe or blocked	https://www.parkrun.ca/buttertrail
2024-01-20	Mary S. Young parkrun	United States	Icy & snowy conditions make the course unsafe	https://www.parkrun.us/marysyoung
2024-01-20	Noel Booth Community parkrun	Canada	Weather	https://www.parkrun.ca/noelboothcommunity
2024-01-20	Oyodogawa shiminryokuchi parkrun	Japan	Weather	https://www.parkrun.jp/oyodogawashiminryokuchi
2024-01-20	Warren County Armco parkrun	United States	Weather	https://www.parkrun.us/warrencountyarmco
2024-01-20 03:13:59.923961			
