Date	Event	Country	Cancellation Note	Website
2022-08-20	Kathu parkrun	South Africa	Horse club have compitions on.	https://www.parkrun.co.za/kathu
2022-08-20	Pobalscoil na Tríonóide parkrun	Ireland	Ongoing Construction Work	https://www.parkrun.ie/pobalscoilnatrionoide
2022-08-20	Springbok parkrun	South Africa	Local Fundraising event at the same venue	https://www.parkrun.co.za/springbok
2022-08-21	Bodington junior parkrun	United Kingdom	All day event at venue	https://www.parkrun.org.uk/bodington-juniors
2022-08-21	Dukeries junior parkrun	United Kingdom	Insufficient volunteers due to holiday and illness	https://www.parkrun.org.uk/dukeries-juniors
2022-08-17 15:20:22.930335			
