Date	Event	Country	Cancellation Note	Website
2024-12-28	Clifton parkrun	United Kingdom	Course unsafe or blocked	https://www.parkrun.org.uk/clifton
2024-12-28	Gilloolys parkrun	South Africa	The venue is too dirty and littered from day visit	https://www.parkrun.co.za/gilloolys
2024-12-28	New York Central Fitness Trail parkrun	Canada	Weather	https://www.parkrun.ca/newyorkcentralfitnesstrail
2024-12-28	Terra Nova parkrun	South Africa	Course unsafe or blocked	https://www.parkrun.co.za/terranova
2024-12-29	Killarney House junior parkrun	Ireland	Christmas Break	https://www.parkrun.ie/killarneyhouse-juniors
2024-12-27 21:19:04.045390			
