Date	Event	Country	Cancellation Note	Website	Added or Removed
2022-07-02	Broadbeach Waters parkrun	Australia	Clash with the Gold Coast Marathon Weekend	https://www.parkrun.com.au/broadbeachwaters	Added
2022-07-02	Claisebrook Cove parkrun	Australia	Awaiting renewal of permit	https://www.parkrun.com.au/claisebrookcove	Added
2022-07-02	Cloncurry parkrun	Australia	Wet & slippery conditions	https://www.parkrun.com.au/cloncurry	Added
2022-07-02	Dhurringile parkrun	Australia	Insufficient Rec Staff Available		Added
2022-07-02	Gayndah River Walk parkrun	Australia	wet weather and safety	https://www.parkrun.com.au/gayndahriverwalk	Added
2022-07-02	Old Thomson River Road parkrun	Australia	Rainfall likely to lead to water on course	https://www.parkrun.com.au/oldthomsonriverroad	Added
2022-07-02	Waterloo Plains parkrun	Australia	Course is wet, slippery and dangerous	https://www.parkrun.com.au/waterlooplains	Added
2022-07-02	White Rock parkrun	Australia	estate closed until later on Saturday	https://www.parkrun.com.au/whiterock	Added
2022-07-01 06:29:22.460567				
