Date	Event	Country	Cancellation Note	Website
2023-05-20	Dusi parkrun	South Africa	Rain has made parts of the course unsafe to use	https://www.parkrun.co.za/dusi
2023-05-20	Glass House Mountains Conservation parkrun	Australia	Trail tunnelled out by water - track unsafe.	https://www.parkrun.com.au/glasshousemountainsconservation
2023-05-20	Guildford parkrun	United Kingdom	Caravans in the park; possible vehicle movements.	https://www.parkrun.org.uk/guildford
2023-05-20	Marecchia parkrun	Italy	Parco danneggiato dall'alluvione.	https://www.parkrun.it/marecchia
2023-05-20	Toboshane Valley Estate parkrun	South Africa	Terrain still wet and slippery after recent rains	https://www.parkrun.co.za/toboshanevalleyestate
2023-05-21	Guildford junior parkrun	United Kingdom	Caravans and Cars on Stoke Park	https://www.parkrun.org.uk/guildford-juniors
2023-05-19 12:32:49.922241			
