Date	Event	Country	Cancellation Note	Website	Added or Removed
2022-07-30	Century City parkrun	South Africa	Event cancelled due to construction on the route	https://www.parkrun.co.za/centurycity	Added
2022-07-30	Cowpasture Reserve parkrun, Camden	Australia	Path unsafe due to recent flooding damage	https://www.parkrun.com.au/cowpasturereservecamden	Added
2022-07-30	Dunedin parkrun	New Zealand	Slip on the course, detour not possible	https://www.parkrun.co.nz/dunedin	Added
2022-07-30	Porirua parkrun	New Zealand	Trees down across the track.	https://www.parkrun.co.nz/porirua	Added
2022-07-29 09:23:12.533152				
