Date	Event	Country	Cancellation Note	Website	Added or Removed
2022-11-12	Sixmilewater parkrun	United Kingdom	Key paths unsuitable due to ongoing repair work.	https://www.parkrun.org.uk/sixmilewater	Added
2022-11-12	South Para Reservoir parkrun	Australia	course flooded	https://www.parkrun.com.au/southparareservoir	Added
2022-11-12	Taman Tasik Danau Kota parkrun	Malaysia	This event is closed until further notice.	https://www.parkrun.my/tamantasikdanaukota	Added
2022-11-12	Varsity Lakes parkrun	Australia	PanPac Masters games dragon boat event same time.	https://www.parkrun.com.au/varsitylakes	Added
2022-11-12	Walton parkrun	United Kingdom	Event closed		Added
2022-11-12	Westport parkrun	Ireland	Course in use for Sea2Summit	https://www.parkrun.ie/westport	Added
2022-11-12	parkrun de Fontainebleau	France	parkrun est actuellement suspendu en France	https://www.parkrun.fr/fontainebleau	Added
2022-11-12	parkrun de Montsouris	France	parkrun est actuellement suspendu en France	https://www.parkrun.fr/montsouris	Added
2022-11-12	parkrun de Rouen	France	parkrun est actuellement suspendu en France	https://www.parkrun.fr/rouen	Added
2022-11-12	parkrun de la Ramée	France	parkrun est actuellement suspendu en France	https://www.parkrun.fr/laramee	Added
2022-11-12	parkrun des Dougnes, Cubnezais	France	parkrun est actuellement suspendu en France	https://www.parkrun.fr/lesdougnes	Added
2022-11-12	parkrun du Bois de Boulogne, Paris	France	parkrun est actuellement suspendu en France	https://www.parkrun.fr/boisdeboulogne	Added
2022-11-12	parkrun du Château de Pierre de Bresse	France	parkrun est actuellement suspendu en France	https://www.parkrun.fr/chateaudepierredebresse	Added
2022-11-12	parkrun du Lac de Divonne	France	parkrun est actuellement suspendu en France	https://www.parkrun.fr/lacdedivonne	Added
2022-11-13	Bramley junior parkrun	United Kingdom	Remembrance Day service in the park	https://www.parkrun.org.uk/bramley-juniors	Added
2022-11-13	Goudhurst junior parkrun	United Kingdom	Remembrance Sunday - field in use.	https://www.parkrun.org.uk/goudhurst-juniors	Added
2022-11-13	Hucknall junior parkrun	United Kingdom	Event in park	https://www.parkrun.org.uk/hucknall-juniors	Added
2022-11-13	Ipswich junior parkrun	United Kingdom	Remembrance Sunday activity in park using route	https://www.parkrun.org.uk/ipswich-juniors	Added
2022-11-13	Pontypridd junior parkrun	United Kingdom	Remembrance Sunday	https://www.parkrun.org.uk/pontypridd-juniors	Added
2022-11-13	Queen’s Parade junior parkrun, Aldershot	United Kingdom	Truce Tournament in field	https://www.parkrun.org.uk/queensparade-juniors	Added
2022-11-13	Rushcliffe junior parkrun	United Kingdom	Our event is making way for Walk with Joe today!	https://www.parkrun.org.uk/rushcliffe-juniors	Added
2022-11-13	Torridge junior parkrun	United Kingdom	Remembrance Parade on our course	https://www.parkrun.org.uk/torridge-juniors	Added
2022-11-13	Town Moor junior parkrun	United Kingdom	Another running event taking place on our course	https://www.parkrun.org.uk/townmoor-juniors	Added
2022-11-13	Tyne Green junior parkrun	United Kingdom	Pre launch starts 27/11		Added
2022-11-13	War Memorial Park junior parkrun	United Kingdom	Remembrance Day service in the park	https://www.parkrun.org.uk/warmemorialpark-juniors	Added
2022-11-13	Wimpole Estate junior parkrun	United Kingdom	Remembrance Sunday - volunteers at other events	https://www.parkrun.org.uk/wimpoleestate-juniors	Added
2022-11-13	Yatton Recreation junior parkrun	United Kingdom	Remembrance Sunday - Road Closed	https://www.parkrun.org.uk/yattonrecreation-juniors	Added
2022-11-07 01:39:16.033214				
