Date	Event	Country	Cancellation Note	Website	Added or Removed
2023-01-14	Centenary parkrun	Australia	Council has closed venue access due to bats	https://www.parkrun.com.au/centenary	Added
2023-01-14	Gisborne parkrun	New Zealand	Debris and mud/silt on course flooding.	https://www.parkrun.co.nz/gisborne	Added
2023-01-14	Haverhill parkrun	United Kingdom	Waterlogged course, muddy and extremely slippery.	https://www.parkrun.org.uk/haverhill	Added
2023-01-14	Newport parkrun	United Kingdom	Groundworks on going - course unusable	https://www.parkrun.org.uk/newport	Added
2023-01-12 01:14:50.196610				
