Date	Event	Country	Cancellation Note	Website
2022-07-02	Anstey Hill Recreation parkrun	Australia	inability to fill necessary volunteer roles	https://www.parkrun.com.au/ansteyhillrecreation
2022-07-02	East Richmond parkrun	Australia	due to inclement weather	https://www.parkrun.com.au/eastrichmond
2022-07-02	Jamaica Pond parkrun	United States	Potential thunderstorms and heavy rain	https://www.parkrun.us/jamaicapond
2022-07-02	Larne parkrun	United Kingdom	Unavailability of Core Team	https://www.parkrun.org.uk/larne
2022-07-02	Rouse Hill parkrun	Australia	Course too wet and slippery	https://www.parkrun.com.au/rousehill
2022-07-01 15:25:49.191944			
