Date	Event	Country	Cancellation Note	Website	Added or Removed
2022-08-13	Dubbo parkrun	Australia	River bank erosion from flooding affecting path	https://www.parkrun.com.au/dubbo	Added
2022-08-13	Fodder Forest parkrun	Australia	Boardwalk under repair and not able to be used	https://www.parkrun.com.au/fodderforest	Added
2022-08-13	Hondajima parkrun	Japan	台風による危険が予想されるため	https://www.parkrun.jp/hondajima	Added
2022-08-13	Jindabyne Sport and Recreation parkrun	Australia	Insufficient volunteers	https://www.parkrun.com.au/jindabynesportandrecreation	Added
2022-08-13	Mudgee parkrun	Australia	Park closed due to path damage and flooding	https://www.parkrun.com.au/mudgee	Added
2022-08-12 09:22:06.800183				
