Date	Event	Country	Cancellation Note	Website	Added or Removed
2022-04-16	Aggeneys parkrun	South Africa	Community unavailable	https://www.parkrun.co.za/aggeneys	Removed
2022-04-16	Alberton Ascot parkrun	Australia	operational requirements	Removed
2022-04-16	Alice Campus parkrun, University of Fort Hare	South Africa	Student volunteers on their midterm break	https://www.parkrun.co.za/alicecampus	Removed
2022-04-16	Altcourse parkrun	United Kingdom	Reopening work in progress	Removed
2022-04-16	Amanzimtoti parkrun	South Africa	Beach has been closed due to the floods.	https://www.parkrun.co.za/amanzimtoti	Removed
2022-04-16	Angrignon parkrun	Canada	COVID-19 (Coronavirus)	Removed
2022-04-16	Appleton Thorn parkrun	United Kingdom	Reopening work in progress	Removed
2022-04-16	Avery Beach parkrun, Huntsville	Canada	COVID-19 (Coronavirus)	https://www.parkrun.ca/averybeach	Removed
2022-04-16	Bambra Bolinda parkrun	Australia	operational requirements	Removed
2022-04-16	Banksia Hill parkrun	Australia	Insufficient Rec Staff Available	Removed
2022-04-16	Bear Brook parkrun	United Kingdom	Reopening work in progress	Removed
2022-04-16	Bedok Reservoir parkrun	Singapore	COVID-19 (Coronavirus)	https://www.parkrun.sg/bedokreservoir	Removed
2022-04-16	Bellevue parkrun	Canada	COVID-19 (Coronavirus)	https://www.parkrun.ca/bellevue	Removed
2022-04-16	Belloluogo parkrun	Italy	COVID-19 (Coronavirus)	Removed
2022-04-16	Belton House parkrun	United Kingdom	Requested by the National Trust - Bank Holiday	https://www.parkrun.org.uk/beltonhouse	Removed
2022-04-16	Bickershaw parkrun	United Kingdom	Reopening work in progress	Removed
2022-04-16	Bishan parkrun	Singapore	COVID-19 (Coronavirus)	https://www.parkrun.sg/bishan	Removed
2022-04-16	Blue Lagoon parkrun	South Africa	Parks congested & unsafe for parkrun	https://www.parkrun.co.za/bluelagoon	Removed
2022-04-16	Bournemouth parkrun	United Kingdom	Travellers on course again.	https://www.parkrun.org.uk/bournemouth	Removed
2022-04-16	Bowral parkrun	Australia	Damage to the course	Removed
2022-04-16	Bridgetown parkrun	South Africa	COVID-19 (Coronavirus)	https://www.parkrun.co.za/bridgetown	Removed
2022-04-16	Brighouse parkrun	United Kingdom	Flood damage to the park	https://www.parkrun.org.uk/brighouse	Removed
2022-04-16	Brockenhurst parkrun	United Kingdom	Brockenhurst College site closed	https://www.parkrun.org.uk/brockenhurst	Removed
2022-04-16	Bunyaville parkrun	Australia	Flood damaged access road at start of parkrun	https://www.parkrun.com.au/bunyaville	Removed
2022-04-16	Callaghan parkrun	Australia	No landholder permission	https://www.parkrun.com.au/callaghan	Removed
2022-04-16	Casula Parklands parkrun	Australia	Flooding Damage and Repairs Required	https://www.parkrun.com.au/casulaparklands	Removed
2022-04-16	Centenary parkrun	Australia	No volunteers - School Holidays	https://www.parkrun.com.au/centenary	Removed
2022-04-16	Central parkrun, Burnaby	Canada	COVID-19 (Coronavirus)	https://www.parkrun.ca/centralburnaby	Removed
2022-04-16	Charleston parkrun, West Virginia	United States	Easter egg hunt on Magic Island	https://www.parkrun.us/charleston	Removed
2022-04-16	Chasewater parkrun	United Kingdom	No Run Director available.	https://www.parkrun.org.uk/chasewater	Removed
2022-04-16	Chipping Norton parkrun	Australia	Wet muddy and slippery course	https://www.parkrun.com.au/chippingnorton	Removed
2022-04-16	Churchill Parkway parkrun	Canada	Poor Trail Conditions	https://www.parkrun.ca/churchillparkway	Removed
2022-04-16	Cobaw Clunes parkrun	Australia	operational requirements	Removed
2022-04-16	Coffs Harbour parkrun	Australia	path remains underwater after rain	https://www.parkrun.com.au/coffsharbour	Removed
2022-04-16	Constantia Greenbelt parkrun	South Africa	COVID-19 (Coronavirus)	https://www.parkrun.co.za/constantiagreenbelt	Removed
2022-04-16	Cowra parkrun	Australia	insufficient run directors, all out of town.	https://www.parkrun.com.au/cowra	Removed
2022-04-16	Cranleigh parkrun	United Kingdom	Park closure due to construction works	https://www.parkrun.org.uk/cranleigh	Removed
2022-04-16	Crathes Castle parkrun	United Kingdom	Easter events in the estate	https://www.parkrun.org.uk/crathescastle	Removed
2022-04-16	Deep Run parkrun	United States	Another event in the park	https://www.parkrun.us/deeprun	Removed
2022-04-16	Dhurringile parkrun	Australia	Insufficient Rec Staff Available	Removed
2022-04-16	Durban Point parkrun	South Africa	route will be to congested due to long weekend	https://www.parkrun.co.za/durbanpoint	Removed
2022-04-16	Dusi parkrun	South Africa	Flooding and mud have made key paths unusable	https://www.parkrun.co.za/dusi	Removed
2022-04-16	Eagan parkrun	United States	another event in Thomas Lake Park.	https://www.parkrun.us/eagan	Removed
2022-04-16	East Coast Brewery parkrun	South Africa	Access Roads flooded / collapsed; course unusable	https://www.parkrun.co.za/eastcoastbrewery	Removed
2022-04-16	East Coast Park parkrun	Singapore	COVID-19 (Coronavirus)	https://www.parkrun.sg/eastcoastpark	Removed
2022-04-16	Elgin parkrun	United Kingdom	Pop show in park	https://www.parkrun.org.uk/elgin	Removed
2022-04-16	Erddig parkrun	United Kingdom	Limited car parking due to Easter Weekend	https://www.parkrun.org.uk/erddig	Removed
2022-04-16	Etna parkrun	Italy	COVID-19 (Coronavirus)	Removed
2022-04-16	Feltham parkrun	United Kingdom	shorts of staff/volunteers	Removed
2022-04-16	Festningen parkrun	Norway	Easter Holiday- most regular runners and crew away	https://www.parkrun.no/festningen	Removed
2022-04-16	Ficksburg parkrun	South Africa	Cancelled - rain - slippery & dangerous conditions	https://www.parkrun.co.za/ficksburg	Removed
2022-04-16	Firenze parkrun	Italy	COVID-19 (Coronavirus)	Removed
2022-04-16	Fulham Palace parkrun	United Kingdom	Construction works to resurface tarmac paths	https://www.parkrun.org.uk/fulhampalace	Removed
2022-04-16	George Lane Memorial parkrun	Canada	COVID-19 (Coronavirus)	Removed
2022-04-16	Gillies Lake parkrun	Canada	COVID-19 (Coronavirus)	https://www.parkrun.ca/gillieslake	Removed
2022-04-16	Glass House Mountains Conservation parkrun	Australia	Landslide on trail	https://www.parkrun.com.au/glasshousemountainsconservation	Removed
2022-04-16	Gloucester North parkrun	United Kingdom	No access to the Tennis Centre and Plock Court.	https://www.parkrun.org.uk/gloucesternorth	Removed
2022-04-16	Gracepoint parkrun	South Africa	Core volunteers travelling over the long weekend	https://www.parkrun.co.za/gracepoint	Removed
2022-04-16	Grove parkrun	United Kingdom	Reopening work in progress	Removed
2022-04-16	Hazlehead parkrun, Aberdeen	United Kingdom	Storm damage to Hazlehead paths	https://www.parkrun.org.uk/hazlehead	Removed
2022-04-16	Hellbrunn parkrun	Austria	No run director / volunteers available	https://www.parkrun.co.at/hellbrunn	Removed
2022-04-16	Hilton parkrun	South Africa	COVID-19 (Coronavirus)	https://www.parkrun.co.za/hilton	Removed
2022-04-16	Hollesley Bay parkrun	United Kingdom	Staff shortage	Removed
2022-04-16	Hondajima parkrun	Japan	ボランティアが不足したため	https://www.parkrun.jp/hondajima	Removed
2022-04-16	Hopkins parkrun	Australia	Operational reasons	Removed
2022-04-16	Jindabyne parkrun	Australia	Flooding	Removed
2022-04-16	Kameeldoring parkrun	South Africa	Easter Weekend	https://www.parkrun.co.za/kameeldoring	Removed
2022-04-16	Kariyashi sogoundo koen parkrun	Japan	ボランティア募集中	https://www.parkrun.jp/kariyashisogoundokoen	Removed
2022-04-16	Kleinplaas parkrun	South Africa	extreme weather conditions; safety risk	https://www.parkrun.co.za/kleinplaas	Removed
2022-04-16	Kurpark parkrun	Germany	COVID-19 (Coronavirus)	Removed
2022-04-16	KwaMashu parkrun	South Africa	COVID-19 (Coronavirus)	https://www.parkrun.co.za/kwamashu	Removed
2022-04-16	La Mandria parkrun	Italy	COVID-19 (Coronavirus)	Removed
2022-04-16	Lady Slipper parkrun	South Africa	COVID-19 (Coronavirus)	https://www.parkrun.co.za/ladyslipper	Removed
2022-04-16	Langenhoven parkrun	South Africa	COVID-19 (Coronavirus)	https://www.parkrun.co.za/langenhoven	Removed
2022-04-16	Louis Trichardt parkrun	South Africa	COVID-19 (Coronavirus)	https://www.parkrun.co.za/louistrichardt	Removed
2022-04-16	Luitpold parkrun	Germany	still due to Covid situation-restart planned soon!	https://www.parkrun.com.de/luitpold	Removed
2022-04-16	Maitland parkrun	Australia	Site closure	Removed
2022-04-16	Marsh-Billings-Rockefeller parkrun	United States	COVID-19 (Coronavirus)	Removed
2022-04-16	McAllister parkrun	United States	COVID-19 (Coronavirus)	Removed
2022-04-16	Middelburg parkrun	South Africa	Inclement weather	https://www.parkrun.co.za/middelburg	Removed
2022-04-16	Mitchells Plain parkrun	South Africa	COVID-19 (Coronavirus)	https://www.parkrun.co.za/mitchellsplain	Removed
2022-04-16	Mofolo parkrun	South Africa	Park not available	https://www.parkrun.co.za/mofolo	Removed
2022-04-16	Montelepre parkrun	Italy	COVID-19 (Coronavirus)	Removed
2022-04-16	Mt Penang parkrun	Australia	Course obstructed	https://www.parkrun.com.au/mtpenang	Removed
2022-04-16	Mthatha parkrun	South Africa	It's raining and the running route is wet.	https://www.parkrun.co.za/mthatha	Removed
2022-04-16	Narromine Wetlands parkrun	Australia	Volunteer Rest Over Easter	https://www.parkrun.com.au/narrominewetlands	Removed
2022-04-16	New Farm parkrun	Australia	Cutter's Landing path works by BCC	https://www.parkrun.com.au/newfarm	Removed
2022-04-16	North Beach parkrun	South Africa	Large crowds are expected at the beach for Easter	https://www.parkrun.co.za/northbeach	Removed
2022-04-16	North Harbour parkrun	Australia	damage to course	https://www.parkrun.com.au/northharbour	Removed
2022-04-16	Northallerton parkrun	United Kingdom	building works on finish path and finish area	https://www.parkrun.org.uk/northallerton	Removed
2022-04-16	Northparkes Oval parkrun	Australia	Not enough volunteers	https://www.parkrun.com.au/northparkesoval	Removed
2022-04-16	Oak Grove parkrun	United States	COVID-19 (Coronavirus)	Removed
2022-04-16	Outlook and District Regional parkrun	Canada	not enough volunteers	https://www.parkrun.ca/outlookanddistrictregional	Removed
2022-04-16	PE Hobie Beach parkrun	South Africa	another event in same location	https://www.parkrun.co.za/pehobiebeach	Removed
2022-04-16	Penistone parkrun	United Kingdom	Visiting circus using the showfield.	https://www.parkrun.org.uk/penistone	Removed
2022-04-16	Penrith Lakes parkrun	Australia	Effects of flooding	https://www.parkrun.com.au/penrithlakes	Removed
2022-04-16	Petrie parkrun	Australia	Part of course is damaged from recent rain/flood	https://www.parkrun.com.au/petrie	Removed
2022-04-16	Phoenix Park parkrun	South Africa	COVID-19 (Coronavirus)	https://www.parkrun.co.za/phoenixpark	Removed
2022-04-16	Pieschener Allee parkrun	Germany	Streckensperrung (Streckenänderung ist in Planung)	https://www.parkrun.com.de/pieschenerallee	Removed
2022-04-16	Pittsworth parkrun	Australia	Horse event at venue, unsafe for parkrunners.	https://www.parkrun.com.au/pittsworth	Removed
2022-04-16	Pont y Bala parkrun	United Kingdom	Course closed due to flood defence work	https://www.parkrun.org.uk/pontybala	Removed
2022-04-16	Portrack parkrun	United Kingdom	Reopening work in progress	Removed
2022-04-16	Presint 18 parkrun, Putrajaya	Malaysia	COVID-19 (Coronavirus)	https://www.parkrun.my/presint18	Removed
2022-04-16	Puckapunyal parkrun	Australia	Easter Saturday	Removed
2022-04-16	Puolarmaari parkrun	Finland	Icy paths	https://www.parkrun.fi/puolarmaari	Removed
2022-04-16	Riverfields parkrun	South Africa	COVID-19 (Coronavirus)	Removed
2022-04-16	Roberts Park parkrun	United Kingdom	Saltaire World Heritage Day - course unusable	https://www.parkrun.org.uk/robertspark	Removed
2022-04-16	Root 44 parkrun	South Africa	COVID-19 (Coronavirus)	https://www.parkrun.co.za/root44	Removed
2022-04-16	Roundshaw Downs parkrun	United Kingdom	Safety reasons due to vehicles/caravans on Downs.	https://www.parkrun.org.uk/roundshaw	Removed
2022-04-16	Rouse Hill parkrun	Australia	The course is wet and flooded in areas, unstable	https://www.parkrun.com.au/rousehill	Removed
2022-04-16	Ruimsig parkrun	South Africa	Event Cancelled - Stagnant water on the corse	https://www.parkrun.co.za/ruimsig	Removed
2022-04-16	Röthelheimpark parkrun	Germany	COVID-19 (Coronavirus)	Removed
2022-04-16	Sherwood Reserve parkrun	New Zealand	alternate course being approved	https://www.parkrun.co.nz/sherwoodreserve	Removed
2022-04-16	Shongweni parkrun	South Africa	Too much damage caused by the flooding, unsafe	https://www.parkrun.co.za/shongweni	Removed
2022-04-16	Snye Point parkrun	Canada	Flood mitigation impacting access.	https://www.parkrun.ca/snyepoint	Removed
2022-04-16	Springhill parkrun	United Kingdom	COVID Restrictions	Removed
2022-04-16	St Andrews parkrun	United Kingdom	Easter fair event at Craigtoun Park	https://www.parkrun.org.uk/standrews	Removed
2022-04-16	Strathalbyn parkrun	Australia	Unable to fill volunteer positions	https://www.parkrun.com.au/strathalbyn	Removed
2022-04-16	Strokestown parkrun	Ireland	Construction Works-cancelled until further notice	https://www.parkrun.ie/strokestown	Removed
2022-04-16	Sunnidale parkrun	Canada	COVID-19 (Coronavirus)	https://www.parkrun.ca/sunnidale	Removed
2022-04-16	TYTO Wetlands parkrun	Australia	Not enough volunteers, most away for Easter	https://www.parkrun.com.au/tytowetlands	Removed
2022-04-16	Tamagawa chuo koen parkrun	Japan	諸事情のため	https://www.parkrun.jp/tamagawachuokoen	Removed
2022-04-16	Taman Pudu Ulu parkrun	Malaysia	COVID-19 (Coronavirus)	https://www.parkrun.my/tamanpuduulu	Removed
2022-04-16	Taman Tasik Danau Kota parkrun	Malaysia	COVID-19 (Coronavirus)	https://www.parkrun.my/tamantasikdanaukota	Removed
2022-04-16	The Spinney parkrun	United Kingdom	Covid-19 Stage 3 Restrictions	Removed
2022-04-16	The Terrace parkrun	Australia	flood damage to course	https://www.parkrun.com.au/theterrace	Removed
2022-04-16	The Venue parkrun	South Africa	All volunteers away for Easter	https://www.parkrun.co.za/thevenue	Removed
2022-04-16	Thousand Hills parkrun	South Africa	Flooding has damaged the course severely	https://www.parkrun.co.za/thousandhills	Removed
2022-04-16	Tinley Manor parkrun	South Africa	Major flooding; parts of the course washed away.	https://www.parkrun.co.za/tinleymanor	Removed
2022-04-16	Toboshane Valley Estate parkrun	South Africa	Route inaccessible due to heavy rain	https://www.parkrun.co.za/toboshanevalleyestate	Removed
2022-04-16	Torbay Velopark parkrun	United Kingdom	Travellers on road by velopark	https://www.parkrun.org.uk/torbayvelopark	Removed
2022-04-16	Tsujido kaihin koen parkrun	Japan	Shortage of volunteers	https://www.parkrun.jp/tsujidokaihinkoen	Removed
2022-04-16	Vaal Marina parkrun	South Africa	None of the run directors are available to arrange	https://www.parkrun.co.za/vaalmarina	Removed
2022-04-16	Ventersburg parkrun	South Africa	Wet and hazardous	https://www.parkrun.co.za/ventersburg	Removed
2022-04-16	Victory Heights Trail parkrun	Australia	Trails not open due to storm damage	https://www.parkrun.com.au/victoryheightstrail	Removed
2022-04-16	Villiersdorp parkrun	South Africa	Easter weekend	https://www.parkrun.co.za/villiersdorp	Removed
2022-04-16	Vrede parkrun	South Africa	COVID-19 (Coronavirus)	Removed
2022-04-16	Walton parkrun	United Kingdom	Reopening work in progress	Removed
2022-04-16	Wascana parkrun	Canada	COVID-19 (Coronavirus)	Removed
2022-04-16	Wayland parkrun	United Kingdom	Reopening work in progress	Removed
2022-04-16	Wentworth Common parkrun	Australia	Course not accessible - Sydney Royal Easter Show	https://www.parkrun.com.au/wentworthcommon	Removed
2022-04-16	West Coast Park parkrun	Singapore	COVID-19 (Coronavirus)	https://www.parkrun.sg/westcoastpark	Removed
2022-04-16	Westonaria parkrun	South Africa	COVID-19 (Coronavirus)	Removed
2022-04-16	Westville parkrun	South Africa	paths are impassable due to flooding and land slid	https://www.parkrun.co.za/westville	Removed
2022-04-16	Whistler parkrun	Canada	COVID-19 (Coronavirus)	Removed
2022-04-16	White Rock parkrun	Australia	Ongoing storm damage to trails	https://www.parkrun.com.au/whiterock	Removed
2022-04-16	Whitley Bay parkrun	United Kingdom	Fair in place at the start/finish line	https://www.parkrun.org.uk/whitleybay	Removed
2022-04-16	Witbank parkrun	South Africa	COVID-19 (Coronavirus)	Removed
2022-04-16	Wits parkrun	South Africa	COVID-19 (Coronavirus)	https://www.parkrun.co.za/wits	Removed
2022-04-16	Wittelsbacher Park parkrun	Germany	COVID-19 (Coronavirus)	Removed
2022-04-16	Zuiderpark parkrun	Netherlands	De Invictus Games vinden plaats in het park.	https://www.parkrun.co.nl/zuiderpark	Removed
2022-04-16	parkrun Angarskie Prudy	Russia	Events suspended in Russia	https://www.parkrun.ru/angarskieprudy	Removed
2022-04-16	parkrun Babushkinsky na Yauze	Russia	Events suspended in Russia	https://www.parkrun.ru/babushkinskynayauze	Removed
2022-04-16	parkrun Balashikha Zarechnaya	Russia	Events suspended in Russia	https://www.parkrun.ru/balashikhazarechnaya	Removed
2022-04-16	parkrun Belgorod Park Pobedy	Russia	Events suspended in Russia	https://www.parkrun.ru/belgorodparkpobedy	Removed
2022-04-16	parkrun Bitsa	Russia	Events suspended in Russia	https://www.parkrun.ru/bitsa	Removed
2022-04-16	parkrun Boeva Dacha	Russia	Events suspended in Russia	https://www.parkrun.ru/boevadacha	Removed
2022-04-16	parkrun Butovo	Russia	Events suspended in Russia	https://www.parkrun.ru/butovo	Removed
2022-04-16	parkrun Buzuluk Park Pushkina	Russia	Events suspended in Russia	https://www.parkrun.ru/buzulukparkpushkina	Removed
2022-04-16	parkrun Cheboksary naberezhnaya	Russia	Events suspended in Russia	https://www.parkrun.ru/cheboksarynaberezhnaya	Removed
2022-04-16	parkrun Chelyabinsk	Russia	Events suspended in Russia	https://www.parkrun.ru/chelyabinsk	Removed
2022-04-16	parkrun Chelyabinsk Ekopark	Russia	Events suspended in Russia	https://www.parkrun.ru/chelyabinskekopark	Removed
2022-04-16	parkrun Chertanovo Pokrovsky Park	Russia	Events suspended in Russia	https://www.parkrun.ru/chertanovopokrovskypark	Removed
2022-04-16	parkrun Dolgoprudny	Russia	Events suspended in Russia	https://www.parkrun.ru/dolgoprudny	Removed
2022-04-16	parkrun Druzhba	Russia	Events suspended in Russia	https://www.parkrun.ru/druzhba	Removed
2022-04-16	parkrun Elagin Ostrov	Russia	Events suspended in Russia	https://www.parkrun.ru/elaginostrov	Removed
2022-04-16	parkrun Filatov Lug	Russia	Events suspended in Russia	https://www.parkrun.ru/filatovlug	Removed
2022-04-16	parkrun Fili	Russia	Events suspended in Russia	https://www.parkrun.ru/fili	Removed
2022-04-16	parkrun Gatchina Prioratsky	Russia	Events suspended in Russia	https://www.parkrun.ru/gatchinaprioratsky	Removed
2022-04-16	parkrun Gorky Park	Russia	Events suspended in Russia	https://www.parkrun.ru/gorkypark	Removed
2022-04-16	parkrun Gorodskoy Park Semya	Russia	Events suspended in Russia	https://www.parkrun.ru/gorodskoyparksemya	Removed
2022-04-16	parkrun Gubernsky Park	Russia	Events suspended in Russia	https://www.parkrun.ru/gubernskypark	Removed
2022-04-16	parkrun Internatsionalistov	Russia	Events suspended in Russia	https://www.parkrun.ru/internatsionalistov	Removed
2022-04-16	parkrun Izmailovo	Russia	Events suspended in Russia	https://www.parkrun.ru/izmailovo	Removed
2022-04-16	parkrun Kazan Central	Russia	Events suspended in Russia	https://www.parkrun.ru/kazancentral	Removed
2022-04-16	parkrun Khimki	Russia	Events suspended in Russia	https://www.parkrun.ru/khimki	Removed
2022-04-16	parkrun Kimry	Russia	Events suspended in Russia	https://www.parkrun.ru/kimry	Removed
2022-04-16	parkrun Kolchugino City Park	Russia	Events suspended in Russia	https://www.parkrun.ru/kolchuginocitypark	Removed
2022-04-16	parkrun Kolomenskoe	Russia	Events suspended in Russia	https://www.parkrun.ru/kolomenskoe	Removed
2022-04-16	parkrun Kolpino	Russia	Events suspended in Russia	https://www.parkrun.ru/kolpino	Removed
2022-04-16	parkrun Komsomolsky	Russia	Events suspended in Russia	https://www.parkrun.ru/komsomolsky	Removed
2022-04-16	parkrun Korolev	Russia	Events suspended in Russia	https://www.parkrun.ru/korolev	Removed
2022-04-16	parkrun Krasnoyarsk Naberezhnaya	Russia	Events suspended in Russia	https://www.parkrun.ru/krasnoyarsknaberezhnaya	Removed
2022-04-16	parkrun Krylatskoe	Russia	Events suspended in Russia	https://www.parkrun.ru/krylatskoe	Removed
2022-04-16	parkrun Kurgan Central Park	Russia	Events suspended in Russia	https://www.parkrun.ru/kurgancentralpark	Removed
2022-04-16	parkrun Kuzminki	Russia	Events suspended in Russia	https://www.parkrun.ru/kuzminki	Removed
2022-04-16	parkrun Lebediny Ray	Russia	Events suspended in Russia	https://www.parkrun.ru/lebedinyray	Removed
2022-04-16	parkrun Lesopark Severny	Russia	Events suspended in Russia	https://www.parkrun.ru/lesoparkseverny	Removed
2022-04-16	parkrun Lobnya Gorodskoy Park	Russia	Events suspended in Russia	https://www.parkrun.ru/lobnyagorodskoypark	Removed
2022-04-16	parkrun Magnitogorsk Ecopark	Russia	Events suspended in Russia	https://www.parkrun.ru/magnitogorskecopark	Removed
2022-04-16	parkrun Maykop Gorodskoy Park	Russia	Events suspended in Russia	https://www.parkrun.ru/maykopgorodskoypark	Removed
2022-04-16	parkrun Mega Park Kudrovo	Russia	Events suspended in Russia	https://www.parkrun.ru/megaparkkudrovo	Removed
2022-04-16	parkrun Memorialny Park	Russia	Events suspended in Russia	https://www.parkrun.ru/memorialnypark	Removed
2022-04-16	parkrun Meshchersky	Russia	Events suspended in Russia	https://www.parkrun.ru/meshchersky	Removed
2022-04-16	parkrun Mikhalkovo	Russia	Events suspended in Russia	https://www.parkrun.ru/mikhalkovo	Removed
2022-04-16	parkrun Mitino	Russia	Events suspended in Russia	https://www.parkrun.ru/mitino	Removed
2022-04-16	parkrun Moskovsky Park Pobedy	Russia	Events suspended in Russia	https://www.parkrun.ru/moskovskyparkpobedy	Removed
2022-04-16	parkrun Muromets	Russia	Events suspended in Russia	https://www.parkrun.ru/muromets	Removed
2022-04-16	parkrun Mytishchi Central Park	Russia	Events suspended in Russia	https://www.parkrun.ru/mytishchicentralpark	Removed
2022-04-16	parkrun Naberezhnaya Reki Velikoy	Russia	Events suspended in Russia	https://www.parkrun.ru/naberezhnayarekivelikoy	Removed
2022-04-16	parkrun Natashinsky	Russia	Events suspended in Russia	https://www.parkrun.ru/natashinsky	Removed
2022-04-16	parkrun Nizhny Novgorod Meshchersky	Russia	Events suspended in Russia	https://www.parkrun.ru/nizhnynovgorodmeshchersky	Removed
2022-04-16	parkrun Nizhny Prud	Russia	Events suspended in Russia	https://www.parkrun.ru/nizhnyprud	Removed
2022-04-16	parkrun Noginsk Gorodskoy Park	Russia	Events suspended in Russia	https://www.parkrun.ru/noginskgorodskoypark	Removed
2022-04-16	parkrun Novosibirsk naberezhnaya	Russia	Events suspended in Russia	https://www.parkrun.ru/novosibirsknaberezhnaya	Removed
2022-04-16	parkrun Obninsk	Russia	Events suspended in Russia	https://www.parkrun.ru/obninsk	Removed
2022-04-16	parkrun Olimpiyskaya Derevnya	Russia	Events suspended in Russia	https://www.parkrun.ru/olimpiyskayaderevnya	Removed
2022-04-16	parkrun Orsk Park Stroiteley	Russia	Events suspended in Russia	https://www.parkrun.ru/orskparkstroiteley	Removed
2022-04-16	parkrun Ostrov Yunost	Russia	Events suspended in Russia	https://www.parkrun.ru/ostrovyunost	Removed
2022-04-16	parkrun Park Bondina	Russia	Events suspended in Russia	https://www.parkrun.ru/parkbondina	Removed
2022-04-16	parkrun Park Guskova	Russia	Events suspended in Russia	https://www.parkrun.ru/parkguskova	Removed
2022-04-16	parkrun Park Kirova	Russia	Events suspended in Russia	https://www.parkrun.ru/parkkirova	Removed
2022-04-16	parkrun Park Talalikhina	Russia	Events suspended in Russia	https://www.parkrun.ru/parktalalikhina	Removed
2022-04-16	parkrun Pavlovsky Posad	Russia	Events suspended in Russia	https://www.parkrun.ru/pavlovskyposad	Removed
2022-04-16	parkrun Perm Balatovo	Russia	Events suspended in Russia	https://www.parkrun.ru/permbalatovo	Removed
2022-04-16	parkrun Petergof Aleksandriysky	Russia	Events suspended in Russia	https://www.parkrun.ru/petergofaleksandriysky	Removed
2022-04-16	parkrun Petrovskaya naberezhnaya	Russia	Events suspended in Russia	https://www.parkrun.ru/petrovskayanaberezhnaya	Removed
2022-04-16	parkrun Plotinka	Russia	Events suspended in Russia	https://www.parkrun.ru/plotinka	Removed
2022-04-16	parkrun Pokrovskoe-Streshnevo	Russia	Events suspended in Russia	https://www.parkrun.ru/pokrovskoestreshnevo	Removed
2022-04-16	parkrun Pur-Navolok	Russia	Events suspended in Russia	https://www.parkrun.ru/purnavolok	Removed
2022-04-16	parkrun Pushkin	Russia	Events suspended in Russia	https://www.parkrun.ru/pushkin	Removed
2022-04-16	parkrun Ramenskoe Gorodskoy Park	Russia	Events suspended in Russia	https://www.parkrun.ru/ramenskoegorodskoypark	Removed
2022-04-16	parkrun Rasskazovka	Russia	Events suspended in Russia	https://www.parkrun.ru/rasskazovka	Removed
2022-04-16	parkrun Readovsky Park	Russia	Events suspended in Russia	https://www.parkrun.ru/readovskypark	Removed
2022-04-16	parkrun Rostov on Don	Russia	Events suspended in Russia	https://www.parkrun.ru/rostovondon	Removed
2022-04-16	parkrun Ryazan Central	Russia	Events suspended in Russia	https://www.parkrun.ru/ryazancentral	Removed
2022-04-16	parkrun Ryazan Oreshek	Russia	Events suspended in Russia	https://www.parkrun.ru/ryazanoreshek	Removed
2022-04-16	parkrun Samara Park Gagarina	Russia	Events suspended in Russia	https://www.parkrun.ru/samaraparkgagarina	Removed
2022-04-16	parkrun Serpukhov Gorodskoy Bor	Russia	Events suspended in Russia	https://www.parkrun.ru/serpukhovgorodskoybor	Removed
2022-04-16	parkrun Severnoe Tushino	Russia	Events suspended in Russia	https://www.parkrun.ru/severnoetushino	Removed
