Date	Event	Country	Cancellation Note	Website
2023-11-04	Abbey Park parkrun	United Kingdom	Bonfire night setup using paths and grass areas	https://www.parkrun.org.uk/abbeypark
2023-11-04	Aggeneys parkrun	South Africa	Route closed due to construction of new pipeline	https://www.parkrun.co.za/aggeneys
2023-11-04	Alderford Lake parkrun	United Kingdom	Venue unavailable	https://www.parkrun.org.uk/alderfordlake
2023-11-04	Ally Pally parkrun	United Kingdom	Ally Pally Fireworks Festival - course unavailable	https://www.parkrun.org.uk/allypally
2023-11-04	Anderson parkrun	New Zealand	Annual recycling day being held in park.	https://www.parkrun.co.nz/anderson
2023-11-04	Avery Beach parkrun, Huntsville	Canada	Trail not maintained in the late fall/winter.	https://www.parkrun.ca/averybeach
2023-11-04	Aylesbury parkrun	United Kingdom	Both courses are still under water.	https://www.parkrun.org.uk/aylesbury
2023-11-04	Bedworth parkrun	United Kingdom	Bonfire preparations in the park.	https://www.parkrun.org.uk/bedworth
2023-11-04	Bexley parkrun	United Kingdom	Fireworks event preparation around the course	https://www.parkrun.org.uk/bexley
2023-11-04	Billericay parkrun	United Kingdom	Course not available due to fireworks display	https://www.parkrun.org.uk/billericay
2023-11-04	Blyth Links parkrun	United Kingdom	Venue unavailable	https://www.parkrun.org.uk/blythlinks
2023-11-05	Bognor Regis junior parkrun	United Kingdom	Course unsafe or blocked	https://www.parkrun.org.uk/bognorregis-juniors
2023-11-05	Bracknell junior parkrun	United Kingdom	Weather	https://www.parkrun.org.uk/bracknell-juniors
2023-11-04	Bracknell parkrun	United Kingdom	Waterlogged paths and more rain on the way	https://www.parkrun.org.uk/bracknell
2023-11-04	Braidwood Showground parkrun	Australia	Venue unavailable	https://www.parkrun.com.au/braidwoodshowground
2023-11-04	Bramshall Road parkrun	United Kingdom	Venue unavailable	https://www.parkrun.org.uk/bramshallroad
2023-11-04	Buckingham parkrun	United Kingdom	River Ouse has decided to join the footpath	https://www.parkrun.org.uk/buckingham
2023-11-05	Cambourne junior parkrun	United Kingdom	Pitches unavailable due to fireworks on Saturday	https://www.parkrun.org.uk/cambourne-juniors
2023-11-04	Camperdown parkrun, Dundee	United Kingdom	Repair work post storm Babet is ongoing.	https://www.parkrun.org.uk/camperdown
2023-11-05	Carlisle junior parkrun	United Kingdom	Carlisle Fire Show	https://www.parkrun.org.uk/carlisle-juniors
2023-11-05	Carmarthen junior parkrun	United Kingdom	Venue unavailable	https://www.parkrun.org.uk/carmarthen-juniors
2023-11-04	Castletown parkrun	Ireland	Venue unavailable	https://www.parkrun.ie/castletown
2023-11-05	Central Park junior parkrun, Boston	United Kingdom	Course unsafe or blocked	https://www.parkrun.org.uk/centralparkboston-juniors
2023-11-04	Chelmsford Central parkrun	United Kingdom	Flooding in Admirals Park	https://www.parkrun.org.uk/chelmsfordcentral
2023-11-05	Cheltenham junior parkrun	United Kingdom	Weather	https://www.parkrun.org.uk/cheltenham-juniors
2023-11-04	Clare Castle parkrun	United Kingdom	Course unsafe or blocked	https://www.parkrun.org.uk/clarecastle
2023-11-04	Clifton parkrun	United Kingdom	Weather	https://www.parkrun.org.uk/clifton
2023-11-05	Clitheroe Castle junior parkrun	United Kingdom	Bonfire Cleanup	https://www.parkrun.org.uk/clitheroecastle-juniors
2023-11-04	Clitheroe Castle parkrun	United Kingdom	Venue unavailable	https://www.parkrun.org.uk/clitheroecastle
2023-11-04	Clonmel parkrun	Ireland	Weather	https://www.parkrun.ie/clonmel
2023-11-05	Clough Hall junior parkrun	United Kingdom	Venue unavailable	https://www.parkrun.org.uk/cloughhall-juniors
2023-11-05	Community Park junior parkrun	United Kingdom	Course unsafe or blocked	https://www.parkrun.org.uk/communitypark-juniors
2023-11-05	Cotlands Park junior parkrun	United Kingdom	Storm damage, paths unsafe	https://www.parkrun.org.uk/cotlandspark-juniors
2023-11-04	Darndale parkrun	Ireland	Course unsafe or blocked	https://www.parkrun.ie/darndale
2023-11-05	Dartford junior parkrun	United Kingdom	Cancelled due to fireworks in the park	https://www.parkrun.org.uk/dartford-juniors
2023-11-04	Dartford parkrun	United Kingdom	Large fireworks event in Dartford Central Park.	https://www.parkrun.org.uk/dartford
2023-11-04	Drumpellier Country parkrun	United Kingdom	BB run in the park, landowner request	https://www.parkrun.org.uk/drumpelliercountry
2023-11-04	Eastbourne parkrun	United Kingdom	Course unsafe or blocked	https://www.parkrun.org.uk/eastbourne
2023-11-04	Eastleigh parkrun	United Kingdom	Heavy rain; waterlogged and slippery conditions	https://www.parkrun.org.uk/eastleigh
2023-11-04	Edenbrook Country parkrun	United Kingdom	Ducks have staged a takeover of course	https://www.parkrun.org.uk/edenbrookcountry
2023-11-05	Evesham junior parkrun	United Kingdom	Course unsafe or blocked	https://www.parkrun.org.uk/evesham-juniors
2023-11-04	Exmouth parkrun	United Kingdom	Course unsafe or blocked	https://www.parkrun.org.uk/exmouth
2023-11-04	Finsbury parkrun	United Kingdom	Course unsafe or blocked	https://www.parkrun.org.uk/finsbury
2023-11-04	Forfar Loch parkrun	United Kingdom	Course unsafe or blocked	https://www.parkrun.org.uk/forfarloch
2023-11-04	Franschhoek parkrun	South Africa	Route still being repaired after extreme weather	https://www.parkrun.co.za/franschhoek
2023-11-04	Fulham Palace parkrun	United Kingdom	Event in park - vehicle movement, Health & Safety	https://www.parkrun.org.uk/fulhampalace
2023-11-04	Gateshead parkrun	United Kingdom	Prep for large fireworks event in the park.	https://www.parkrun.org.uk/gateshead
2023-11-04	Glossop parkrun	United Kingdom	Venue unavailable	https://www.parkrun.org.uk/glossop
2023-11-05	Gnoll junior parkrun	United Kingdom	No RD available	https://www.parkrun.org.uk/gnoll-juniors
2023-11-05	Great Cornard junior parkrun	United Kingdom	Weather	https://www.parkrun.org.uk/greatcornard-juniors
2023-11-04	Great Cornard parkrun	United Kingdom	Weather	https://www.parkrun.org.uk/greatcornard
2023-11-04	Great Dunmow parkrun	United Kingdom	Flooded Course	https://www.parkrun.org.uk/greatdunmow
2023-11-04	Grove Fields parkrun	United Kingdom	Course flooded and unsafe to use	https://www.parkrun.org.uk/grovefields
2023-11-04	Guernsey parkrun	United Kingdom	Weather	https://www.parkrun.org.uk/guernsey
2023-11-05	Guildford junior parkrun	United Kingdom	Bonfire night	https://www.parkrun.org.uk/guildford-juniors
2023-11-04	Guildford parkrun	United Kingdom	Fireworks in Stoke Park	https://www.parkrun.org.uk/guildford
2023-11-04	Haldon Forest parkrun	United Kingdom	Course unsafe or blocked	https://www.parkrun.org.uk/haldonforest
2023-11-05	Harlow junior parkrun	United Kingdom	Bonfire and fireworks in the park	https://www.parkrun.org.uk/harlow-juniors
2023-11-04	Heartlands parkrun	United Kingdom	Fireworks event and fair at site	https://www.parkrun.org.uk/heartlands
2023-11-04	Hermanus parkrun	South Africa	The access road to the course is closed	https://www.parkrun.co.za/hermanus
2023-11-04	Higginson parkrun, Marlow	United Kingdom	Old Father Thames is running on our course!	https://www.parkrun.org.uk/higginsonmarlow
2023-11-04	Horinouchi koen parkrun	Japan	Venue unavailable	https://www.parkrun.jp/horinouchikoen
2023-11-04	Horspath parkrun	United Kingdom	Course unsafe or blocked	https://www.parkrun.org.uk/horspath
2023-11-04	Huskisson parkrun	Australia	Venue unavailable	https://www.parkrun.com.au/huskisson
2023-11-05	Ipswich junior parkrun	United Kingdom	Venue unavailable	https://www.parkrun.org.uk/ipswich-juniors
2023-11-04	Isabel Trail parkrun	United Kingdom	Course unsafe or blocked	https://www.parkrun.org.uk/isabeltrail
2023-11-04	Jersey parkrun	United Kingdom	Weather	https://www.parkrun.org.uk/jersey
2023-11-04	Jindabyne parkrun	Australia	Event Closed	https://www.parkrun.com.au/jindabyne
2023-11-04	Kettering parkrun	United Kingdom	Venue unavailable	https://www.parkrun.org.uk/kettering
2023-11-04	Kirkwall parkrun	United Kingdom	Course being used to set up town bonfire	https://www.parkrun.org.uk/kirkwall
2023-11-05	Lake Meadows junior parkrun	United Kingdom	Fireworks at Lake Meadows	https://www.parkrun.org.uk/lakemeadows-juniors
2023-11-05	Long Eaton junior parkrun	United Kingdom	Venue unavailable	https://www.parkrun.org.uk/longeaton-juniors
2023-11-04	Long Eaton parkrun	United Kingdom	Bonfire event; key paths unusable & vehicles	https://www.parkrun.org.uk/longeaton
2023-11-04	Longrun Meadow parkrun	United Kingdom	Weather	https://www.parkrun.org.uk/longrunmeadow
2023-11-04	Lymington Woodside parkrun	United Kingdom	Weather	https://www.parkrun.org.uk/lymingtonwoodside
2023-11-04	Lynnfield parkrun	South Africa	Part of route compromised by flooding.	https://www.parkrun.co.za/lynnfield
2023-11-04	Maidstone parkrun	United Kingdom	Venue unavailable	https://www.parkrun.org.uk/maidstone
2023-11-05	Maldon Prom junior parkrun	United Kingdom	Venue unavailable	https://www.parkrun.org.uk/maldonprom-juniors
2023-11-04	Maldon Prom parkrun	United Kingdom	Another event happening in park	https://www.parkrun.org.uk/maldonprom
2023-11-04	Millennium parkrun	Canada	Venue unavailable	https://www.parkrun.ca/millennium
2023-11-04	Momoi harappa koen parkrun	Japan	Public event at the park	https://www.parkrun.jp/momoiharappakoen
2023-11-04	Moreletapark Gemeente parkrun	South Africa	Crafters Fair Christmas Market: Traffic on course	https://www.parkrun.co.za/moreletaparkgemeente
2023-11-04	Mura di Lucca parkrun	Italy	Svolgimento evento Lucca Comics in concomitanza	https://www.parkrun.it/muradilucca
2023-11-04	New Earswick parkrun	United Kingdom	Course waterlogged	https://www.parkrun.org.uk/newearswick
2023-11-05	Northallerton junior parkrun	United Kingdom	Shortage of volunteers	https://www.parkrun.org.uk/northallerton-juniors
2023-11-04	Northern Pathway parkrun	New Zealand	Northern Pathway parkrun starts 11th November 2023	https://www.parkrun.co.nz/northernpathway
2023-11-04	Odakaryokuchi parkrun	Japan	Venue unavailable	https://www.parkrun.jp/odakaryokuchi
2023-11-04	Ormskirk parkrun	United Kingdom	Venue unavailable, University open day	https://www.parkrun.org.uk/ormskirk
2023-11-05	Park Wood junior parkrun	United Kingdom	No RD’s available .	https://www.parkrun.org.uk/parkwood-juniors
2023-11-04	Penistone parkrun	United Kingdom	Bonfire setup	https://www.parkrun.org.uk/penistone
2023-11-05	Peoples Park junior parkrun	United Kingdom	No DBS RD	https://www.parkrun.org.uk/peoplespark-juniors
2023-11-04	Perth parkrun	United Kingdom	Course unsafe or blocked	https://www.parkrun.org.uk/perth
2023-11-04	Phoenix Park parkrun	South Africa	Event Closed	https://www.parkrun.co.za/phoenixpark
2023-11-04	Pittsworth parkrun	Australia	Venue unavailable	https://www.parkrun.com.au/pittsworth
2023-11-05	Pontypridd junior parkrun	United Kingdom	Clean up operation following firework display.	https://www.parkrun.org.uk/pontypridd-juniors
2023-11-04	Reading parkrun	United Kingdom	Course unsafe or blocked	https://www.parkrun.org.uk/reading
2023-11-04	Red Star parkrun	South Africa	Historics Inland Tour at Red Star Raceway	https://www.parkrun.co.za/redstar
2023-11-04	Riverside Walk parkrun	United Kingdom	Weather	https://www.parkrun.org.uk/riversidewalk
2023-11-04	Riverside parkrun, Kamloops	Canada	Venue unavailable	https://www.parkrun.ca/riversidekamloops
2023-11-04	Ross-on-Wye parkrun	United Kingdom	Mum lied, drips do get wet!	https://www.parkrun.org.uk/rossonwye
2023-11-04	Rostrevor parkrun	United Kingdom	Course unsafe or blocked	https://www.parkrun.org.uk/rostrevor
2023-11-04	Rugby parkrun	United Kingdom	Firework display being set up	https://www.parkrun.org.uk/rugby
2023-11-04	Salisbury parkrun	United Kingdom	Flooding to the park.	https://www.parkrun.org.uk/salisbury
2023-11-05	Saltwell junior parkrun	United Kingdom	Firework event blocking course	https://www.parkrun.org.uk/saltwell-juniors
2023-11-04	Sandhurst Memorial parkrun	United Kingdom	Course unsafe or blocked	https://www.parkrun.org.uk/sandhurstmemorial
2023-11-04	Seaford Beach parkrun	United Kingdom	Course unsafe or blocked	https://www.parkrun.org.uk/seafordbeach
2023-11-04	Seaton parkrun	United Kingdom	Debris from storm making route unsafe	https://www.parkrun.org.uk/seaton
2023-11-04	Shongweni parkrun	South Africa	Venue Unavailable	https://www.parkrun.co.za/shongweni
2023-11-04	Sixmilewater parkrun	United Kingdom	Venue unavailable	https://www.parkrun.org.uk/sixmilewater
2023-11-04	Skatås parkrun	Sweden	Venue unavailable	https://www.parkrun.se/skatas
2023-11-04	Snowden Field parkrun	United Kingdom	By order of the field protection team (weather)	https://www.parkrun.org.uk/snowdenfield
2023-11-04	Southsea parkrun	United Kingdom	Course more like a Tough Mudder than a parkrun	https://www.parkrun.org.uk/southsea
2023-11-04	Stadtpark parkrun, Graz	Austria	Venue unavailable	https://www.parkrun.co.at/stadtparkgraz
2023-11-05	Staveley junior parkrun	United Kingdom	Course unsafe or blocked	https://www.parkrun.org.uk/staveley-juniors
2023-11-05	Stonehouse junior parkrun	United Kingdom	Waterlogged field, groundsman stopped use	https://www.parkrun.org.uk/stonehouse-juniors
2023-11-04	Stonehouse parkrun	United Kingdom	Weather	https://www.parkrun.org.uk/stonehouse
2023-11-04	Tampere parkrun	Finland	Weather	https://www.parkrun.fi/tampere
2023-11-04	Tamworth Castle Grounds parkrun	United Kingdom	Venue unavailable	https://www.parkrun.org.uk/tamworthcastlegrounds
2023-11-04	Teignmouth Promenade parkrun	United Kingdom	Course unsafe or blocked	https://www.parkrun.org.uk/teignmouthpromenade
2023-11-04	Tewkesbury parkrun	United Kingdom	Ground to boggy to run on after flooding	https://www.parkrun.org.uk/tewkesbury
2023-11-05	The Waterfront junior parkrun	United Kingdom	Weather	https://www.parkrun.org.uk/thewaterfront-juniors
2023-11-04	Thornbury parkrun	United Kingdom	Venue unavailable	https://www.parkrun.org.uk/thornbury
2023-11-04	Thornham Walks parkrun	United Kingdom	Adverse weather - dangerous course conditions	https://www.parkrun.org.uk/thornhamwalks
2023-11-04	Thorp Perrow parkrun	United Kingdom	Halloween Event on Estate; crowds expected	https://www.parkrun.org.uk/thorpperrow
2023-11-04	Toboshane Valley Estate parkrun	South Africa	course still very muddy and slippery	https://www.parkrun.co.za/toboshanevalleyestate
2023-11-04	Tonbridge parkrun	United Kingdom	Course unsafe or blocked	https://www.parkrun.org.uk/tonbridge
2023-11-05	Torbay Velopark junior parkrun	United Kingdom	cyclocross event at velopark	https://www.parkrun.org.uk/torbayvelopark-juniors
2023-11-04	Tsurumi Ryokuchi parkrun	Japan	Venue unavailable	https://www.parkrun.jp/tsurumiryokuchi
2023-11-05	Tyne Green junior parkrun	United Kingdom	Tyne Tour is taking place at Tyne Green this weeke	https://www.parkrun.org.uk/tynegreen-juniors
2023-11-04	Tyne Green parkrun	United Kingdom	Tyne Tour Event on Tyne Green	https://www.parkrun.org.uk/tynegreen
2023-11-04	Ury Riverside parkrun	United Kingdom	Course still flooded	https://www.parkrun.org.uk/uryriverside
2023-11-05	Verulamium junior parkrun	United Kingdom	Clear Up from Fireworks display	https://www.parkrun.org.uk/verulamium-juniors
2023-11-05	Wakefield Thornes junior parkrun	United Kingdom	Venue unavailable	https://www.parkrun.org.uk/wakefieldthornes-juniors
2023-11-04	Wakefield Thornes parkrun	United Kingdom	Venue unavailable	https://www.parkrun.org.uk/wakefieldthornes
2023-11-04	Watermead Country Park parkrun	United Kingdom	Course unsafe or blocked	https://www.parkrun.org.uk/watermeadcountrypark
2023-11-04	Werribee Park Mansion parkrun	Australia	Course closed due to flooding	https://www.parkrun.com.au/werribeeparkmansion
2023-11-04	Wetherby parkrun	United Kingdom	Course being used for Bonfire night celebrations	https://www.parkrun.org.uk/wetherby
2023-11-05	Wicksteed junior parkrun	United Kingdom	Course unavailable due to event in the park.	https://www.parkrun.org.uk/wicksteed-juniors
2023-11-05	Wimbledon Park junior parkrun	United Kingdom	Venue unavailable	https://www.parkrun.org.uk/wimbledonpark-juniors
2023-11-04	Wimpole Estate parkrun	United Kingdom	Landowner Request (Waterlogged Ground)	https://www.parkrun.org.uk/wimpoleestate
2023-11-05	Winchester junior parkrun	United Kingdom	Fireworks event at North Walls	https://www.parkrun.org.uk/winchester-juniors
2023-11-04	Winchester parkrun	United Kingdom	Course unsafe or blocked	https://www.parkrun.org.uk/winchester
2023-11-04	Witton parkrun	United Kingdom	Bonfire	https://www.parkrun.org.uk/witton
2023-11-05	Woking junior parkrun	United Kingdom	Park unavailable - clear up from Fireworks display	https://www.parkrun.org.uk/woking-juniors
2023-11-04	Woking parkrun	United Kingdom	Venue unavailable	https://www.parkrun.org.uk/woking
2023-11-04	Woodgate Valley Country Park parkrun	United Kingdom	Travellers in car park	https://www.parkrun.org.uk/woodgatevalleycountrypark
2023-11-05	Worden Park junior parkrun	United Kingdom	Course unsafe or blocked	https://www.parkrun.org.uk/wordenpark-juniors
2023-11-04	Worden parkrun	United Kingdom	Venue unavailable	https://www.parkrun.org.uk/worden
2023-11-04	Worthing parkrun	United Kingdom	Weather	https://www.parkrun.org.uk/worthing
2023-11-04	Yuuka Family Road parkrun	Japan	Shortage of volunteers	https://www.parkrun.jp/yuukafamilyroad
2023-11-04	parkrun Wzniesienie Osowy	Poland	Course unsafe or blocked	https://www.parkrun.pl/wzniesienieosowy
2023-11-04	parkrun de Fontainebleau	France	parkrun est actuellement suspendu en France	https://www.parkrun.fr/fontainebleau
2023-11-04	parkrun de Montsouris	France	parkrun est actuellement suspendu en France	https://www.parkrun.fr/montsouris
2023-11-04	parkrun de Rouen	France	parkrun est actuellement suspendu en France	https://www.parkrun.fr/rouen
2023-11-04	parkrun de la Ramée	France	parkrun est actuellement suspendu en France	https://www.parkrun.fr/laramee
2023-11-04	parkrun des Dougnes, Cubnezais	France	parkrun est actuellement suspendu en France	https://www.parkrun.fr/lesdougnes
2023-11-04	parkrun du Bois de Boulogne, Paris	France	parkrun est actuellement suspendu en France	https://www.parkrun.fr/boisdeboulogne
2023-11-04	parkrun du Château de Pierre de Bresse	France	parkrun est actuellement suspendu en France	https://www.parkrun.fr/chateaudepierredebresse
2023-11-04	parkrun du Lac de Divonne	France	parkrun est actuellement suspendu en France	https://www.parkrun.fr/lacdedivonne
