Date	Event	Country	Cancellation Note	Website	Added or Removed
2023-01-28	Abingdon parkrun	United Kingdom	Muddy, standing water and ice	https://www.parkrun.org.uk/abingdon	Removed
2023-01-28	Albury Wodonga parkrun	Australia	Flooding on the course	https://www.parkrun.com.au/alburywodonga	Removed
2023-01-28	Amanzimtoti parkrun	South Africa	Not received landowner's permission	https://www.parkrun.co.za/amanzimtoti	Removed
2023-01-28	An Bonnán Buí parkrun	Ireland	Venue not available	Removed
2023-01-28	Aspen parkrun	United States	Winter Pause	https://www.parkrun.us/aspen	Removed
2023-01-28	Avery Beach parkrun, Huntsville	Canada	Winter Pause	https://www.parkrun.ca/averybeach	Removed
2023-01-28	Aylesbury parkrun	United Kingdom	Weather.  Paths remain icy and slippery.	https://www.parkrun.org.uk/aylesbury	Removed
2023-01-28	Barry Curtis parkrun	New Zealand	extreme weather, dangerous conditions	https://www.parkrun.co.nz/barrycurtis	Removed
2023-01-28	Bartley Park parkrun	United Kingdom	ice on the course	https://www.parkrun.org.uk/bartleypark	Removed
2023-01-28	Barton Trail parkrun	Canada	Winter Pause	https://www.parkrun.ca/bartontrail	Removed
2023-01-28	Bellevue parkrun	Canada	Winter Pause	https://www.parkrun.ca/bellevue	Removed
2023-01-28	Berkeley Green parkrun	United Kingdom	SGS College open day so can't use the site	https://www.parkrun.org.uk/berkeleygreen	Removed
2023-01-28	Bill Thorpe Walking Bridge parkrun	Canada	Thick ice on most of the course. Too dangerous.	https://www.parkrun.ca/billthorpewalkingbridge	Removed
2023-01-28	Braidwood Showground parkrun	Australia	Works being done at showground. Cannot use course.	https://www.parkrun.com.au/braidwoodshowground	Removed
2023-01-28	Brecksville Reservation parkrun	United States	Winter Pause	https://www.parkrun.us/brecksvillereservation	Removed
2023-01-28	Chuo koen parkrun	Japan	天候悪化の予報のため中止とします。	https://www.parkrun.jp/chuokoen	Removed
2023-01-28	Churchill Parkway parkrun	Canada	Extreme Cold	https://www.parkrun.ca/churchillparkway	Removed
2023-01-28	City Park parkrun, Iowa	United States	slick conditions with snow coming down.	https://www.parkrun.us/cityparkiowa	Removed
2023-01-28	Clonmel parkrun	Ireland	Route unsuitable after flooding	https://www.parkrun.ie/clonmel	Removed
2023-01-28	Cobram parkrun	Australia	River flooding	https://www.parkrun.com.au/cobram	Removed
2023-01-28	Cornwall parkrun	New Zealand	Extreme weather	https://www.parkrun.co.nz/cornwall	Removed
2023-01-28	Courthouse Lake parkrun	United States	Dangerous wind chills forecasted	https://www.parkrun.us/courthouselake	Removed
2023-01-28	Cranleigh parkrun	United Kingdom	Continuing redevelopment of park	https://www.parkrun.org.uk/cranleigh	Removed
2023-01-28	Darlington South Park parkrun	United Kingdom	slippy paths	https://www.parkrun.org.uk/darlingtonsouthpark	Removed
2023-01-28	Durham parkrun	United Kingdom	Course checkers fell over twice on ice	https://www.parkrun.org.uk/durham	Removed
2023-01-28	Eastleigh parkrun	United Kingdom	Course waterlogged with further rain forecast	https://www.parkrun.org.uk/eastleigh	Removed
2023-01-28	Edgbaston Reservoir parkrun	United Kingdom	key paths unusable	https://www.parkrun.org.uk/edgbastonreservoir	Removed
2023-01-28	Edwin Carolan Community parkrun	Ireland	Building Works On track Not Complete	https://www.parkrun.ie/edwincarolancommunity	Removed
2023-01-28	Ekebergsletta parkrun	Norway	Winter Pause	https://www.parkrun.no/ekebergsletta	Removed
2023-01-28	Euroa parkrun	Australia	Track repairs incomplete	https://www.parkrun.com.au/euroa	Removed
2023-01-28	Festningen parkrun	Norway	icy course	https://www.parkrun.no/festningen	Removed
2023-01-28	Fish Hoek parkrun	South Africa	Red Hill Marathon using part of route & fields	https://www.parkrun.co.za/fishhoek	Removed
2023-01-28	Flaxmere parkrun	New Zealand	adverse weather conditions, course unsafe	https://www.parkrun.co.nz/flaxmere	Removed
2023-01-28	Frickley Country parkrun	United Kingdom	Course still dangerous due to ice	https://www.parkrun.org.uk/frickleycountry	Removed
2023-01-28	Friedrichsau parkrun	Germany	Icy grounds especially on the cobblestones	https://www.parkrun.com.de/friedrichsau	Removed
2023-01-28	George Lane Memorial parkrun	Canada	Due to Cold Temperatures	https://www.parkrun.ca/georgelanememorial	Removed
2023-01-28	Gisborne parkrun	New Zealand	First Light Marathon needs the Waikanae Reserve	https://www.parkrun.co.nz/gisborne	Removed
2023-01-28	Greenpoint parkrun	South Africa	New route still to be approved	https://www.parkrun.co.za/greenpoint	Removed
2023-01-28	Guildford parkrun	United Kingdom	Park still too wet and muddy.	https://www.parkrun.org.uk/guildford	Removed
2023-01-28	Hackworth parkrun	United Kingdom	Black ice on course, unsafe to proceed	https://www.parkrun.org.uk/hackworth	Removed
2023-01-28	Hamlet Park parkrun	United States	Dangerous wind chills and course conditions	https://www.parkrun.us/hamletpark	Removed
2023-01-28	Henstridge Airfield parkrun	United Kingdom	flooding prevention work ongoing.	https://www.parkrun.org.uk/henstridgeairfield	Removed
2023-01-28	Hobsonville Point parkrun	New Zealand	Severe weather conditions in Auckland	https://www.parkrun.co.nz/hobsonvillepoint	Removed
2023-01-28	Hondajima parkrun	Japan	ボランティア不足のため	https://www.parkrun.jp/hondajima	Removed
2023-01-28	Huddinge parkrun	Sweden	Vinterpaus	https://www.parkrun.se/huddinge	Removed
2023-01-28	Kingston parkrun	United Kingdom	ThamesWater promo filming with protesters expected	https://www.parkrun.org.uk/kingston	Removed
2023-01-28	Lancefield parkrun	Australia	Track damage	https://www.parkrun.com.au/lancefield	Removed
2023-01-28	Leamington parkrun	United Kingdom	Cross country event at Newbold	https://www.parkrun.org.uk/leamington	Removed
2023-01-28	Lillie parkrun, Ann Arbor	United States	ice on course :(	https://www.parkrun.us/lillie	Removed
2023-01-28	Lillsjön parkrun	Sweden	Vinterpaus	https://www.parkrun.se/lillsjon	Removed
2023-01-28	Mansfield OH parkrun	United States	icy trail. Course unsafe for parkrun	https://www.parkrun.us/mansfieldoh	Removed
2023-01-28	March parkrun	United Kingdom	Air ambulance in park	https://www.parkrun.org.uk/march	Removed
2023-01-28	McLean Beach parkrun	Australia	course closed after recent flooding	https://www.parkrun.com.au/mcleanbeach	Removed
2023-01-28	Melaleuca parkrun	Australia	Insufficient Rec Staff Available	Removed
2023-01-28	Middelburg parkrun	South Africa	Venue not available.	Removed
2023-01-28	Mildura Weir parkrun	Australia	track inundated due to floods and no approved alt.	https://www.parkrun.com.au/milduraweir	Removed
2023-01-28	Millwater parkrun	New Zealand	Severe weather conditions in Auckland.	https://www.parkrun.co.nz/millwater	Removed
2023-01-28	Murray Bridge parkrun	Australia	Course closed due to flooding	https://www.parkrun.com.au/murraybridge	Removed
2023-01-28	Nansenparken parkrun	Norway	There is too much ice on the course to run safely	https://www.parkrun.no/nansenparken	Removed
2023-01-28	Nepean River parkrun	Australia	Bob the Builder hasn’t fixed it. Construction work	https://www.parkrun.com.au/nepeanriver	Removed
2023-01-28	Newport parkrun	United Kingdom	Path works running behind schedule.	https://www.parkrun.org.uk/newport	Removed
2023-01-28	North Wollongong parkrun	Australia	No access to car park due to scheduled concert	https://www.parkrun.com.au/northwollongong	Removed
2023-01-28	Northallerton parkrun	United Kingdom	Ice on new tarmac path on top field	https://www.parkrun.org.uk/northallerton	Removed
2023-01-28	Nose Hill parkrun	Canada	Severe cold/snow weather warning.	https://www.parkrun.ca/nosehill	Removed
2023-01-28	Oakwell Hall parkrun	United Kingdom	Exhibition in barn , key paths unusable	https://www.parkrun.org.uk/oakwellhall	Removed
2023-01-28	Ocean Grove parkrun	Australia	Event paused for peak summer period	https://www.parkrun.com.au/oceangrove	Removed
2023-01-28	Ohio and Erie Canal Reservation parkrun	United States	Ice on the trail creating unsafe conditions	https://www.parkrun.us/ohioanderiecanalreservation	Removed
2023-01-28	Owairaka parkrun	New Zealand	The stream has flooded and the course is unsafe.	https://www.parkrun.co.nz/owairaka	Removed
2023-01-28	Pendle parkrun	United Kingdom	Area in use	https://www.parkrun.org.uk/pendle	Removed
2023-01-28	Port Sorell parkrun	Australia	State Surf Club Carnival using same location	https://www.parkrun.com.au/portsorell	Removed
2023-01-28	Puarenga parkrun	New Zealand	Extreme weather conditions	https://www.parkrun.co.nz/puarenga	Removed
2023-01-28	Puolarmaari parkrun	Finland	Winter Pause	https://www.parkrun.fi/puolarmaari	Removed
2023-01-28	Reading parkrun	United Kingdom	Thames flooded course & ground needs to recover.	https://www.parkrun.org.uk/reading	Removed
2023-01-28	Renmark parkrun	Australia	Flood damage and an ongoing flood alert	https://www.parkrun.com.au/renmark	Removed
2023-01-28	Riverside Park parkrun	United States	We have a snow storm	https://www.parkrun.us/riversidepark	Removed
2023-01-28	Ross-on-Wye parkrun	United Kingdom	Vicar of Dibley puddles	https://www.parkrun.org.uk/rossonwye	Removed
2023-01-28	Saint-Paulin parkrun	Canada	Winter Pause	https://www.parkrun.ca/saintpaulin	Removed
2023-01-28	Sherwood Reserve parkrun	New Zealand	Course unsafe due to flooding	https://www.parkrun.co.nz/sherwoodreserve	Removed
2023-01-28	Sippo Lake parkrun	United States	Trail Icy	https://www.parkrun.us/sippolake	Removed
2023-01-28	Snye Point parkrun	Canada	artic winter games conflict	https://www.parkrun.ca/snyepoint	Removed
2023-01-28	Somerdale Pavilion parkrun	United Kingdom	core team striking for 10% pay rise (waterlogged)	https://www.parkrun.org.uk/somerdalepavilion	Removed
2023-01-28	Stratford Park parkrun, Stroud	United Kingdom	Paths are very muddy - we're giving them a break	https://www.parkrun.org.uk/stratfordparkstroud	Removed
2023-01-28	Strathcona Island parkrun	Canada	Extreme cold weather warning (-27 with wind chill)	https://www.parkrun.ca/strathconaisland	Removed
2023-01-28	Sunshine Beach parkrun	Japan	悪天候（雪、積雪）が予想され、道中にて危険が予想されるため	https://www.parkrun.jp/sunshinebeach	Removed
2023-01-28	TYTO Wetlands parkrun	Australia	Unsafe to run at - Boggy Ground - Too much water.	https://www.parkrun.com.au/tytowetlands	Removed
2023-01-28	Taman Pudu Ulu parkrun	Malaysia	Permit Renewal with Landowner, DBKL	https://www.parkrun.my/tamanpuduulu	Removed
2023-01-28	Taman Tasik Danau Kota parkrun	Malaysia	This event is closed until further notice.	https://www.parkrun.my/tamantasikdanaukota	Removed
2023-01-28	Tennogawa koen parkrun	Japan	公園内の大規模工事のため	https://www.parkrun.jp/tennogawakoen	Removed
2023-01-28	Tewkesbury parkrun	United Kingdom	Course not fit to run on due to 3 weeks of floods	https://www.parkrun.org.uk/tewkesbury	Removed
2023-01-28	Tøyen parkrun	Norway	icy conditions - unsafe to go ahead	https://www.parkrun.no/toyen	Removed
2023-01-28	Urayasushi sogo koen parkrun	Japan	ボランティア都合のため	https://www.parkrun.jp/urayasushisogokoen	Removed
2023-01-28	Waterford Nature parkrun	Ireland	Event suspended until further notice.	https://www.parkrun.ie/waterfordnature	Removed
2023-01-28	Welkom parkrun	South Africa	Other events - School Sport	https://www.parkrun.co.za/welkom	Removed
2023-01-28	Werribee Park Mansion parkrun	Australia	Damage to course	https://www.parkrun.com.au/werribeeparkmansion	Removed
2023-01-28	Western Springs parkrun	New Zealand	Extreme weather, course flooded.	https://www.parkrun.co.nz/westernsprings	Removed
2023-01-28	Whakatane Gardens parkrun	New Zealand	the relentless bad weather event	https://www.parkrun.co.nz/whakatanegardens	Removed
2023-01-28	White Rock parkrun	Australia	The conservation estate is closed due to bushfire.	https://www.parkrun.com.au/whiterock	Removed
2023-01-28	Whiteley parkrun	United Kingdom	on going work by council on paths	https://www.parkrun.org.uk/whiteley	Removed
2023-01-28	Witton parkrun	United Kingdom	Northern Cross Country	https://www.parkrun.org.uk/witton	Removed
2023-01-28	parkrun Las Łagiewnicki	Poland	Brak zgody zarządcy terenu na organizację parkrun	https://www.parkrun.pl/laslagiewnicki	Removed
2023-01-28	parkrun Olsztyn	Poland	Bardzo duże oblodzenia trasy.	https://www.parkrun.pl/olsztyn	Removed
2023-01-28	parkrun de Fontainebleau	France	parkrun est actuellement suspendu en France	https://www.parkrun.fr/fontainebleau	Removed
2023-01-28	parkrun de Montsouris	France	parkrun est actuellement suspendu en France	https://www.parkrun.fr/montsouris	Removed
2023-01-28	parkrun de Rouen	France	parkrun est actuellement suspendu en France	https://www.parkrun.fr/rouen	Removed
2023-01-28	parkrun de la Ramée	France	parkrun est actuellement suspendu en France	https://www.parkrun.fr/laramee	Removed
2023-01-28	parkrun des Dougnes, Cubnezais	France	parkrun est actuellement suspendu en France	https://www.parkrun.fr/lesdougnes	Removed
2023-01-28	parkrun du Bois de Boulogne, Paris	France	parkrun est actuellement suspendu en France	https://www.parkrun.fr/boisdeboulogne	Removed
2023-01-28	parkrun du Château de Pierre de Bresse	France	parkrun est actuellement suspendu en France	https://www.parkrun.fr/chateaudepierredebresse	Removed
2023-01-28	parkrun du Lac de Divonne	France	parkrun est actuellement suspendu en France	https://www.parkrun.fr/lacdedivonne	Removed
2023-01-29	Cambridge junior parkrun	United Kingdom	Cycling event in the park	https://www.parkrun.org.uk/cambridge-juniors	Removed
2023-01-29	Great Cornard junior parkrun	United Kingdom	Lack of volunteers	https://www.parkrun.org.uk/greatcornard-juniors	Removed
2023-01-29	Prudhoe Riverside junior parkrun	United Kingdom	No Run Director this week	https://www.parkrun.org.uk/prudhoeriverside-juniors	Removed
2023-01-29	St Anne’s junior parkrun	Ireland	Set up for other event taking place	https://www.parkrun.ie/stannes-juniors	Removed
2023-02-04	An Bonnán Buí parkrun	Ireland	Venue not available		Added
2023-02-04	Aspen parkrun	United States	Winter Pause	https://www.parkrun.us/aspen	Added
2023-02-04	Avery Beach parkrun, Huntsville	Canada	Winter Pause	https://www.parkrun.ca/averybeach	Added
2023-02-04	Barton Trail parkrun	Canada	Winter Pause	https://www.parkrun.ca/bartontrail	Added
2023-02-04	Bellevue parkrun	Canada	Winter Pause	https://www.parkrun.ca/bellevue	Added
2023-02-04	Braidwood Showground parkrun	Australia	Works being done at showground. Cannot use course.	https://www.parkrun.com.au/braidwoodshowground	Added
2023-02-04	Brecksville Reservation parkrun	United States	Winter Pause	https://www.parkrun.us/brecksvillereservation	Added
2023-02-04	Cobram parkrun	Australia	River flooding	https://www.parkrun.com.au/cobram	Added
2023-02-04	Cranleigh parkrun	United Kingdom	Continuing redevelopment of park	https://www.parkrun.org.uk/cranleigh	Added
2023-02-04	Curl Curl parkrun	Australia	Sun Run 2023 -Dee Why to Manly via our course	https://www.parkrun.com.au/curlcurl	Added
2023-02-04	Ekebergsletta parkrun	Norway	Winter Pause	https://www.parkrun.no/ekebergsletta	Added
2023-02-04	Eldorado Park parkrun	South Africa	School Athletics	https://www.parkrun.co.za/eldoradopark	Added
2023-02-04	Fingal Bay parkrun	Australia	Major surf carnival being conducted	https://www.parkrun.com.au/fingalbay	Added
2023-02-04	Greenpoint parkrun	South Africa	New route pending approval	https://www.parkrun.co.za/greenpoint	Added
2023-02-04	Holyrood parkrun	United Kingdom	Clash with organised event, paths unusable	https://www.parkrun.org.uk/holyrood	Added
2023-02-04	Huddinge parkrun	Sweden	Vinterpaus	https://www.parkrun.se/huddinge	Added
2023-02-04	Lancefield parkrun	Australia	Track damage	https://www.parkrun.com.au/lancefield	Added
2023-02-04	Lillsjön parkrun	Sweden	Vinterpaus	https://www.parkrun.se/lillsjon	Added
2023-02-04	Melaleuca parkrun	Australia	Insufficient Rec Staff Available		Added
2023-02-04	Middelburg parkrun	South Africa	Venue not available.		Added
2023-02-04	Mildura Weir parkrun	Australia	awaiting track repair and no alt course approved	https://www.parkrun.com.au/milduraweir	Added
2023-02-04	Ormskirk parkrun	United Kingdom	Collage closures	https://www.parkrun.org.uk/ormskirk	Added
2023-02-04	Puolarmaari parkrun	Finland	Winter Pause	https://www.parkrun.fi/puolarmaari	Added
2023-02-04	Renmark parkrun	Australia	Flood damage and an ongoing flood alert	https://www.parkrun.com.au/renmark	Added
2023-02-04	Saint-Paulin parkrun	Canada	Winter Pause	https://www.parkrun.ca/saintpaulin	Added
2023-02-04	Snye Point parkrun	Canada	artic winter games conflict	https://www.parkrun.ca/snyepoint	Added
2023-02-04	Sunshine Beach parkrun	Japan	ボランティアスタッフが集まらないため	https://www.parkrun.jp/sunshinebeach	Added
2023-02-04	Taman Tasik Danau Kota parkrun	Malaysia	This event is closed until further notice.	https://www.parkrun.my/tamantasikdanaukota	Added
2023-02-04	Town Moor parkrun	United Kingdom	Winter Warmer Event taking over our course	https://www.parkrun.org.uk/townmoor	Added
2023-02-04	Waterford Nature parkrun	Ireland	Event suspended until further notice.	https://www.parkrun.ie/waterfordnature	Added
2023-02-04	Welkom parkrun	South Africa	Other events - School Sport	https://www.parkrun.co.za/welkom	Added
2023-02-04	Whiteley parkrun	United Kingdom	on going work by council on paths	https://www.parkrun.org.uk/whiteley	Added
2023-02-04	Witton parkrun	United Kingdom	Cross Country	https://www.parkrun.org.uk/witton	Added
2023-02-04	parkrun de Fontainebleau	France	parkrun est actuellement suspendu en France	https://www.parkrun.fr/fontainebleau	Added
2023-02-04	parkrun de Montsouris	France	parkrun est actuellement suspendu en France	https://www.parkrun.fr/montsouris	Added
2023-02-04	parkrun de Rouen	France	parkrun est actuellement suspendu en France	https://www.parkrun.fr/rouen	Added
2023-02-04	parkrun de la Ramée	France	parkrun est actuellement suspendu en France	https://www.parkrun.fr/laramee	Added
2023-02-04	parkrun des Dougnes, Cubnezais	France	parkrun est actuellement suspendu en France	https://www.parkrun.fr/lesdougnes	Added
2023-02-04	parkrun du Bois de Boulogne, Paris	France	parkrun est actuellement suspendu en France	https://www.parkrun.fr/boisdeboulogne	Added
2023-02-04	parkrun du Château de Pierre de Bresse	France	parkrun est actuellement suspendu en France	https://www.parkrun.fr/chateaudepierredebresse	Added
2023-02-04	parkrun du Lac de Divonne	France	parkrun est actuellement suspendu en France	https://www.parkrun.fr/lacdedivonne	Added
2023-02-05	Dewsbury junior parkrun	United Kingdom	core team unavailable due to Dewsbury 10k	https://www.parkrun.org.uk/dewsbury-juniors	Added
2023-02-05	Maldon Prom junior parkrun	United Kingdom	Military vehicles display in the park	https://www.parkrun.org.uk/maldonprom-juniors	Added
2023-02-05	Wilton Park junior parkrun	United Kingdom	Dewsbury 10k - road closure affects access to park	https://www.parkrun.org.uk/wiltonpark-juniors	Added
2023-01-30 01:10:42.199090				
