Date	Event	Country	Cancellation Note	Website
2026-01-18	Ballincollig Regional junior parkrun	Ireland	Weather	https://www.parkrun.ie/ballincolligregional-juniors
2026-01-18	Duloch junior parkrun	United Kingdom	Course unsafe or blocked	https://www.parkrun.org.uk/duloch-juniors
2026-01-18	Fife Cycle Park junior parkrun	United Kingdom	Weather	https://www.parkrun.org.uk/fifecyclepark-juniors
2026-01-18	Graves junior parkrun	United Kingdom	Weather	https://www.parkrun.org.uk/graves-juniors
2026-01-18	Millbank Boating Pond junior parkrun	United Kingdom	Weather	https://www.parkrun.org.uk/millbankboatingpond-juniors
2026-01-18	St Mary’s Campus junior parkrun	Ireland	Weather	https://www.parkrun.ie/stmaryscampus-juniors
2026-01-18 09:16:29.750688			
