Date	Event	Country	Cancellation Note	Website	Added or Removed
2022-05-21	Brandkop parkrun	South Africa	Route too slipery due to heavy rain	https://www.parkrun.co.za/brandkop	Added
2022-05-21	Dusi parkrun	South Africa	Flooding has made parts of the course unusable.	https://www.parkrun.co.za/dusi	Added
2022-05-21	Gladstone QLD parkrun	Australia	Both A and B course flooded	https://www.parkrun.com.au/gladstoneqld	Added
2022-05-21	Jeffreys Bay parkrun	South Africa	Too wet and muddy after two days of rain.	https://www.parkrun.co.za/jeffreysbay	Added
2022-05-21	Tennogawa koen parkrun	Japan	降雨により、コース上の安全が確保されないため	https://www.parkrun.jp/tennogawakoen	Added
2022-05-21	White Rock parkrun	Australia	Ongoing trail damage from weather event	https://www.parkrun.com.au/whiterock	Added
2022-05-21 05:15:51.104646				
