Date	Event	Country	Cancellation Note	Website	Added or Removed
2023-06-10	Benalla Botanical Gardens parkrun	Australia	Course unsafe or blocked	https://www.parkrun.com.au/benallabotanicalgardens	Added
2023-06-10	Chaffey Park parkrun	Australia	unforeseen circumstances	https://www.parkrun.com.au/chaffeypark	Added
2023-06-10	Euroa parkrun	Australia	key paths unusable due to minor flooding	https://www.parkrun.com.au/euroa	Added
2023-06-10	Menai parkrun	Australia	No Run Director available.	https://www.parkrun.com.au/menai	Added
2023-06-09 12:34:29.717437				
