Date	Event	Country	Cancellation Note	Website
2023-04-15	Bower Park parkrun	United Kingdom	Drainage work makes keys paths unusable.	https://www.parkrun.org.uk/bowerpark
2023-04-15	Mtunzini parkrun	South Africa	Clashing event on same property.	https://www.parkrun.co.za/mtunzini
2023-04-15	Somerdale Pavilion parkrun	United Kingdom	It's Wet Wet Wet. The course that is, not the grou	https://www.parkrun.org.uk/somerdalepavilion
2023-04-15	Werribee Park Mansion parkrun	Australia	Damage to course	https://www.parkrun.com.au/werribeeparkmansion
2023-04-16	Dukeries junior parkrun	United Kingdom	Shortage of volunteers	https://www.parkrun.org.uk/dukeries-juniors
2023-04-13 12:28:12.796794			
