Date	Event	Country	Cancellation Note	Website	Added or Removed
2022-11-05	Euroa parkrun	Australia	Flood Damage	https://www.parkrun.com.au/euroa	Added
2022-11-05	Kerang Regional parkrun	Australia	Flooding, need to limit foot traffic on levee	https://www.parkrun.com.au/kerangregional	Added
2022-11-05	Lancefield parkrun	Australia	Water on parts of the course	https://www.parkrun.com.au/lancefield	Added
2022-11-05	Shepparton parkrun	Australia	course flooded, paths are not clear	https://www.parkrun.com.au/shepparton	Added
2022-11-02 09:18:44.649614				
