Date	Event	Country	Cancellation Note	Website	Added or Removed
2022-05-28	East Sutton Park parkrun	United Kingdom	Staff Shortages		Added
2022-05-28	Greenpoint parkrun	South Africa	Not enough volunteers	https://www.parkrun.co.za/greenpoint	Added
2022-05-28	Mount Pleasant parkrun	United Kingdom	weather restrictions and staff shortage		Added
2022-05-29	Guildford junior parkrun	United Kingdom	Travelling encampment on the route currently.	https://www.parkrun.org.uk/guildford-juniors	Added
2022-05-27 18:29:29.062799				
