Date	Event	Country	Cancellation Note	Website	Added or Removed
2026-01-18	Ballincollig Regional junior parkrun	Ireland	Weather	https://www.parkrun.ie/ballincolligregional-juniors	Added
2026-01-18	Duloch junior parkrun	United Kingdom	Course unsafe or blocked	https://www.parkrun.org.uk/duloch-juniors	Added
2026-01-18	Fife Cycle Park junior parkrun	United Kingdom	Weather	https://www.parkrun.org.uk/fifecyclepark-juniors	Added
2026-01-18	Graves junior parkrun	United Kingdom	Weather	https://www.parkrun.org.uk/graves-juniors	Added
2026-01-18	Millbank Boating Pond junior parkrun	United Kingdom	Weather	https://www.parkrun.org.uk/millbankboatingpond-juniors	Added
2026-01-18	St Mary’s Campus junior parkrun	Ireland	Weather	https://www.parkrun.ie/stmaryscampus-juniors	Added
2026-01-18 09:16:29.750786				
