Date	Event	Country	Cancellation Note	Website
2023-04-08	Aggeneys parkrun	South Africa	Route closed due to construction of new waterline	https://www.parkrun.co.za/aggeneys
2023-04-08	Barberton parkrun	South Africa	course abandoned, moving to new course soon	https://www.parkrun.co.za/barberton
2023-04-08	Noordwyk parkrun	South Africa	Event Core Volunteer Team Not Available	https://www.parkrun.co.za/noordwyk
2023-04-09	Northala Fields junior parkrun	United Kingdom	Insufficient Volunteers	https://www.parkrun.org.uk/northalafields-juniors
2023-04-06 12:26:27.146905			
