Date	Event	Country	Cancellation Note	Website
2022-12-03	Albury Wodonga parkrun	Australia	due to flooding on course	https://www.parkrun.com.au/alburywodonga
2022-12-04	Ashlyns junior parkrun	United Kingdom	Cyclocross event on course	https://www.parkrun.org.uk/ashlyns-juniors
2022-12-03	Aspen parkrun	United States	paused for winter	https://www.parkrun.us/aspen
2022-12-03	Balyang Sanctuary parkrun	Australia	Paths closed by land manager after recent flooding	https://www.parkrun.com.au/balyangsanctuary
2022-12-04	Barshaw junior parkrun	United Kingdom	Jingle Bell run in park	https://www.parkrun.org.uk/barshaw-juniors
2022-12-04	Bellevue Park junior parkrun	Australia	Unable to fill volunteer roster	https://www.parkrun.com.au/bellevuepark-juniors
2022-12-03	Bellevue parkrun	Canada	due to another event!	https://www.parkrun.ca/bellevue
2022-12-03	Braidwood Showground parkrun	Australia	Works being done at showground. Cannot use course.	https://www.parkrun.com.au/braidwoodshowground
2022-12-03	Burswood Peninsula parkrun	Australia	Cricket Test Match (30th Nov - 4th Dec)	https://www.parkrun.com.au/burswoodpeninsula
2022-12-03	Canyon Rim Trail parkrun	United States	Another event is scheduled at our location.	https://www.parkrun.us/canyonrimtrail
2022-12-03	Centennial parkrun	Australia	Good Things Music Festival - Park is closed.	https://www.parkrun.com.au/centennial
2022-12-04	Chelmsford junior parkrun	United Kingdom	Santa fun run taking place in the park	https://www.parkrun.org.uk/chelmsford-juniors
2022-12-04	Clitheroe Castle junior parkrun	United Kingdom	No RD available this week	https://www.parkrun.org.uk/clitheroecastle-juniors
2022-12-03	Clonmel parkrun	Ireland	Course flooded	https://www.parkrun.ie/clonmel
2022-12-03	Cobram parkrun	Australia	Cobram parkrun	https://www.parkrun.com.au/cobram
2022-12-03	Courthouse Lake parkrun	United States	Ice on trail combined with windchills forecast	https://www.parkrun.us/courthouselake
2022-12-03	Cranleigh parkrun	United Kingdom	continuing park redevelopment	https://www.parkrun.org.uk/cranleigh
2022-12-03	Crathes Castle parkrun	United Kingdom	Recent flood damage and ongoing forestry ops	https://www.parkrun.org.uk/crathescastle
2022-12-04	Dixton junior parkrun, Monmouth	United Kingdom	Santa fun run at 10am in Monmouth instead	https://www.parkrun.org.uk/dixton-juniors
2022-12-03	Echuca Moama parkrun	Australia	Safety: flooded course	https://www.parkrun.com.au/echucamoama
2022-12-03	Edenbrook Country parkrun	United Kingdom	Events at leisure centre	https://www.parkrun.org.uk/edenbrookcountry
2022-12-03	Edwin Carolan Community parkrun	Ireland	Building Works on Track For For-seeable Future	https://www.parkrun.ie/edwincarolancommunity
2022-12-03	Euroa parkrun	Australia	Track damage from floods	https://www.parkrun.com.au/euroa
2022-12-03	Franschhoek parkrun	South Africa	Run the Vines Trailrun - homerun course being used	https://www.parkrun.co.za/franschhoek
2022-12-03	Greenpoint parkrun	South Africa	Road works. New course to be approved.	https://www.parkrun.co.za/greenpoint
2022-12-04	Guildford junior parkrun	United Kingdom	Santa Run in park	https://www.parkrun.org.uk/guildford-juniors
2022-12-03	Hampton Oval parkrun	Australia	beach part of course closed due to crocodile risk	https://www.parkrun.com.au/hamptonoval
2022-12-03	Heartlands parkrun	United Kingdom	Christmas Markets - Site unavailable	https://www.parkrun.org.uk/heartlands
2022-12-03	Henstridge Airfield parkrun	United Kingdom	Excessive flooding on course	https://www.parkrun.org.uk/henstridgeairfield
2022-12-03	Huddinge parkrun	Sweden	För mycket is på banan	https://www.parkrun.se/huddinge
2022-12-04	Inverleith junior parkrun	United Kingdom	Christmas charity festival & races using the park	https://www.parkrun.org.uk/inverleith-juniors
2022-12-03	Joe Creason parkrun	United States	Louisville Metro Parks Santa Sleigh 5K	https://www.parkrun.us/joecreason
2022-12-03	Kingston Park parkrun	Australia	Construction of New Track	https://www.parkrun.com.au/kingstonpark
2022-12-04	King’s Lynn junior parkrun	United Kingdom	Run director illness / no replacement RD available	https://www.parkrun.org.uk/kingslynn-juniors
2022-12-03	Kwanele parkrun	South Africa	Core volunteers team unavailable.	https://www.parkrun.co.za/kwanele
2022-12-03	Lancefield parkrun	Australia	Track damage	https://www.parkrun.com.au/lancefield
2022-12-03	Land’s End parkrun	United Kingdom	Annual HERO LEJOG car rally taking place	https://www.parkrun.org.uk/landsend
2022-12-03	Lews Castle parkrun	United Kingdom	Local race event	https://www.parkrun.org.uk/lewscastle
2022-12-03	Llanerchaeron parkrun	United Kingdom	National Trust Christmas Fair weekend	https://www.parkrun.org.uk/llanerchaeron
2022-12-03	Markeaton parkrun	United Kingdom	Family Festivities taking place in the park	https://www.parkrun.org.uk/markeaton
2022-12-03	Markshall Estate parkrun	United Kingdom	Christmas market event at Markshall Estate	https://www.parkrun.org.uk/markshallestate
2022-12-03	McAllister parkrun	United States	This event is closed until further notice.	
2022-12-03	McLean Beach parkrun	Australia	Flooded course	https://www.parkrun.com.au/mcleanbeach
2022-12-03	Melaleuca parkrun	Australia	Insufficient Rec Staff Available	
2022-12-03	Middelburg parkrun	South Africa	Venue no longer available.	https://www.parkrun.co.za/middelburg
2022-12-03	Mildura Weir parkrun	Australia	Flooding	https://www.parkrun.com.au/milduraweir
2022-12-03	Mitchells Plain parkrun	South Africa	DSTV Festival is happening on this day	https://www.parkrun.co.za/mitchellsplain
2022-12-03	Murray Bridge parkrun	Australia	rising river levels affecting course	https://www.parkrun.com.au/murraybridge
2022-12-03	Narromine Wetlands parkrun	Australia	Track continues to be flooded and unsafe	https://www.parkrun.com.au/narrominewetlands
2022-12-03	Newport parkrun	United Kingdom	Continuing groundworks on course	https://www.parkrun.org.uk/newport
2022-12-03	North Shore parkrun	Australia	Lack of volunteers	https://www.parkrun.com.au/northshore
2022-12-03	Oakwell Hall parkrun	United Kingdom	Christmas fair in the park	https://www.parkrun.org.uk/oakwellhall
2022-12-03	Oiso undokoen parkrun	Japan	ディレクターが確保できないため。	https://www.parkrun.jp/oisoundokoen
2022-12-03	Pakapakanthi parkrun	Australia	Adelaide 500 car race using the park	https://www.parkrun.com.au/pakapakanthi
2022-12-03	Pongola parkrun	South Africa	Core volunteers not available	https://www.parkrun.co.za/pongola
2022-12-04	Prestatyn Prom junior parkrun	United Kingdom	No Run Director available.	https://www.parkrun.org.uk/prestatynprom-juniors
2022-12-03	Puolarmaari parkrun	Finland	Icy conditions	https://www.parkrun.fi/puolarmaari
2022-12-04	Reigate Priory junior parkrun	United Kingdom	YMCA Santa run happening in same location	https://www.parkrun.org.uk/reigatepriory-juniors
2022-12-03	Richards Bay parkrun	South Africa	Event taking place in the park	https://www.parkrun.co.za/richardsbay
2022-12-03	Riverbank parkrun	Australia	Course damaged by flood waters, relocation pending	https://www.parkrun.com.au/riverbank
2022-12-03	Riverway parkrun	Australia	Christmas Carol Event Set Up in Park	https://www.parkrun.com.au/riverway
2022-12-03	Salcey Forest parkrun	United Kingdom	Landowner hosting another event, cannot use route.	https://www.parkrun.org.uk/salceyforest
2022-12-03	Shawnigan Hills parkrun	Canada	Snow forecast - cannot guarantee safety of course.	https://www.parkrun.ca/shawniganhills
2022-12-03	Snye Point parkrun	Canada	Wind chill minus 32 - Extreme cold	https://www.parkrun.ca/snyepoint
2022-12-03	Sport Ireland Campus parkrun	Ireland	Course closed World Cyclocross Champs preparation	https://www.parkrun.ie/sportirelandcampus
2022-12-03	St Helens parkrun	United Kingdom	Event taking place in the park	https://www.parkrun.org.uk/sthelens
2022-12-04	Stanley Park junior parkrun	United Kingdom	Clash with Santa dash	https://www.parkrun.org.uk/stanleypark-juniors
2022-12-03	Taman Tasik Danau Kota parkrun	Malaysia	This event is closed until further notice.	https://www.parkrun.my/tamantasikdanaukota
2022-12-03	Tetbury Goods Shed parkrun	United Kingdom	another event at Goods shed	https://www.parkrun.org.uk/tetburygoodsshed
2022-12-03	Urayasushi sogo koen parkrun	Japan	ボランティア都合のため	https://www.parkrun.jp/urayasushisogokoen
2022-12-03	Ventersburg parkrun	South Africa	Wet and hazardous	https://www.parkrun.co.za/ventersburg
2022-12-03	Wangaratta parkrun	Australia	River level still flooding the pathway	https://www.parkrun.com.au/wangaratta
2022-12-03	Waterloo Plains parkrun	Australia	Track is slippery and dangerous	https://www.parkrun.com.au/waterlooplains
2022-12-03	Werribee Park Mansion parkrun	Australia	Damage to course	https://www.parkrun.com.au/werribeeparkmansion
2022-12-04	Weston-super-Mare junior parkrun	United Kingdom	No RDs available due to local event	https://www.parkrun.org.uk/westonsupermare-juniors
2022-12-03	Whiteley parkrun	United Kingdom	Council works in park, key paths unusable	https://www.parkrun.org.uk/whiteley
2022-12-03	Winthrop Trailhead parkrun	United States	Extremely cold temps (<3F) and snow forecast.	https://www.parkrun.us/winthroptrailhead
2022-12-03	Witton parkrun	United Kingdom	Cross Country	https://www.parkrun.org.uk/witton
2022-12-04	Wyndham junior parkrun	United Kingdom	Rotary charity Santa Fun taking place in the park	https://www.parkrun.org.uk/wyndham-juniors
2022-12-03	Yodogawa kasenkoen Hirakata chiku parkrun	Japan	Canceled due to marathon event	https://www.parkrun.jp/yodogawakasenkoenhirakatachiku
2022-12-03	parkrun de Fontainebleau	France	parkrun est actuellement suspendu en France	https://www.parkrun.fr/fontainebleau
2022-12-03	parkrun de Montsouris	France	parkrun est actuellement suspendu en France	https://www.parkrun.fr/montsouris
2022-12-03	parkrun de Rouen	France	parkrun est actuellement suspendu en France	https://www.parkrun.fr/rouen
2022-12-03	parkrun de la Ramée	France	parkrun est actuellement suspendu en France	https://www.parkrun.fr/laramee
2022-12-03	parkrun des Dougnes, Cubnezais	France	parkrun est actuellement suspendu en France	https://www.parkrun.fr/lesdougnes
2022-12-03	parkrun du Bois de Boulogne, Paris	France	parkrun est actuellement suspendu en France	https://www.parkrun.fr/boisdeboulogne
2022-12-03	parkrun du Château de Pierre de Bresse	France	parkrun est actuellement suspendu en France	https://www.parkrun.fr/chateaudepierredebresse
2022-12-03	parkrun du Lac de Divonne	France	parkrun est actuellement suspendu en France	https://www.parkrun.fr/lacdedivonne
