Date	Event	Country	Cancellation Note	Website	Added or Removed
2026-01-25	Broadmeadow junior parkrun	United Kingdom	Shortage of volunteers	https://www.parkrun.org.uk/broadmeadow-juniors	Added
2026-01-25	Cobb Gate junior parkrun	United Kingdom	Weather	https://www.parkrun.org.uk/cobbgate-juniors	Added
2026-01-25	Cowick Barton Playing Fields junior parkrun	United Kingdom	Weather	https://www.parkrun.org.uk/cowickbartonpf-juniors	Added
2026-01-25	Dromleena Lawn junior parkrun	Ireland	Course unsafe or blocked	https://www.parkrun.ie/dromleenalawn-juniors	Added
2026-01-25	Griffeen junior parkrun	Ireland	Course unsafe or blocked	https://www.parkrun.ie/griffeen-juniors	Added
2026-01-25	Ormeau junior parkrun	United Kingdom	Course unsafe or blocked	https://www.parkrun.org.uk/ormeau-juniors	Added
2026-01-25	Pinehill junior parkrun	United Kingdom	Course unsafe or blocked	https://www.parkrun.org.uk/pinehill-juniors	Added
2026-01-25	South Beach Estate junior parkrun	United Kingdom	Weather	https://www.parkrun.org.uk/southbeachestate-juniors	Added
2026-01-25 15:15:23.407896				
