Event	Country	Cancellation Note	Website	Added or Removed
Druridge Bay parkrun	United Kingdom	park still closed due to storm damage	https://www.parkrun.org.uk/druridgebay	Added
Landesgartenschau Park parkrun	Germany	Aktuelle Corona-Situation	https://www.parkrun.com.de/landesgartenschaupark	Added
Rothay Park parkrun	United Kingdom	Aftermath of Storm, paths not clear	https://www.parkrun.org.uk/rothaypark	Added
Southport parkrun	United Kingdom	Trees still down in park obstructing paths.	https://www.parkrun.org.uk/southport	Added
2021-12-09 18:18:52.084929				
