Date	Event	Country	Cancellation Note	Website	Added or Removed
2023-01-14	Prieska parkrun	South Africa	no attendance	https://www.parkrun.co.za/prieska	Added
2023-01-14	Strathcona Island parkrun	Canada	The course is too icy to proceed safely.	https://www.parkrun.ca/strathconaisland	Added
2023-01-15	Dixton junior parkrun, Monmouth	United Kingdom	Flooded course	https://www.parkrun.org.uk/dixton-juniors	Added
2023-01-15	Medina I.O.W junior parkrun	United Kingdom	waterlogged course and safety of the children	https://www.parkrun.org.uk/medina-juniors	Added
2023-01-15	Queen’s Parade junior parkrun, Aldershot	United Kingdom	Field water logged and not safe for running	https://www.parkrun.org.uk/queensparade-juniors	Added
2023-01-15	Whaley Bridge junior parkrun	United Kingdom	not enough marshals to safety put in the event	https://www.parkrun.org.uk/whaleybridge-juniors	Added
2023-01-15	Winchester junior parkrun	United Kingdom	Park waterlogged, route unusable	https://www.parkrun.org.uk/winchester-juniors	Added
2023-01-14 18:16:14.695899				
