Date	Event	Country	Cancellation Note	Website	Added or Removed
2022-10-08	Aliwal North parkrun	South Africa	Event Closed	https://www.parkrun.co.za/aliwalnorth	Removed
2022-10-08	Pobalscoil na Tríonóide parkrun	Ireland	Ongoing Construction Work	https://www.parkrun.ie/pobalscoilnatrionoide	Added
2022-10-08	Sixmilewater parkrun	United Kingdom	Ongoing Construction work along the Parkrun route.	https://www.parkrun.org.uk/sixmilewater	Added
2022-10-08	parkrun Chełm	Poland	nowa trasa nie ma jeszcze zgody Urzedu Miasta	https://www.parkrun.pl/chelm	Added
2022-10-09	Paddington Rec junior parkrun	United Kingdom	Paths being repaved.	https://www.parkrun.org.uk/paddingtonrec-juniors	Added
2022-10-05 18:35:53.284616				
