Date	Event	Country	Cancellation Note	Website	Added or Removed
2022-09-04	Burgess junior parkrun	United Kingdom	Our volunteer team will be running The Big Half!	https://www.parkrun.org.uk/burgess-juniors	Added
2022-09-04	Cheltenham junior parkrun	United Kingdom	CHELTENHAM HALF MARATHON, ACCESS ROADS CLOSED	https://www.parkrun.org.uk/cheltenham-juniors	Added
2022-09-04	Derry City junior parkrun	United Kingdom	Course being used for Waterside Half Marathon	https://www.parkrun.org.uk/derrycity-juniors	Added
2022-09-04	Eltham junior parkrun	United Kingdom	Core Team Unavailable	https://www.parkrun.org.uk/eltham-juniors	Added
2022-09-04	Faversham Recreation Ground junior parkrun	United Kingdom	Due to Hop Festival aftermath	https://www.parkrun.org.uk/favershamrec-juniors	Added
2022-09-04	Griffeen junior parkrun	Ireland	Works on going in the park	https://www.parkrun.ie/griffeen-juniors	Added
2022-09-04	Kennington Park junior parkrun	United Kingdom	No core team	https://www.parkrun.org.uk/kenningtonpark-juniors	Added
2022-09-04	King George V junior parkrun	United Kingdom	Food & River Festival in park; key paths unusable	https://www.parkrun.org.uk/kinggeorgev-juniors	Added
2022-09-04	Knavesmire junior parkrun	United Kingdom	Race meeting on the Knavesmire	https://www.parkrun.org.uk/knavesmire-juniors	Added
2022-09-04	Melton Mowbray junior parkrun	United Kingdom	Moved to Play Close Park juniors now		Added
2022-09-04	Prestatyn Prom junior parkrun	United Kingdom	No Run Director available.	https://www.parkrun.org.uk/prestatynprom-juniors	Added
2022-09-04	Queen’s Park junior parkrun, Rochdale	United Kingdom	Annual Fete in the park using most of our paths	https://www.parkrun.org.uk/queensparkrochdale-juniors	Added
2022-09-04	Shipley Country junior parkrun	United Kingdom	Food Fair in park on key parts of route	https://www.parkrun.org.uk/shipleycountry-juniors	Added
2022-09-04	Stratford-upon-Avon Rec junior parkrun	United Kingdom	Stratford Big 10k using the Rec	https://www.parkrun.org.uk/stratforduponavonrec-juniors	Added
2022-09-04	War Memorial Park junior parkrun	United Kingdom	Godiva Festival - landowner request to cancel	https://www.parkrun.org.uk/warmemorialpark-juniors	Added
2022-09-04	West End junior parkrun	United Kingdom	Armed forces event in the park	https://www.parkrun.org.uk/westend-juniors	Added
2022-09-04	Wilton Park junior parkrun	United Kingdom	Event setup, as cars impact safety / finish funnel	https://www.parkrun.org.uk/wiltonpark-juniors	Added
2022-09-04	Wimpole Estate junior parkrun	United Kingdom	Temporary Pause - Event Team retraining	https://www.parkrun.org.uk/wimpoleestate-juniors	Added
2022-08-29 02:03:06.187963				
