Date	Event	Country	Cancellation Note	Website	Added or Removed
2023-01-21	Cobaw Clunes parkrun	Australia	Unit lockdown prevented event from taking place		Added
2023-01-22	King George V junior parkrun	United Kingdom	Icy and unsafe paths	https://www.parkrun.org.uk/kinggeorgev-juniors	Added
2023-01-22	Play Close Park junior parkrun	United Kingdom	Icy paths and freezing temperatures.	https://www.parkrun.org.uk/playclosepark-juniors	Added
2023-01-22	Swadlincote junior parkrun	United Kingdom	Due to icy conditions	https://www.parkrun.org.uk/swadlincote-juniors	Added
2023-01-22 00:57:28.241613				
