Date	Event	Country	Cancellation Note	Website
2022-01-22	Bellville parkrun	South Africa	Still waiting for City of Cape Town Event Permit	https://www.parkrun.co.za/bellville
2022-01-22	Lismore parkrun	Australia	Part of course under water due to minor flooding.	https://www.parkrun.com.au/lismore
2022-01-22	Mt Penang parkrun	Australia	landowner permit in progress	https://www.parkrun.com.au/mtpenang
2022-01-22	Nahoon Point parkrun	South Africa	Awaiting permission from local authority.	https://www.parkrun.co.za/nahoonpoint
2022-01-22	Wienburgpark parkrun	Germany	weiterhin nicht startbereit	https://www.parkrun.com.de/wienburgpark
2022-01-22	parkrun Kolchugino City Park	Russia	Не очищена трасса	https://www.parkrun.ru/kolchuginocitypark
2022-01-21 12:32:37.804678			
