Date	Event	Country	Cancellation Note	Website	Added or Removed
2022-08-20	Meijo koen parkrun	Japan	台風接近につき	https://www.parkrun.jp/meijokoen	Removed
2022-08-20	Taman Pudu Ulu parkrun	Malaysia	COVID-19 (Coronavirus)	https://www.parkrun.my/tamanpuduulu	Removed
2022-08-20	The Terrace parkrun	Australia	mud on course from floods	https://www.parkrun.com.au/theterrace	Added
2022-08-21	King George junior parkrun	United Kingdom	Fun Fair in the park, key paths obstructing	https://www.parkrun.org.uk/kinggeorge-juniors	Added
2022-08-18 09:18:30.072181				
