Date	Event	Country	Cancellation Note	Website
2022-06-25	Jeffreys Bay parkrun	South Africa	Course slippery and flooded after heavy rain	https://www.parkrun.co.za/jeffreysbay
2022-06-25	Kleinplaas parkrun	South Africa	unpredictable weather and unsafe terrain	https://www.parkrun.co.za/kleinplaas
2022-06-25	Lady Slipper parkrun	South Africa	still work needed on route and venue	https://www.parkrun.co.za/ladyslipper
2022-06-25	Richards Bay parkrun	South Africa	Unexpected event and closure of the route	https://www.parkrun.co.za/richardsbay
2022-06-25	Ruimsig parkrun	South Africa	Core team not available	https://www.parkrun.co.za/ruimsig
2022-06-25	Tampere parkrun	Finland	Ei ole riittävästi vapaaehtoisia	https://www.parkrun.fi/tampere
2022-06-26	Gardenhurst Estate junior parkrun	United Kingdom	Event at Hockey Club	https://www.parkrun.org.uk/gardenhurstestate-juniors
2022-06-24 18:29:20.859312			
