Date	Event	Country	Cancellation Note	Website
2022-12-24	Eagan parkrun	United States	ice, snow, cold!!!	https://www.parkrun.us/eagan
2022-12-24	Hamlet Park parkrun	United States	Blizzard conditions and dangerous wind chill temps	https://www.parkrun.us/hamletpark
2022-12-24	Tetbury Goods Shed parkrun	United Kingdom	Too few Volunteers on the line	https://www.parkrun.org.uk/tetburygoodsshed
2022-12-24	Weavers Country Estate parkrun	South Africa	Water logged	https://www.parkrun.co.za/weaverscountryestate
2022-12-22 18:18:10.882896			
