Date	Event	Country	Cancellation Note	Website
2023-01-07	Chipping Norton School parkrun	United Kingdom	Course conditions and weather forecast	https://www.parkrun.org.uk/chippingnortonschool
2023-01-07	Hondajima parkrun	Japan	ボランティア不足のため	https://www.parkrun.jp/hondajima
2023-01-07	McLean Beach parkrun	Australia	course closed after recent flooding	https://www.parkrun.com.au/mcleanbeach
2023-01-08	Shelley junior parkrun	United Kingdom	waterlogged course	https://www.parkrun.org.uk/shelley-juniors
2023-01-06 09:18:38.495684			
