Date	Event	Country	Cancellation Note	Website
2022-09-10	Albury Wodonga parkrun	Australia	Due to flooding of the course	https://www.parkrun.com.au/alburywodonga
2022-09-10	Century City parkrun	South Africa	Event cancelled due to construction on the route	https://www.parkrun.co.za/centurycity
2022-09-10	Jamestown Golf Course parkrun	Australia	Course inaccessible due to poor weather	https://www.parkrun.com.au/jamestowngolfcourse
2022-09-10	Rouse Hill parkrun	Australia	Course too slippery and wet	https://www.parkrun.com.au/rousehill
2022-09-09 06:41:07.380594			
