Date	Event	Country	Cancellation Note	Website
2022-01-01	Mendel Riverbank parkrun	Canada	Extreme weather conditions	https://www.parkrun.ca/mendelriverbank
2022-01-01	Strathcona Island parkrun	Canada	Due to extremely cold weather	https://www.parkrun.ca/strathconaisland
2022-01-02	Caledonian junior parkrun	United Kingdom	not enough volunteers available	https://www.parkrun.org.uk/caledonian-juniors
2022-01-02	Paddington Rec junior parkrun	United Kingdom	park closure. bank holiday.	https://www.parkrun.org.uk/paddingtonrec-juniors
2022-01-02	Peoples Park junior parkrun	United Kingdom	No Run Directors available	https://www.parkrun.org.uk/peoplespark-juniors
2022-01-01 18:17:38.344148			
