Date	Event	Country	Cancellation Note	Website
2023-06-24	Duikersdrift parkrun, Tulbagh	South Africa	Course unsafe or blocked	https://www.parkrun.co.za/duikersdrift
2023-06-24	George parkrun	South Africa	Course unsafe or blocked	https://www.parkrun.co.za/george
2023-06-24	Groeneweide parkrun	South Africa	After inspection of rout, to much water and unsafe	https://www.parkrun.co.za/groeneweide
2023-06-24	Riviera on Vaal parkrun	South Africa	Golf tournament at Riviera on Vaal	https://www.parkrun.co.za/rivieraonvaal
2023-06-24	Shongweni parkrun	South Africa	Venue unavailable	https://www.parkrun.co.za/shongweni
2023-06-24	Worcester Pitchcroft parkrun	United Kingdom	Balloon Festival event, no public access	https://www.parkrun.org.uk/worcesterpitchcroft
2023-06-22 18:17:18.156005			
