Date	Event	Country	Cancellation Note	Website	Added or Removed
2022-09-17	Chaffey Park parkrun	Australia	course is under water due to flooding	https://www.parkrun.com.au/chaffeypark	Added
2022-09-17	Deep Run parkrun	United States	event no longer happening (#682570)	https://www.parkrun.us/deeprun	Removed
2022-09-17	Dubbo parkrun	Australia	River Flooding Inundating Course	https://www.parkrun.com.au/dubbo	Added
2022-09-17	McLean Beach parkrun	Australia	Path is flooded due to a high river	https://www.parkrun.com.au/mcleanbeach	Added
2022-09-17	Oakwell Hall parkrun	United Kingdom	Landowners request	https://www.parkrun.org.uk/oakwellhall	Added
2022-09-17	Puolarmaari parkrun	Finland	Lack of volunteers	https://www.parkrun.fi/puolarmaari	Added
2022-09-17	Tamworth parkrun	Australia	Due to flooding, path is under water and unusable.	https://www.parkrun.com.au/tamworth	Added
2022-09-17	White Rock parkrun	Australia	Cannot fill essential volunteer roles	https://www.parkrun.com.au/whiterock	Added
2022-09-16 12:49:28.354116				
