Date	Event	Country	Cancellation Note	Website
2022-08-06	Bill Rose Sports Complex parkrun	Australia	complex closed	https://www.parkrun.com.au/billrosesportscomplex
2022-08-06	Braidwood Showground parkrun	Australia	Course is under water.	https://www.parkrun.com.au/braidwoodshowground
2022-08-06	Highbury Fields parkrun	United Kingdom	the park has been closed by police	https://www.parkrun.org.uk/highburyfields
2022-08-06	Kleinplaas parkrun	South Africa	Crossfit using the venue for the day	https://www.parkrun.co.za/kleinplaas
2022-08-06	Werribee Park Mansion parkrun	Australia	No volunteers available for course setup	https://www.parkrun.com.au/werribeeparkmansion
2022-08-06	Westbury Town Common parkrun	Australia	flooding of the course	https://www.parkrun.com.au/westburytowncommon
2022-08-06	Woodbridge Riverside parkrun	Australia	flooding over Parkrun course, unsafe conditions	https://www.parkrun.com.au/woodbridgeriverside
2022-08-07	Bellevue Park junior parkrun	Australia	volunteer roster not filled	https://www.parkrun.com.au/bellevuepark-juniors
2022-08-05 12:48:47.137514			
