Date	Event	Country	Cancellation Note	Website	Added or Removed
2022-03-12	Clermont Waterfront parkrun	United States	Weather forecast does not look safe	https://www.parkrun.us/clermontwaterfront	Added
2022-03-12	College Park parkrun	United States	Winter storm warning: high winds, unsafe travel	https://www.parkrun.us/collegepark	Added
2022-03-12	Deep Run parkrun	United States	Weather and no volunteers	https://www.parkrun.us/deeprun	Added
2022-03-12	Kensington parkrun	United States	Predicted bad weather at 9am	https://www.parkrun.us/kensington	Added
2022-03-12	Roosevelt Island DC parkrun	United States	hazardous weather conditions	https://www.parkrun.us/rooseveltislanddc	Added
2022-03-12 00:57:23.150806				
