Date	Event	Country	Cancellation Note	Website
2022-02-26	Brooklands parkrun	United Kingdom	Funfair is staying an extra week.	https://www.parkrun.org.uk/brooklands
2022-02-26	Downsview parkrun	Canada	Not enough time to get volunteers	https://www.parkrun.ca/downsview
2022-02-26	Henley Wood parkrun, Oswestry	United Kingdom	Waterlogged course needs time to recover.	https://www.parkrun.org.uk/henleywood
2022-02-26	Lanhydrock parkrun	United Kingdom	The estate has so many trees down from the storms	https://www.parkrun.org.uk/lanhydrock
2022-02-26	Snye Point parkrun	Canada	to return in spring	https://www.parkrun.ca/snyepoint
2022-02-26	Whitby parkrun	Canada	Reopening on March 5	https://www.parkrun.ca/whitby
2022-02-21 21:13:46.696594			
