Date	Event	Country	Cancellation Note	Website
2024-02-17	Evesham parkrun	United Kingdom	Flooding on the course.	https://www.parkrun.org.uk/evesham
2024-02-17	Ross-on-Wye parkrun	United Kingdom	One sheet of Plenty did not do the job. Flooded	https://www.parkrun.org.uk/rossonwye
2024-02-17	Somerdale Pavilion parkrun	United Kingdom	Danger of alligator attack (flooded again)	https://www.parkrun.org.uk/somerdalepavilion
2024-02-17	Stratford Park parkrun, Stroud	United Kingdom	Course unsafe or blocked	https://www.parkrun.org.uk/stratfordparkstroud
2024-02-17	Tewkesbury parkrun	United Kingdom	We’re still flooded ?	https://www.parkrun.org.uk/tewkesbury
2024-02-17	Wotton parkrun	United Kingdom	Waterlogged course	https://www.parkrun.org.uk/wotton
2024-02-18	Evesham junior parkrun	United Kingdom	Flooding and water logged route	https://www.parkrun.org.uk/evesham-juniors
2024-02-14 18:16:38.650176			
