Date	Event	Country	Cancellation Note	Website
2022-03-05	Ashgrove parkrun	Australia	course is covered with debris	https://www.parkrun.com.au/ashgrove
2022-03-05	parkrun Angarskie Prudy	Russia	work day, all run directors are busy	https://www.parkrun.ru/angarskieprudy
2022-03-05	parkrun Kimry	Russia	Отмена по причине того, что суббота рабочий день.	https://www.parkrun.ru/kimry
2022-03-06	Peoples Park junior parkrun	United Kingdom	Establishing an event team	https://www.parkrun.org.uk/peoplespark-juniors
2022-02-28 12:26:25.300138			
