Date	Event	Country	Cancellation Note	Website	Added or Removed
2022-01-08	Merimbula parkrun	Australia	Unfortunately still awaiting approval to recommen.	https://www.parkrun.com.au/merimbula	Added
2022-01-08	Montrose Foreshore parkrun	Australia	current covid impact and resourcing	https://www.parkrun.com.au/montroseforeshore	Added
2022-01-08	Ventersburg parkrun	South Africa	Above average rainfall, route covered overgrowth	https://www.parkrun.co.za/ventersburg	Added
2022-01-08	Willow parkrun	Australia	Course flooded	https://www.parkrun.com.au/willow	Added
2022-01-07 06:27:13.025387				
