Date	Event	Country	Cancellation Note	Website	Added or Removed
2024-01-13	Richmond Olympic parkrun	Canada	Weather	https://www.parkrun.ca/richmondolympic	Added
2024-01-13	Riverside parkrun, Grand Rapids	United States	Weather	https://www.parkrun.us/riversidegrandrapids	Added
2024-01-13	Rock Creek Trail parkrun	United States	Inclement weather, icy conditions on the trail.	https://www.parkrun.us/rockcreektrail	Added
2024-01-13	Shawnigan Hills parkrun	Canada	Icy conditions making course unsafe.	https://www.parkrun.ca/shawniganhills	Added
2024-01-13 03:13:55.231712				
