Date	Event	Country	Cancellation Note	Website
2023-03-25	Eldorado Park parkrun	South Africa	Bad Weather conditions	https://www.parkrun.co.za/eldoradopark
2023-03-25	Higginson parkrun, Marlow	United Kingdom	River Thames is on the course!	https://www.parkrun.org.uk/higginsonmarlow
2023-03-25	Mapetla parkrun	South Africa	It was raining and the route was unsafe	https://www.parkrun.co.za/mapetla
2023-03-26	Sutton Lawn junior parkrun	United Kingdom	No available Run Director	https://www.parkrun.org.uk/suttonlawn-juniors
2023-03-25 09:12:11.874090			
