Date	Event	Country	Cancellation Note	Website
2022-07-09	Alexandra parkrun, Moss Side	United Kingdom	An obstacle 5K race requires time for setup	https://www.parkrun.org.uk/alexandra
2022-07-09	Bideford parkrun	United Kingdom	No Run Directors available	https://www.parkrun.org.uk/bideford
2022-07-09	Blue Gum Hills parkrun	Australia	wet weather/flooding, and the course condition.	https://www.parkrun.com.au/bluegumhills
2022-07-09	Mildura Weir parkrun	Australia	Loch maintenance works: key path not accessible	https://www.parkrun.com.au/milduraweir
2022-07-09	The Terrace parkrun	Australia	Course flooded	https://www.parkrun.com.au/theterrace
2022-07-06 15:24:55.180386			
