Date	Event	Country	Cancellation Note	Website	Added or Removed
2022-08-13	Grüner Weg parkrun	Germany	No runners came along.	https://www.parkrun.com.de/gruenerweg	Added
2022-08-13	Progression parkrun	Ireland	insufficient staff (prison based)		Added
2022-08-14	Evesham junior parkrun	United Kingdom	Lack of volunteers	https://www.parkrun.org.uk/evesham-juniors	Added
2022-08-14	Salt Hill junior parkrun	United Kingdom	Not enough volunteers to make the event safe	https://www.parkrun.org.uk/salthill-juniors	Added
2022-08-14	The Great Field junior parkrun	United Kingdom	extreme heat warnings; lack of shade on course	https://www.parkrun.org.uk/thegreatfield-juniors	Added
2022-08-13 12:27:46.294169				
