Date	Event	Country	Cancellation Note	Website
2023-01-01	The Mystery junior parkrun, Wavertree	United Kingdom	New Year's Day *	https://www.parkrun.org.uk/themystery-juniors
2022-12-31	The Spinney parkrun	United Kingdom	Internal staffing issues	
2023-01-01	The Station Yard junior parkrun	United Kingdom	New Year's Day *	https://www.parkrun.org.uk/thestationyard-juniors
2023-01-01	The Waterfront junior parkrun	United Kingdom	New Year's Day	https://www.parkrun.org.uk/thewaterfront-juniors
2023-01-01	The Wirral Way junior parkrun, Parkgate	United Kingdom	New Year's Day.	https://www.parkrun.org.uk/thewirralway-juniors
2022-12-31	Thornbury parkrun	United Kingdom	The course is waterlogged.	https://www.parkrun.org.uk/thornbury
2023-01-01	Thorndon junior parkrun	Australia	Volunteers attending 5km NYD events	https://www.parkrun.com.au/thorndon-juniors
2023-01-01	Tilgate junior parkrun	United Kingdom	New Year's Day *	https://www.parkrun.org.uk/tilgate-juniors
2022-12-31	Toboshane Valley Estate parkrun	South Africa	New Years eve. No volunteers Available	https://www.parkrun.co.za/toboshanevalleyestate
2022-12-31	Tokoinranta parkrun	Finland	Main route covered in ice; route unusable	https://www.parkrun.fi/tokoinranta
2023-01-01	Tokoinranta parkrun	Finland	Main route covered in ice; route is unusable	https://www.parkrun.fi/tokoinranta
2023-01-01	Tolson junior parkrun	United Kingdom	New Year's Day *	https://www.parkrun.org.uk/tolson-juniors
2023-01-01	Tonbridge junior parkrun	United Kingdom	New Years Day 2023	https://www.parkrun.org.uk/tonbridge-juniors
2023-01-01	Tooting Common junior parkrun	United Kingdom	No RDs available	https://www.parkrun.org.uk/tootingcommon-juniors
2023-01-01	Torbay Velopark junior parkrun	United Kingdom	New Year's Day *	https://www.parkrun.org.uk/torbayvelopark-juniors
2023-01-01	Torvean junior parkrun	United Kingdom	Another event in park	https://www.parkrun.org.uk/torvean-juniors
2022-12-31	Torvean parkrun	United Kingdom	path is still very icy in places	https://www.parkrun.org.uk/torvean
2023-01-01	Tyne Green junior parkrun	United Kingdom	New Year's Day *	https://www.parkrun.org.uk/tynegreen-juniors
2022-12-31	Tøyen parkrun	Norway	Thick slippy ice on course - unsafe without spikes	https://www.parkrun.no/toyen
2022-12-31	Umfolozi parkrun	South Africa	Venue not available	https://www.parkrun.co.za/umfolozi
2023-01-01	Uppermill junior parkrun	United Kingdom	it's New Year's Day! Enjoy the lie in.	https://www.parkrun.org.uk/uppermill-juniors
2022-12-31	Urayasushi sogo koen parkrun	Japan	ボランティア都合のため	https://www.parkrun.jp/urayasushisogokoen
2022-12-31	Ury Riverside parkrun	United Kingdom	route unsafe due to ice and flooding.	https://www.parkrun.org.uk/uryriverside
2023-01-01	Verulamium junior parkrun	United Kingdom	No RDs available	https://www.parkrun.org.uk/verulamium-juniors
2023-01-01	Vicarstown junior parkrun	Ireland	Volunteers/runners taking a break for New Year	https://www.parkrun.ie/vicarstown-juniors
2023-01-01	Victoria junior parkrun, Glasgow	United Kingdom	New Year’s Day	https://www.parkrun.org.uk/victoria-juniors
2023-01-01	Victoria junior parkrun, Macclesfield	United Kingdom	Core team not available	https://www.parkrun.org.uk/victoriamacclesfield-juniors
2023-01-01	Victoria junior parkrun, St Helens	United Kingdom	To kindly allow the 5k event to go ahead.	https://www.parkrun.org.uk/victoriasthelens-juniors
2023-01-01	Wakefield Thornes junior parkrun	United Kingdom	New Year's Day *	https://www.parkrun.org.uk/wakefieldthornes-juniors
2022-12-31	Walton parkrun	United Kingdom	No staff in work that day	
2023-01-01	War Memorial Park junior parkrun	United Kingdom	New Year's Day	https://www.parkrun.org.uk/warmemorialpark-juniors
2023-01-01	Wardown junior parkrun	United Kingdom	New Years Day - Public holiday	https://www.parkrun.org.uk/wardown-juniors
2023-01-01	Warrington junior parkrun	United Kingdom	Host facility closed; no access to AED / Equipment	https://www.parkrun.org.uk/warrington-juniors
2022-12-31	Warwick Racecourse parkrun	United Kingdom	New Year's Eve Raceday at Warwick Racecourse	https://www.parkrun.org.uk/warwickracecourse
2023-01-01	Waterlooville junior parkrun	United Kingdom	No Core team available	https://www.parkrun.org.uk/waterlooville-juniors
2023-01-01	Watermead Country Park junior parkrun	United Kingdom	Core Team decision to not hold an event.	https://www.parkrun.org.uk/watermeadcountrypark-juniors
2023-01-01	Waterworks junior parkrun	United Kingdom	New Year's Day *	https://www.parkrun.org.uk/waterworks-juniors
2023-01-01	Wednesfield junior parkrun	United Kingdom	Volunteer consensus	https://www.parkrun.org.uk/wednesfield-juniors
2022-12-31	Weltevrede Wine Estate parkrun	South Africa	New Years eve. No volunteers Available	https://www.parkrun.co.za/weltevredewineestate
2022-12-31	Werribee Park Mansion parkrun	Australia	Damage to course	https://www.parkrun.com.au/werribeeparkmansion
2023-01-01	Weston-super-Mare junior parkrun	United Kingdom	No RDs available	https://www.parkrun.org.uk/westonsupermare-juniors
2023-01-01	Westside Playing Fields junior parkrun	Ireland	New Year's Day *	https://www.parkrun.ie/westsideplayingfields-juniors
2023-01-01	Weymouth junior parkrun	United Kingdom	New years day - try a 5k instead!	https://www.parkrun.org.uk/weymouth-juniors
2023-01-01	Whaley Bridge junior parkrun	United Kingdom	New Year's Day *	https://www.parkrun.org.uk/whaleybridge-juniors
2023-01-01	Whitelands Farm junior parkrun	United Kingdom	New Year's day - core team unavailable	https://www.parkrun.org.uk/whitelandsfarm-juniors
2022-12-31	Whiteley parkrun	United Kingdom	Council works in park, key paths unusable	https://www.parkrun.org.uk/whiteley
2023-01-01	Whitley Bay junior parkrun	United Kingdom	New Year’s Day; no event	https://www.parkrun.org.uk/whitleybay-juniors
2023-01-01	Whitstable junior parkrun	United Kingdom	New Years Day	https://www.parkrun.org.uk/whitstable-juniors
2023-01-01	Wicksteed junior parkrun	United Kingdom	5k event running on New Years Day this year	https://www.parkrun.org.uk/wicksteed-juniors
2023-01-01	Widnes junior parkrun	United Kingdom	Adult Is taking place at the same time	https://www.parkrun.org.uk/widnes-juniors
2023-01-01	Wilmslow junior parkrun	United Kingdom	Wilmslow parkrun 5k taking place	https://www.parkrun.org.uk/wilmslow-juniors
2023-01-01	Wilton Park junior parkrun	United Kingdom	New Year's Day - volunteers not around	https://www.parkrun.org.uk/wiltonpark-juniors
2023-01-01	Wimbledon Park junior parkrun	United Kingdom	Volunteers’ day off.	https://www.parkrun.org.uk/wimbledonpark-juniors
2023-01-01	Wimpole Estate junior parkrun	United Kingdom	New Year’s Day	https://www.parkrun.org.uk/wimpoleestate-juniors
2023-01-01	Winchester junior parkrun	United Kingdom	New Year's Day 5k parkrun event taking place	https://www.parkrun.org.uk/winchester-juniors
2022-12-31	Windhoek parkrun	South Africa	Core volunteers unavailable	https://www.parkrun.co.za/windhoek
2023-01-01	Windmill Hill junior parkrun	United Kingdom	No Run Directors	https://www.parkrun.org.uk/windmillhill-juniors
2023-01-01	Wisbech junior parkrun	United Kingdom	Lots of our regular volunteers are unavailable or	https://www.parkrun.org.uk/wisbech-juniors
2022-12-31	Wits parkrun	South Africa	The University grounds will be closed	https://www.parkrun.co.za/wits
2023-01-01	Woking junior parkrun	United Kingdom	Core team and defibrillator unavailable	https://www.parkrun.org.uk/woking-juniors
2023-01-01	Wood Green junior parkrun	United Kingdom	New Years Day - school site closed	https://www.parkrun.org.uk/woodgreen-juniors
2023-01-01	Woodley junior parkrun	United Kingdom	No run directors available	https://www.parkrun.org.uk/woodley-juniors
2023-01-01	Worden Park junior parkrun	United Kingdom	New Year’s Day core team busy	https://www.parkrun.org.uk/wordenpark-juniors
2023-01-01	Worksop College junior parkrun	United Kingdom	Site closed	https://www.parkrun.org.uk/worksopcollege-juniors
2023-01-01	Worthing Leisure Centre junior parkrun	United Kingdom	Volunteers away on New Years Day	https://www.parkrun.org.uk/worthingleisurecentre-juniors
2023-01-01	Wotton Community PARC junior parkrun	United Kingdom	New Year's Day *	https://www.parkrun.org.uk/wottoncommunityparc-juniors
2023-01-01	Wycombe Rye junior parkrun	United Kingdom	New Year's Day	https://www.parkrun.org.uk/wycomberye-juniors
2023-01-01	Wyndham junior parkrun	United Kingdom	No New Year's Day event	https://www.parkrun.org.uk/wyndham-juniors
2023-01-01	Wyre Forest junior parkrun	United Kingdom	New Year's Day *	https://www.parkrun.org.uk/wyreforest-juniors
2023-01-01	Yatton Recreation junior parkrun	United Kingdom	New Year's Day *	https://www.parkrun.org.uk/yattonrecreation-juniors
2023-01-01	Yeovil Rec junior parkrun	United Kingdom	No RD available	https://www.parkrun.org.uk/yeovilrec-juniors
2022-12-31	Yuuka Family Road parkrun	Japan	ボランティア不足のため	https://www.parkrun.jp/yuukafamilyroad
2022-12-31	Zuiderpark parkrun	Netherlands	Evenementleiders op vakantie!	https://www.parkrun.co.nl/zuiderpark
2022-12-31	parkrun Las Łagiewnicki	Poland	Trasa zajęta przez Bieg Sylwestrowy	https://www.parkrun.pl/laslagiewnicki
2022-12-31	parkrun de Fontainebleau	France	parkrun est actuellement suspendu en France	https://www.parkrun.fr/fontainebleau
2022-12-31	parkrun de Montsouris	France	parkrun est actuellement suspendu en France	https://www.parkrun.fr/montsouris
2022-12-31	parkrun de Rouen	France	parkrun est actuellement suspendu en France	https://www.parkrun.fr/rouen
2022-12-31	parkrun de la Ramée	France	parkrun est actuellement suspendu en France	https://www.parkrun.fr/laramee
2022-12-31	parkrun des Dougnes, Cubnezais	France	parkrun est actuellement suspendu en France	https://www.parkrun.fr/lesdougnes
2022-12-31	parkrun du Bois de Boulogne, Paris	France	parkrun est actuellement suspendu en France	https://www.parkrun.fr/boisdeboulogne
2022-12-31	parkrun du Château de Pierre de Bresse	France	parkrun est actuellement suspendu en France	https://www.parkrun.fr/chateaudepierredebresse
2022-12-31	parkrun du Lac de Divonne	France	parkrun est actuellement suspendu en France	https://www.parkrun.fr/lacdedivonne
