Date	Event	Country	Cancellation Note	Website
2022-02-12	Ashburton parkrun	South Africa	Crash at Ashburton N3 closed	https://www.parkrun.co.za/ashburton
2022-02-12	Omeya parkrun	South Africa	Course damaged due to rainfall	https://www.parkrun.co.za/omeya
2022-02-12	Outlook and District Regional parkrun	Canada	unsafe trail conditions	https://www.parkrun.ca/outlookanddistrictregional
2022-02-12	parkrun Kolchugino City Park	Russia	По просьбе руководства стадиона, соревнования	https://www.parkrun.ru/kolchuginocitypark
2022-02-12 06:16:25.027638			
