Event	Country
Abbey Park parkrun	United Kingdom
Caledon Golf Course parkrun	South Africa
Eastern Trail parkrun, Biddeford	United States
Havelkanal parkrun	Germany
Hutton Recreation Ground junior parkrun	United Kingdom
King GeorgeV Playing Field junior parkrun, MillEnd	United Kingdom
Moreletapark Gemeente parkrun	South Africa
Park Hill Recreation Ground junior parkrun	United Kingdom
Salisbury Field junior parkrun	United Kingdom
Stadtpark parkrun	Germany
The Old Rail Trail junior parkrun	Ireland
Yackandandah Rail Trail parkrun	Australia
parkrun Błonie, Krotoszyn	Poland
