Event	Country	Cancellation Note	Website	Added or Removed
Fulham Palace parkrun	United Kingdom	Thames Path Challenge taking place in the park.	https://www.parkrun.org.uk/fulhampalace	Added
Knockanacree Woods parkrun	Ireland	Tree down on course.	https://www.parkrun.ie/knockanacreewoods	Added
Nagaragawa koen parkrun	Japan	緊急事態宣言継続中の為、中止します。	https://www.parkrun.jp/nagaragawakoen	Added
Old Deer Park parkrun	United Kingdom	Richmond Runfest in park; A and B courses blocked	https://www.parkrun.org.uk/olddeerpark	Added
2021-09-07 00:47:09.249431				
