Event	Country	Cancellation Note	Website	Added or<br />Removed
Fukakitaryokuchi parkrun	Japan	昨日の大雨で治水緑地である深北緑地公園に寝屋川の水が越流し、その水がまだ引いておらず、コースが水没し	https://www.parkrun.jp/fukakitaryokuchi	Added
Inverell parkrun	Australia	River broken banks, water covering path.	https://www.parkrun.com.au/inverell	Added
Kennington Reservoir parkrun	Australia	parks victoria permits not in place -advised by HO	https://www.parkrun.com.au/kenningtonreservoir	Added
White Rock parkrun	Australia	Sufficient volunteers	https://www.parkrun.com.au/whiterock	Added
2021-07-09 12:31:35.103400				
