Event	Country	Cancellation Note	Website	Added or<br />Removed
Hackworth parkrun	United Kingdom	The Little Big Meeting is being held in the park.	https://www.parkrun.org.uk/hackworth	Added
Kingston parkrun	United Kingdom	Another event on the course	https://www.parkrun.org.uk/kingston	Added
Lota parkrun	Australia	Qld Covid restrictions Brisbane area.	https://www.parkrun.com.au/lota	Added
Maborikaigan yuhodo parkrun	Japan	緊急事態宣言発出のため　State of Emergency	https://www.parkrun.jp/maborikaiganyuhodo	Added
Sanukikodomonokuni parkrun	Japan	新型コロナウィルス感染症拡大防止のため	https://www.parkrun.jp/sanukikodomonokuni	Added
2021-08-02 12:14:33.683613				
