Event	Country	Cancellation Note	Added or<br />Removed
Albert parkrun, Melbourne	Australia	COVID restrictions	Removed
Alberton Ascot parkrun	Australia	COVID Restrictions in place	Removed
Altona Beach parkrun	Australia	COVID restrictions still in place	Removed
Amager Fælled parkrun	Denmark	COVID-19 (Coronavirus)	Removed
Amager Strandpark parkrun	Denmark	COVID-19 (Coronavirus)	Removed
Ararat parkrun	Australia	Due to covid restrictions	Removed
Aspen parkrun	United States	COVID-19 (Coronavirus)	Removed
Aurora parkrun	Australia	Victoria restrictions on public gatherings	Removed
Bairnsdale parkrun	Australia	COVID restrictions still in place	Removed
Ballarat parkrun	Australia	Victoria 7 Day Circuit Breaker Lockdown 3rd week	Removed
Balyang Sanctuary parkrun	Australia	Victoria Government Current Covid Restrictions	Removed
Bambra Bolinda parkrun	Australia	COVID Restrictions in place	Removed
Bannockburn Bush parkrun	Australia	Covid restrictions Victoria State govt	Removed
Bellevue Park junior parkrun	Australia	back next week!	Removed
Benalla Botanical Gardens parkrun	Australia	Victorian Lockdown laws eff 11 June 2021	Removed
Bendigo Botanic Gardens parkrun	Australia	COVID restrictions	Removed
Berwick Springs parkrun	Australia	Victoria 7 Day Circuit Breaker Lockdown	Removed
Berwick Waters parkrun	Australia	Lockdown	Removed
Birdsland Reserve parkrun	Australia	Victorian Lockdown restrictions still apply	Removed
Brabrand parkrun	Denmark	COVID-19 (Coronavirus)	Removed
Braidwood Showground parkrun	Australia	Ground too wet & unsafe.	Removed
Bright parkrun	Australia	Responsible Safety precautions Covid associated.	Removed
Brimbank parkrun	Australia	Covid19 restrictions still in place	Removed
Campaspe parkrun	Australia	Victorian COVID-19 restrictions	Removed
Cascades on Clyde Wetlands parkrun	Australia	Victoria lockdown	Removed
Castlemaine parkrun	Australia	Victorian Covid-19 restrictions	Removed
Chelsea Bicentennial parkrun	Australia	COVID restrictions still in place	Removed
Churchill parkrun	Australia	COVID restrictions still in place	Removed
Cobaw Clunes parkrun	Australia	COVID Restrictions in place	Removed
Cobram parkrun	Australia	Victorian lockdown	Removed
Coburg parkrun	Australia	Victoria Lockdown restrictions	Removed
Cohuna parkrun	Australia	COVD Restrictions in force	Removed
Comber junior parkrun	United Kingdom	COVID-19 (Coronavirus)	Removed
Cradock parkrun	South Africa	COVID-19 (Coronavirus)	Removed
Dandenong parkrun	Australia	Victoria Circuit Breaker Lockdown	Removed
Darebin parkrun	Australia	COVID restrictions	Removed
Darwin parkrun	Australia	Greek Glenti Festival in the park	Removed
Depot Park parkrun	United States	event conflict, Freedom Walk; key paths unusable	Added
Dhurringile parkrun	Australia	COVID restrictions still in place	Removed
Diamond Creek parkrun	Australia	Current lockdown restrictions do not permit parkru	Removed
Doornhoek Farm parkrun	South Africa	Thabazimbi Covid hotspot	Removed
Durham City junior parkrun	United Kingdom	Durham Regatta - cars parked on riverbanks	Removed
Eastbourne junior parkrun	United Kingdom	Eastbourne 10km on the Prom we use	Added
Eastern Gardens parkrun	Australia	Due to a Victorian State COVID-19 restrictions.	Removed
Echuca Moama parkrun	Australia	COVID restriction - public gathering limits	Removed
Esbjerg parkrun	Denmark	COVID-19 (Coronavirus)	Removed
Euroa parkrun	Australia	Covid regulations	Removed
Eynesbury Heritage Trail junior parkrun	Australia	Victorian COVID-19 restrictions	Removed
Fairpark Reserve parkrun	Australia	VICTORIAN COVID LOCKDOWN EXTENSION	Removed
Faversham Recreation Ground junior parkrun	United Kingdom	Funfair in the park obstructing run route	Removed
Frog Hollow parkrun	Australia	COVID19 Lockdown as directed by Vic DHHS	Removed
Gardiners Creek parkrun	Australia	COVID 19 Public gathering restrictions in Victoria	Removed
Goldfields Reservoir parkrun	Australia	COVID Restrictions	Removed
Grahamstown parkrun	South Africa	Will only be starting Grahamstown Parkrun 19/6/21	Removed
Grand Ridge Rail Trail parkrun, Mirboo North	Australia	COVID restrictions still in place	Removed
Grey Goose parkrun	South Africa	COVID-19 (Coronavirus)	Removed
Guildford junior parkrun	United Kingdom	Event at Stoke Park	Added
Hamilton parkrun	Australia	COVID restrictions still in place	Removed
Hastings Foreshore parkrun	Australia	Victorian circuit breaker Lockdown	Removed
Heritage Harbor parkrun, Ottawa	United States	COVID-19 (Coronavirus)	Removed
Highlands parkrun	Australia	COVID restrictions still in place	Removed
Hopkins parkrun	Australia	Victorian Covid Shutdown.	Removed
Inverell parkrun	Australia	Path covered by river from recent rains.	Removed
Inverloch parkrun	Australia	Covid lockdown restrictions Victoria	Removed
Jacks Road junior parkrun	United Kingdom	COVID-19 (Coronavirus)	Removed
Jells parkrun	Australia	Victoria 7 Day Circuit Breaker Lockdown week 3	Removed
KM Reedy Reserve parkrun	Australia	Victorian lockdown restrictions	Removed
Karkarook parkrun	Australia	Victorian COVID Restrictions	Removed
Kathu parkrun	South Africa	Cancelled due to another event take place	Removed
Kennington Reservoir parkrun	Australia	covid lockdown - victorian government directive	Removed
Kerang Regional parkrun	Australia	Victoria COVID restrictions	Removed
Komani parkrun	South Africa	COVID-19 (Coronavirus)	Removed
Koonwarra parkrun	Australia	Co-vid restrictions, public gatherings only at 20!	Removed
Lake Boga Foreshore parkrun	Australia	Ongoing Victorian restrictions	Removed
Lakes Entrance parkrun	Australia	Victoria lockdown restrictions	Removed
Lalor parkrun	Australia	Due to limited gatherings .Victoria covid measures	Removed
Lancefield parkrun	Australia	COVID restrictions still in place	Removed
Lillydale Lake parkrun	Australia	not permitted under current COVID restrictions	Removed
Loch Leven junior parkrun	United Kingdom	COVID-19 (Coronavirus)	Removed
Logan River parkrun	Australia	Logan City Council doing works - path closed	Removed
Lorne Beach parkrun	Australia	Victorian Government COVID restrictions.	Removed
Louis Hamon Park parkrun	Australia	Victoria lockdown continued for week 3	Removed
Mansfield Botanic parkrun	Australia	Covid-19 restrictions	Removed
Maribyrnong parkrun	Australia	COVID-19 restrictions for Metro Melbourne	Removed
Marriott Waters parkrun	Australia	Victoria cricut breaker lockdown	Removed
Mernda parkrun	Australia	COVID restrictions	Removed
Mildura Weir parkrun	Australia	Covid Restrictions	Removed
Moira junior parkrun	United Kingdom	COVID-19 (Coronavirus)	Removed
Moree parkrun	Australia	COVID-19 Hotspots Identified in Moree	Removed
Mount Beauty parkrun	Australia	Covid state lockdown	Removed
Mullum Mullum parkrun	Australia	Melbourne lockdown	Removed
Nagaragawa koen parkrun	Japan	緊急事態宣言中のため	Removed
Newborough parkrun	Australia	COVID 19 Restrictions	Removed
Newport Lakes parkrun	Australia	Victoria C-19 lockdown continues :(	Removed
Nhill parkrun	Australia	COVID restrictions still in place	Removed
Nibe parkrun	Denmark	COVID-19 (Coronavirus)	Removed
Nordre Fælled parkrun, Randers	Denmark	COVID-19 (Coronavirus)	Removed
Ocean Grove parkrun	Australia	Victorian COVID restrictions	Removed
Ovens River Trail parkrun	Australia	Covid restrictions limit = 20 in outdoor gathering	Removed
Oyodogawa shiminryokuchi parkrun	Japan	雷雨予報	Removed
Pakenham parkrun	Australia	COVID-19 Lockdown	Removed
Parkville parkrun	Australia	No parkrun Sat 12 June due to Covid restrictions.	Removed
Peppertree parkrun	Australia	Covid Restrictions Victorian Government	Removed
Perth junior parkrun	United Kingdom	COVID-19 (Coronavirus)	Removed
Phillip Island parkrun	Australia	public gathering limits under state restrictions	Removed
Point Cook parkrun	Australia	Vic GovLockdown Gathering Limit Restrictions	Removed
Pontefract junior parkrun	United Kingdom	Horse racing on; key paths unusable.	Added
Port Fairy parkrun	Australia	Covid Lockdown Victoria	Removed
Port Macquarie parkrun	Australia	Ride The Wave Event impacting our course	Added
Portarlington parkrun	Australia	Victoria COVID-19 lockdown limits on gatherings	Removed
Portland parkrun	Australia	Due to Government COVID restrictions	Removed
Puckapunyal parkrun	Australia	Lock down restrictions	Removed
Rosebud parkrun	Australia	COVID restrictions still in place	Removed
Sale parkrun	Australia	Continued restrictions following lockdown in Vic	Removed
Shepparton parkrun	Australia	Victoria's Covid restrictions on groups	Removed
Shimanami Earthland parkrun	Japan	ボランティア不足のため	Removed
Studley parkrun	Australia	Covid-19 restrictions	Removed
Sunbury parkrun	Australia	Victoria covid restrictions	Removed
Tarrengower parkrun	Australia	COVID restrictions still in place	Removed
Timboon parkrun	Australia	Victoria 7 Day Circuit Breaker Lockdown extension	Removed
Toolern Creek parkrun	Australia	Victoria 7 Day Circuit Breaker Lockdown	Removed
Torquay parkrun	Australia	COVID-19	Removed
Traralgon parkrun	Australia	COVID restrictions still in place	Removed
Vejen parkrun	Denmark	COVID-19 (Coronavirus)	Removed
Ventersburg parkrun	South Africa	COVID-19 (Coronavirus)	Removed
Verulamium junior parkrun	United Kingdom	St Albans Half Marathon in park, course in use	Removed
Wallaby Track parkrun	Australia	Victorian COVID restrictions	Removed
Wangaratta parkrun	Australia	Continued Victorian limits on gatherings of 20	Removed
Warragul parkrun	Australia	Covid snap lockdown	Removed
Warringal Parklands parkrun	Australia	Victorian Lockdown	Removed
Warrnambool parkrun	Australia	Victoria Government ongoing restrictions	Removed
Westerfolds junior parkrun	Australia	COVID restrictions still in place	Removed
Westerfolds parkrun	Australia	Victorian Government announcement	Removed
Weymouth junior parkrun	United Kingdom	Weymouth Half Marathon will be using Lodmoor Park	Removed
Willow parkrun	Australia	Covid restrictions	Removed
Wilson Botanic parkrun	Australia	Victorian Government restrictions due to Covid-19	Removed
Wimmera River parkrun, Horsham	Australia	COVID Restrictions	Removed
Wyndham Vale parkrun	Australia	As a Tier 3 approved event, we are governed by the	Removed
Yodogawa kasenkoen Hirakata chiku parkrun	Japan	緊急事態宣言により外出自粛のため	Removed
You Yangs parkrun	Australia	COVID public gathering restrictions	Removed
Yuuka Family Road parkrun	Japan	まん延防止等措置のため	Removed
parkrun Angarskie Prudy	Russia	В связи с ростом заболеваемости COVID-19 в Москве	Removed
parkrun Babushkinsky na Yauze	Russia	В связи с ростом заболеваемости COVID-19 в Москве	Removed
parkrun Bitsa	Russia	В связи с ростом заболеваемости COVID-19 в Москве	Removed
parkrun Butovo	Russia	В связи с ростом заболеваемости COVID-19 в Москве	Removed
parkrun Chertanovo Pokrovsky Park	Russia	В связи с ростом заболеваемости COVID-19 в Москве	Removed
parkrun Druzhba	Russia	В связи с ростом заболеваемости COVID-19 в Москве	Removed
parkrun Filatov Lug	Russia	"В связи с ростом заболеваемости COVID-19"""	Removed
parkrun Fili	Russia	Подробности читайте на странице новостей.	Removed
parkrun Gatchina Prioratsky	Russia	Другое мероприятие в парке	Removed
parkrun Gorky Park	Russia	В связи с ростом заболеваемости COVID-19 в Москве	Removed
parkrun Izmailovo	Russia	В связи с ростом заболеваемости COVID-19 в Москве	Removed
parkrun Jezioro Górne, Kętrzyn	Poland	Prace drogowe na większości naszej trasie	Removed
parkrun Kimry	Russia	Строительные работы на трассе.	Removed
parkrun Kolchugino City Park	Russia	Отсутствие волонтеров	Removed
parkrun Kolomenskoe	Russia	В связи с ростом заболеваемости COVID-19 в Москве	Removed
parkrun Krylatskoe	Russia	В связи с ростом заболеваемости COVID-19 в Москве	Removed
parkrun Kuzminki	Russia	В связи с ростом заболеваемости COVID-19 в Москве	Removed
parkrun Mikhalkovo	Russia	В связи с ростом заболеваемости COVID-19 в Москве	Removed
parkrun Mitino	Russia	В связи с ростом заболеваемости COVID-19 в Москве	Removed
parkrun Olimpiyskaya Derevnya	Russia	COVID-19 (Coronavirus)	Added
parkrun Olimpiyskaya Derevnya	Russia	В связи с ростом заболеваемости COVID-19 в Москве	Removed
parkrun Pokrovskoe-Streshnevo	Russia	В связи с ростом заболеваемости COVID-19 в Москве	Removed
parkrun Puszcza Niepołomicka	Poland	COVID-19 (Coronavirus)	Removed
parkrun Severnoe Tushino	Russia	В связи с ростом заболеваемости COVID-19 в Москве	Removed
parkrun Severny Rechnoy Vokzal	Russia	В связи с ростом заболеваемости COVID-19 в Москве	Removed
parkrun Sokolniki	Russia	В связи с ростом заболеваемости COVID-19 в Москве	Removed
parkrun Szczecinek	Poland	Spotkania odwołane w związku ze zmianą zespołu.	Removed
parkrun Timiryazevsky	Russia	В связи с ростом заболеваемости COVID-19 в Москве	Removed
parkrun Tsaritsyno	Russia	В связи с ростом заболеваемости COVID-19 в Москве	Removed
parkrun Vernadskogo	Russia	В связи с ростом заболеваемости COVID-19 в Москве	Removed
parkrun Voronezh Central Park	Russia	"Festive events ""Day of Russia"""	Removed
parkrun Zelenograd	Russia	В связи с ростом заболеваемости COVID-19 в Москве	Removed
parkrun park 850-letiya Moskvy	Russia	В связи с ростом заболеваемости COVID-19 в Москве	Removed
2021-06-14 00:57:01.411261		
