Event	Country	Cancellation Note	Website	Added or Removed
Medway junior parkrun	United Kingdom	Broken tree on course.	https://www.parkrun.org.uk/medway-juniors	Added
Ormeau junior parkrun	United Kingdom	Belfast City Marathon	https://www.parkrun.org.uk/ormeau-juniors	Added
Paddington Rec junior parkrun	United Kingdom	Event in Park	https://www.parkrun.org.uk/paddingtonrec-juniors	Added
parkrun Wolbrom	Poland	Poszukujemy zespołu do prowadzenia spotkań parkrun	https://www.parkrun.pl/wolbrom	Added
2021-10-03 08:10:59.903740				
