Event	Country	Cancellation Note	Website
Belfast Victoria junior parkrun	United Kingdom	Another event taking place	https://www.parkrun.org.uk/belfastvictoria-juniors
Boston Road Rec junior parkrun	United Kingdom	Circus at the recreation ground	https://www.parkrun.org.uk/bostonroadrec-juniors
Burswood Peninsula parkrun	Australia	The WAFL Grand Final	https://www.parkrun.com.au/burswoodpeninsula
Bushy junior parkrun	United Kingdom	Rutting Stags across the course	https://www.parkrun.org.uk/bushy-juniors
Carlisle parkrun	United Kingdom	Wedding at Morton Manor	https://www.parkrun.org.uk/carlisle
Clapham Common parkrun	United Kingdom	Pretty Muddy/Race for life on the course	https://www.parkrun.org.uk/claphamcommon
Cowra parkrun	Australia	Covid restrictions	https://www.parkrun.com.au/cowra
Crystal Palace junior parkrun	United Kingdom	Race 4 Life occupying both our routes	https://www.parkrun.org.uk/crystalpalace-juniors
Helix junior parkrun	United Kingdom	Pedal for Falkirk taking place, paths unusable	https://www.parkrun.org.uk/helix-juniors
Leazes parkrun	United Kingdom	Music festival; parts of route inaccessible	https://www.parkrun.org.uk/leazes
Lorne Beach parkrun	Australia	melb lockdown	https://www.parkrun.com.au/lornebeach
Malling parkrun	United Kingdom	Flood prevention works + path improvements	https://www.parkrun.org.uk/malling
Milnrow Memorial Park junior parkrun	United Kingdom	Not enough volunteers due to the Rochdale run	https://www.parkrun.org.uk/milnrowmemorialpark-juniors
Oiso undokoen parkrun	Japan	ディレクターが確保できないため。	https://www.parkrun.jp/oisoundokoen
Oriam parkrun	United Kingdom	Another event will be using part of parkrun course	https://www.parkrun.org.uk/oriam
Oyodogawa shiminryokuchi parkrun	Japan	公園での別のイベント	https://www.parkrun.jp/oyodogawashiminryokuchi
Park Wood junior parkrun	United Kingdom	No Run directors available	https://www.parkrun.org.uk/parkwood-juniors
Sedgefield junior parkrun	United Kingdom	No Run Directors available	https://www.parkrun.org.uk/sedgefield-juniors
Shrewsbury parkrun	United Kingdom	Oktoberfest Event in the park,traffic on our route	https://www.parkrun.org.uk/shrewsbury
Snye Point parkrun	Canada	conflict of dates/local event: Birchwood Bender	https://www.parkrun.ca/snyepoint
Stonehouse junior parkrun	United Kingdom	Shortage of Run Directors	https://www.parkrun.org.uk/stonehouse-juniors
The Waterfront junior parkrun	United Kingdom	Jersey Marathon and Mile	https://www.parkrun.org.uk/thewaterfront-juniors
Victoria Dock parkrun	United Kingdom	London Marathon - safety	https://www.parkrun.org.uk/victoriadock
Waterworks junior parkrun	United Kingdom	Belfast Marathon going through park.	https://www.parkrun.org.uk/waterworks-juniors
2021-09-27 00:50:19.482695			
